,AlertAlarmDateTime,SnapshotUrl,TimeZoneAbreviation,UtcOffsetMinutes,adjustedvalue,alertalarmtype,algorithm,description,eventdatetime,isalarm,isalert,isreset,lastvalue,maxalarmthresholdvalue,maxwarningthresholdvalue,metricName,metricNameChinese,metricid,metrickey,metricshortname,metrictype,minalarmthresholdvalue,minwarningthresholdvalue,path,serialnumber,targetvalue,timezone
0,,,,,3,Device,,,1/10/2023 10:57:06 AM -08:00,True,False,False,1.0,,,,,,SYS_ALM,SystemAlertAlarm,,,,AlertAlarm/2301Q65746/2023,2301Q65746,,America/Los_Angeles
1,2023-01-10T19:22:00,,,0.0,3,Device,,System Alert /Alarm,Jan 10 2023  7:22PM,False,False,True,,,,,,,SYS_ALM,SystemAlertAlarm,,,,AlertAlarm/2301Q65746/2023,2301Q65746,,America/Los_Angeles
2,2023-03-06T12:15:00,,,0.0,3,Device,,System Alert /Alarm,Mar  6 2023 12:15PM,False,False,True,,,,,,,SYS_ALM,SystemAlertAlarm,,,,AlertAlarm/2301Q65746/2023,2301Q65746,,America/Los_Angeles
3,2023-03-14T21:09:00,,,0.0,3,Device,,System Alert /Alarm,Mar 14 2023  9:09PM,False,False,True,,,,,,,SYS_ALM,SystemAlertAlarm,,,,AlertAlarm/2301Q65746/2023,2301Q65746,,America/Los_Angeles
4,2023-03-14T20:08:00,https://alarmssaveandnotifyprod.blob.core.windows.net/snapshot/vu210550150310_1/2023/3/15/2/41/VU210550150310_1_1678824492,,0.0,143,Device,,AUTORESTART PENDING-LINE PHASE LOSS,Mar 14 2023  8:08PM,False,True,False,,,,,,,ALARM_01,CH_ALARM_01,,,,AlertAlarm/2301Q65746/2023,2301Q65746,,America/Los_Angeles
5,2023-03-14T20:08:00,https://alarmssaveandnotifyprod.blob.core.windows.net/snapshot/vu210550150310_1/2023/3/15/2/41/VU210550150310_1_1678824492,,0.0,229,Device,,PROTECTIVE LIMIT-LOW CHILLED WATER  FLOW,Mar 14 2023  8:08PM,True,False,False,,,,,,,ALARM_02,CH_ALARM_02,,,,AlertAlarm/2301Q65746/2023,2301Q65746,,America/Los_Angeles
6,2023-03-14T20:24:00,,,0.0,229,Device,,PROTECTIVE LIMIT-LOW CHILLED WATER  FLOW,Mar 14 2023  8:24PM,True,False,True,,,,,,,ALARM_02,CH_ALARM_02,,,,AlertAlarm/2301Q65746/2023,2301Q65746,,America/Los_Angeles
7,2023-03-14T21:09:00,,,0.0,143,Device,,AUTORESTART PENDING-LINE PHASE LOSS,Mar 14 2023  9:09PM,False,True,True,,,,,,,ALARM_01,CH_ALARM_01,,,,AlertAlarm/2301Q65746/2023,2301Q65746,,America/Los_Angeles
8,2023-03-21T17:26:00,,,0.0,3,Device,,System Alert /Alarm,Mar 21 2023  5:26PM,False,False,True,,,,,,,SYS_ALM,SystemAlertAlarm,,,,AlertAlarm/2301Q65746/2023,2301Q65746,,America/Los_Angeles
9,2023-03-21T17:26:00,,,0.0,229,Device,,PROTECTIVE LIMIT-LOW CHILLED WATER  FLOW,Mar 21 2023  5:26PM,True,False,True,,,,,,,ALARM_03,CH_ALARM_03,,,,AlertAlarm/2301Q65746/2023,2301Q65746,,America/Los_Angeles
10,2023-03-27T04:55:00,,,0.0,3,Device,,System Alert /Alarm,Mar 27 2023  4:55AM,False,False,True,,,,,,,SYS_ALM,SystemAlertAlarm,,,,AlertAlarm/2301Q65746/2023,2301Q65746,,America/Los_Angeles
11,2023-03-27T03:20:00,,,0.0,166,Device,,HIGH DC BUS VOLTAGE,Mar 27 2023  3:20AM,False,True,True,,,,,,,ALARM_02,CH_ALARM_02,,,,AlertAlarm/2301Q65746/2023,2301Q65746,,America/Los_Angeles
12,2023-04-25T02:05:00,,,0.0,229,Device,,PROTECTIVE LIMIT-LOW CHILLED WATER  FLOW,Apr 25 2023  2:05AM,True,False,True,,,,,,,ALARM_02,CH_ALARM_02,,,,AlertAlarm/2301Q65746/2023,2301Q65746,,America/Los_Angeles
13,2023-04-25T02:05:00,https://alarmssaveandnotifyprod.blob.core.windows.net/snapshot/vu210550150310_1/2023/4/25/2/5/VU210550150310_1_1682388345,,0.0,143,Device,,AUTORESTART PENDING-LINE PHASE LOSS,Apr 25 2023  2:05AM,False,True,False,,,,,,,ALARM_01,CH_ALARM_01,,,,AlertAlarm/2301Q65746/2023,2301Q65746,,America/Los_Angeles
14,2023-04-25T12:22:00,,,0.0,143,Device,,AUTORESTART PENDING-LINE PHASE LOSS,Apr 25 2023 12:22PM,False,True,True,,,,,,,ALARM_01,CH_ALARM_01,,,,AlertAlarm/2301Q65746/2023,2301Q65746,,America/Los_Angeles
15,,,,,3,Device,,,4/25/2023 5:17:52 AM -07:00,True,False,False,1.0,,,,,,SYS_ALM,SystemAlertAlarm,,,,AlertAlarm/2301Q65746/2023,2301Q65746,,America/Los_Angeles
16,2023-05-01T10:31:00,,,0.0,3,Device,,System Alert /Alarm,May  1 2023 10:31AM,False,False,True,,,,,,,SYS_ALM,SystemAlertAlarm,,,,AlertAlarm/2301Q65746/2023,2301Q65746,,America/Los_Angeles
17,2023-05-01T10:31:00,https://alarmssaveandnotifyprod.blob.core.windows.net/snapshot/vu210550150310_1/2023/5/1/13/10/VU210550150310_1_1682937091,,0.0,143,Device,,AUTORESTART PENDING-LINE PHASE LOSS,May  1 2023 10:31AM,False,True,False,,,,,,,ALARM_01,CH_ALARM_01,,,,AlertAlarm/2301Q65746/2023,2301Q65746,,America/Los_Angeles
18,2023-06-20T20:49:00,,,0.0,143,Device,,AUTORESTART PENDING-LINE PHASE LOSS,Jun 20 2023  8:49PM,False,True,True,,,,,,,ALARM_01,CH_ALARM_01,,,,AlertAlarm/2301Q65746/2023,2301Q65746,,America/Los_Angeles
19,2023-06-20T20:49:00,https://alarmssaveandnotifyprod.blob.core.windows.net/snapshot/vu210550150310_1/2023/6/20/21/47/VU210550150310_1_1687294188,,0.0,123,Device,,RUN CAPACITY LIMITED-HIGH COMPRESSOR LIFT,Jun 20 2023  8:49PM,False,True,False,,,,,,,ALARM_01,CH_ALARM_01,,,,AlertAlarm/2301Q65746/2023,2301Q65746,,America/Los_Angeles
20,2023-06-20T21:03:00,,,0.0,123,Device,,RUN CAPACITY LIMITED-HIGH COMPRESSOR LIFT,Jun 20 2023  9:03PM,False,True,True,,,,,,,ALARM_01,CH_ALARM_01,,,,AlertAlarm/2301Q65746/2023,2301Q65746,,America/Los_Angeles
21,,,,,2,Device,,,6/20/2023 1:53:40 PM -07:00,False,True,False,1.0,,,,,,SYS_ALM,SystemAlertAlarm,,,,AlertAlarm/2301Q65746/2023,2301Q65746,,America/Los_Angeles
22,2023-06-23T07:10:00,,,0.0,2,Device,,System Alert /Alarm,Jun 23 2023  7:10AM,False,False,True,,,,,,,SYS_ALM,SystemAlertAlarm,,,,AlertAlarm/2301Q65746/2023,2301Q65746,,America/Los_Angeles
23,2023-06-23T07:10:00,https://alarmssaveandnotifyprod.blob.core.windows.net/snapshot/vu210550150310_1/2023/6/23/7/53/VU210550150310_1_1687504258,,0.0,123,Device,,RUN CAPACITY LIMITED-HIGH COMPRESSOR LIFT,Jun 23 2023  7:10AM,False,True,False,,,,,,,ALARM_01,CH_ALARM_01,,,,AlertAlarm/2301Q65746/2023,2301Q65746,,America/Los_Angeles
24,2023-06-23T07:10:00,https://alarmssaveandnotifyprod.blob.core.windows.net/snapshot/vu210550150310_1/2023/6/23/7/53/VU210550150310_1_1687504258,,0.0,229,Device,,PROTECTIVE LIMIT-LOW CHILLED WATER  FLOW,Jun 23 2023  7:10AM,True,False,False,,,,,,,ALARM_02,CH_ALARM_02,,,,AlertAlarm/2301Q65746/2023,2301Q65746,,America/Los_Angeles
25,,,,,3,Device,,,6/23/2023 12:13:50 AM -07:00,True,False,False,1.0,,,,,,SYS_ALM,SystemAlertAlarm,,,,AlertAlarm/2301Q65746/2023,2301Q65746,,America/Los_Angeles
26,2023-06-23T13:00:00,,,0.0,123,Device,,RUN CAPACITY LIMITED-HIGH COMPRESSOR LIFT,Jun 23 2023  1:00PM,False,True,True,,,,,,,ALARM_01,CH_ALARM_01,,,,AlertAlarm/2301Q65746/2023,2301Q65746,,America/Los_Angeles
27,2023-06-23T13:00:00,,,0.0,3,Device,,System Alert /Alarm,Jun 23 2023  1:00PM,False,False,True,,,,,,,SYS_ALM,SystemAlertAlarm,,,,AlertAlarm/2301Q65746/2023,2301Q65746,,America/Los_Angeles
28,2023-06-23T13:00:00,,,0.0,229,Device,,PROTECTIVE LIMIT-LOW CHILLED WATER  FLOW,Jun 23 2023  1:00PM,True,False,True,,,,,,,ALARM_02,CH_ALARM_02,,,,AlertAlarm/2301Q65746/2023,2301Q65746,,America/Los_Angeles
29,2023-07-03T10:02:00,https://alarmssaveandnotifyprod.blob.core.windows.net/snapshot/vu210550150310_1/2023/7/3/10/2/VU210550150310_1_1688378530,,0.0,143,Device,,AUTORESTART PENDING-LINE PHASE LOSS,Jul  3 2023 10:02AM,False,True,False,,,,,,,ALARM_01,CH_ALARM_01,,,,AlertAlarm/2301Q65746/2023,2301Q65746,,America/Los_Angeles
30,2023-07-03T10:20:00,https://alarmssaveandnotifyprod.blob.core.windows.net/snapshot/vu210550150310_1/2023/7/3/10/20/VU210550150310_1_1688379627,,0.0,165,Device,,MACHINE ALERT-HIGH COND WATER FLOW,Jul  3 2023 10:20AM,False,True,False,,,,,,,ALARM_02,CH_ALARM_02,,,,AlertAlarm/2301Q65746/2023,2301Q65746,,America/Los_Angeles
31,2023-07-12T00:28:00,,,0.0,143,Device,,AUTORESTART PENDING-LINE PHASE LOSS,Jul 12 2023 12:28AM,False,True,True,,,,,,,ALARM_01,CH_ALARM_01,,,,AlertAlarm/2301Q65746/2023,2301Q65746,,America/Los_Angeles
32,2023-07-12T00:28:00,,,0.0,165,Device,,MACHINE ALERT-HIGH COND WATER FLOW,Jul 12 2023 12:28AM,False,True,True,,,,,,,ALARM_02,CH_ALARM_02,,,,AlertAlarm/2301Q65746/2023,2301Q65746,,America/Los_Angeles
33,,,,,3,Device,,,7/11/2023 5:23:39 PM -07:00,True,False,False,1.0,,,,,,SYS_ALM,SystemAlertAlarm,,,,AlertAlarm/2301Q65746/2023,2301Q65746,,America/Los_Angeles
34,,,,,3,Device,,,7/15/2023 7:03:56 AM -07:00,True,False,False,1.0,,,,,,SYS_ALM,SystemAlertAlarm,,,,AlertAlarm/2301Q65746/2023,2301Q65746,,America/Los_Angeles
35,2023-07-15T16:27:00,,,0.0,3,Device,,System Alert /Alarm,Jul 15 2023  4:27PM,False,False,True,,,,,,,SYS_ALM,SystemAlertAlarm,,,,AlertAlarm/2301Q65746/2023,2301Q65746,,America/Los_Angeles
36,2023-07-15T16:27:00,https://alarmssaveandnotifyprod.blob.core.windows.net/snapshot/vu210550150310_1/2023/7/15/16/27/VU210550150310_1_1689438460,,0.0,143,Device,,AUTORESTART PENDING-LINE PHASE LOSS,Jul 15 2023  4:27PM,False,True,False,,,,,,,ALARM_01,CH_ALARM_01,,,,AlertAlarm/2301Q65746/2023,2301Q65746,,America/Los_Angeles
37,2023-07-17T06:12:00,,,0.0,143,Device,,AUTORESTART PENDING-LINE PHASE LOSS,Jul 17 2023  6:12AM,False,True,True,,,,,,,ALARM_01,CH_ALARM_01,,,,AlertAlarm/2301Q65746/2023,2301Q65746,,America/Los_Angeles
38,2023-07-17T06:12:00,https://alarmssaveandnotifyprod.blob.core.windows.net/snapshot/vu210550150310_1/2023/7/17/6/12/VU210550150310_1_1689574324,,0.0,229,Device,,PROTECTIVE LIMIT-LOW CHILLED WATER  FLOW,Jul 17 2023  6:12AM,True,False,False,,,,,,,ALARM_01,CH_ALARM_01,,,,AlertAlarm/2301Q65746/2023,2301Q65746,,America/Los_Angeles
39,,,,,3,Device,,,7/16/2023 11:12:53 PM -07:00,True,False,False,1.0,,,,,,SYS_ALM,SystemAlertAlarm,,,,AlertAlarm/2301Q65746/2023,2301Q65746,,America/Los_Angeles
40,2023-07-17T09:52:00,,,0.0,3,Device,,System Alert /Alarm,Jul 17 2023  9:52AM,False,False,True,,,,,,,SYS_ALM,SystemAlertAlarm,,,,AlertAlarm/2301Q65746/2023,2301Q65746,,America/Los_Angeles
41,2023-07-17T09:52:00,,,0.0,229,Device,,PROTECTIVE LIMIT-LOW CHILLED WATER  FLOW,Jul 17 2023  9:52AM,True,False,True,,,,,,,ALARM_01,CH_ALARM_01,,,,AlertAlarm/2301Q65746/2023,2301Q65746,,America/Los_Angeles
42,2023-07-17T19:58:00,https://alarmssaveandnotifyprod.blob.core.windows.net/snapshot/vu210550150310_1/2023/7/17/20/42/VU210550150310_1_1689623916,,0.0,122,Device,,RUN CAPACITY LIMITED-LOW EVAP REFRIG TEMP,Jul 17 2023  7:58PM,False,True,False,,,,,,,ALARM_01,CH_ALARM_01,,,,AlertAlarm/2301Q65746/2023,2301Q65746,,America/Los_Angeles
43,2023-07-17T20:50:00,https://alarmssaveandnotifyprod.blob.core.windows.net/snapshot/vu210550150310_1/2023/7/17/20/50/VU210550150310_1_1689627031,,0.0,123,Device,,RUN CAPACITY LIMITED-HIGH COMPRESSOR LIFT,Jul 17 2023  8:50PM,False,True,False,,,,,,,ALARM_02,CH_ALARM_02,,,,AlertAlarm/2301Q65746/2023,2301Q65746,,America/Los_Angeles
44,2023-07-18T17:32:00,https://alarmssaveandnotifyprod.blob.core.windows.net/snapshot/vu210550150310_1/2023/7/18/17/32/VU210550150310_1_1689701522,,0.0,232,Device,,PROTECTIVE LIMIT-LOW REFRIGERANT TEMP,Jul 18 2023  5:32PM,True,False,False,,,,,,,ALARM_03,CH_ALARM_03,,,,AlertAlarm/2301Q65746/2023,2301Q65746,,America/Los_Angeles
45,2023-07-25T20:13:00,,,0.0,122,Device,,RUN CAPACITY LIMITED-LOW EVAP REFRIG TEMP,Jul 25 2023  8:13PM,False,True,True,,,,,,,ALARM_01,CH_ALARM_01,,,,AlertAlarm/2301Q65746/2023,2301Q65746,,America/Los_Angeles
46,2023-07-25T20:13:00,,,0.0,232,Device,,PROTECTIVE LIMIT-LOW REFRIGERANT TEMP,Jul 25 2023  8:13PM,True,False,True,,,,,,,ALARM_03,CH_ALARM_03,,,,AlertAlarm/2301Q65746/2023,2301Q65746,,America/Los_Angeles
47,,,,,2,Device,,,7/25/2023 1:18:48 PM -07:00,False,True,False,1.0,,,,,,SYS_ALM,SystemAlertAlarm,,,,AlertAlarm/2301Q65746/2023,2301Q65746,,America/Los_Angeles
48,2023-07-25T23:18:00,,,0.0,2,Device,,System Alert /Alarm,Jul 25 2023 11:18PM,False,False,True,,,,,,,SYS_ALM,SystemAlertAlarm,,,,AlertAlarm/2301Q65746/2023,2301Q65746,,America/Los_Angeles
49,2023-07-25T23:18:00,,,0.0,123,Device,,RUN CAPACITY LIMITED-HIGH COMPRESSOR LIFT,Jul 25 2023 11:18PM,False,True,True,,,,,,,ALARM_02,CH_ALARM_02,,,,AlertAlarm/2301Q65746/2023,2301Q65746,,America/Los_Angeles
50,2023-07-26T17:13:00,https://alarmssaveandnotifyprod.blob.core.windows.net/snapshot/vu210550150310_1/2023/7/26/19/9/VU210550150310_1_1690391582,,0.0,123,Device,,RUN CAPACITY LIMITED-HIGH COMPRESSOR LIFT,Jul 26 2023  5:13PM,False,True,False,,,,,,,ALARM_01,CH_ALARM_01,,,,AlertAlarm/2301Q65746/2023,2301Q65746,,America/Los_Angeles
51,,,,,2,Device,,,7/26/2023 10:15:55 AM -07:00,False,True,False,1.0,,,,,,SYS_ALM,SystemAlertAlarm,,,,AlertAlarm/2301Q65746/2023,2301Q65746,,America/Los_Angeles
52,,,,,2,Device,,,7/26/2023 10:50:56 AM -07:00,False,True,False,1.0,,,,,,SYS_ALM,SystemAlertAlarm,,,,AlertAlarm/2301Q65746/2023,2301Q65746,,America/Los_Angeles
53,2023-07-26T17:40:00,,,0.0,123,Device,,RUN CAPACITY LIMITED-HIGH COMPRESSOR LIFT,Jul 26 2023  5:40PM,False,True,True,,,,,,,ALARM_01,CH_ALARM_01,,,,AlertAlarm/2301Q65746/2023,2301Q65746,,America/Los_Angeles
54,2023-07-26T18:10:00,,,0.0,2,Device,,System Alert /Alarm,Jul 26 2023  6:10PM,False,False,True,,,,,,,SYS_ALM,SystemAlertAlarm,,,,AlertAlarm/2301Q65746/2023,2301Q65746,,America/Los_Angeles
55,,,,,2,Device,,,7/26/2023 11:20:56 AM -07:00,False,True,False,1.0,,,,,,SYS_ALM,SystemAlertAlarm,,,,AlertAlarm/2301Q65746/2023,2301Q65746,,America/Los_Angeles
56,,,,,2,Device,,,7/26/2023 12:00:56 PM -07:00,False,True,False,1.0,,,,,,SYS_ALM,SystemAlertAlarm,,,,AlertAlarm/2301Q65746/2023,2301Q65746,,America/Los_Angeles
57,2023-07-26T19:18:00,,,0.0,2,Device,,System Alert /Alarm,Jul 26 2023  7:18PM,False,False,True,,,,,,,SYS_ALM,SystemAlertAlarm,,,,AlertAlarm/2301Q65746/2023,2301Q65746,,America/Los_Angeles
58,,,,,2,Device,,,7/26/2023 12:23:56 PM -07:00,False,True,False,1.0,,,,,,SYS_ALM,SystemAlertAlarm,,,,AlertAlarm/2301Q65746/2023,2301Q65746,,America/Los_Angeles
59,2023-07-26T20:43:00,,,0.0,2,Device,,System Alert /Alarm,Jul 26 2023  8:43PM,False,False,True,,,,,,,SYS_ALM,SystemAlertAlarm,,,,AlertAlarm/2301Q65746/2023,2301Q65746,,America/Los_Angeles
60,2023-07-31T18:41:00,https://alarmssaveandnotifyprod.blob.core.windows.net/snapshot/vu210550150310_1/2023/7/31/18/42/VU210550150310_1_1690828919,,0.0,123,Device,,RUN CAPACITY LIMITED-HIGH COMPRESSOR LIFT,Jul 31 2023  6:41PM,False,True,False,,,,,,,ALARM_01,CH_ALARM_01,,,,AlertAlarm/2301Q65746/2023,2301Q65746,,America/Los_Angeles
61,,,,,2,Device,,,7/31/2023 11:45:56 AM -07:00,False,True,False,1.0,,,,,,SYS_ALM,SystemAlertAlarm,,,,AlertAlarm/2301Q65746/2023,2301Q65746,,America/Los_Angeles
62,2023-07-31T18:50:00,,,0.0,2,Device,,System Alert /Alarm,Jul 31 2023  6:50PM,False,False,True,,,,,,,SYS_ALM,SystemAlertAlarm,,,,AlertAlarm/2301Q65746/2023,2301Q65746,,America/Los_Angeles
63,2023-07-31T18:50:00,,,0.0,123,Device,,RUN CAPACITY LIMITED-HIGH COMPRESSOR LIFT,Jul 31 2023  6:50PM,False,True,True,,,,,,,ALARM_01,CH_ALARM_01,,,,AlertAlarm/2301Q65746/2023,2301Q65746,,America/Los_Angeles
64,,,,,2,Device,,,7/31/2023 1:30:57 PM -07:00,False,True,False,1.0,,,,,,SYS_ALM,SystemAlertAlarm,,,,AlertAlarm/2301Q65746/2023,2301Q65746,,America/Los_Angeles
65,,,,,2,Device,,,7/31/2023 1:48:57 PM -07:00,False,True,False,1.0,,,,,,SYS_ALM,SystemAlertAlarm,,,,AlertAlarm/2301Q65746/2023,2301Q65746,,America/Los_Angeles
66,,,,,2,Device,,,8/1/2023 12:14:01 PM -07:00,False,True,False,1.0,,,,,,SYS_ALM,SystemAlertAlarm,,,,AlertAlarm/2301Q65746/2023,2301Q65746,,America/Los_Angeles
67,2023-08-01T20:39:00,,,0.0,2,Device,,System Alert /Alarm,Aug  1 2023  8:39PM,False,False,True,,,,,,,SYS_ALM,SystemAlertAlarm,,,,AlertAlarm/2301Q65746/2023,2301Q65746,,America/Los_Angeles
68,,,,,2,Device,,,8/1/2023 1:44:01 PM -07:00,False,True,False,1.0,,,,,,SYS_ALM,SystemAlertAlarm,,,,AlertAlarm/2301Q65746/2023,2301Q65746,,America/Los_Angeles
69,2023-08-01T20:54:00,,,0.0,2,Device,,System Alert /Alarm,Aug  1 2023  8:54PM,False,False,True,,,,,,,SYS_ALM,SystemAlertAlarm,,,,AlertAlarm/2301Q65746/2023,2301Q65746,,America/Los_Angeles
70,,,,,2,Device,,,8/1/2023 2:14:01 PM -07:00,False,True,False,1.0,,,,,,SYS_ALM,SystemAlertAlarm,,,,AlertAlarm/2301Q65746/2023,2301Q65746,,America/Los_Angeles
71,2023-08-01T21:24:00,,,0.0,2,Device,,System Alert /Alarm,Aug  1 2023  9:24PM,False,False,True,,,,,,,SYS_ALM,SystemAlertAlarm,,,,AlertAlarm/2301Q65746/2023,2301Q65746,,America/Los_Angeles
72,,,,,3,Device,,,8/7/2023 4:04:07 AM -07:00,True,False,False,1.0,,,,,,SYS_ALM,SystemAlertAlarm,,,,AlertAlarm/2301Q65746/2023,2301Q65746,,America/Los_Angeles
73,2023-08-07T11:06:00,,,0.0,3,Device,,System Alert /Alarm,Aug  7 2023 11:06AM,False,False,True,,,,,,,SYS_ALM,SystemAlertAlarm,,,,AlertAlarm/2301Q65746/2023,2301Q65746,,America/Los_Angeles
74,2023-08-07T11:06:00,https://alarmssaveandnotifyprod.blob.core.windows.net/snapshot/vu210550150310_1/2023/8/7/11/6/VU210550150310_1_1691406375,,0.0,143,Device,,AUTORESTART PENDING-LINE PHASE LOSS,Aug  7 2023 11:06AM,False,True,False,,,,,,,ALARM_01,CH_ALARM_01,,,,AlertAlarm/2301Q65746/2023,2301Q65746,,America/Los_Angeles
75,2023-08-07T11:06:00,https://alarmssaveandnotifyprod.blob.core.windows.net/snapshot/vu210550150310_1/2023/8/7/11/6/VU210550150310_1_1691406375,,0.0,223,Device,,PROTECTIVE LIMIT-STARTER MODULE FAILURE,Aug  7 2023 11:06AM,True,False,False,,,,,,,ALARM_02,CH_ALARM_02,,,,AlertAlarm/2301Q65746/2023,2301Q65746,,America/Los_Angeles
76,2023-08-07T11:34:00,,,0.0,143,Device,,AUTORESTART PENDING-LINE PHASE LOSS,Aug  7 2023 11:34AM,False,True,True,,,,,,,ALARM_01,CH_ALARM_01,,,,AlertAlarm/2301Q65746/2023,2301Q65746,,America/Los_Angeles
77,2023-08-07T11:34:00,,,0.0,223,Device,,PROTECTIVE LIMIT-STARTER MODULE FAILURE,Aug  7 2023 11:34AM,True,False,True,,,,,,,ALARM_02,CH_ALARM_02,,,,AlertAlarm/2301Q65746/2023,2301Q65746,,America/Los_Angeles
78,2023-08-20T17:09:00,https://alarmssaveandnotifyprod.blob.core.windows.net/snapshot/vu210550150310_1/2023/8/20/17/9/VU210550150310_1_1692551352,,0.0,123,Device,,RUN CAPACITY LIMITED-HIGH COMPRESSOR LIFT,Aug 20 2023  5:09PM,False,True,False,,,,,,,ALARM_01,CH_ALARM_01,,,,AlertAlarm/2301Q65746/2023,2301Q65746,,America/Los_Angeles
79,,,,,2,Device,,,8/20/2023 10:10:34 AM -07:00,False,True,False,1.0,,,,,,SYS_ALM,SystemAlertAlarm,,,,AlertAlarm/2301Q65746/2023,2301Q65746,,America/Los_Angeles
80,2023-08-21T01:24:00,,,0.0,2,Device,,System Alert /Alarm,Aug 21 2023  1:24AM,False,False,True,,,,,,,SYS_ALM,SystemAlertAlarm,,,,AlertAlarm/2301Q65746/2023,2301Q65746,,America/Los_Angeles
81,2023-08-21T01:24:00,,,0.0,123,Device,,RUN CAPACITY LIMITED-HIGH COMPRESSOR LIFT,Aug 21 2023  1:24AM,False,True,True,,,,,,,ALARM_01,CH_ALARM_01,,,,AlertAlarm/2301Q65746/2023,2301Q65746,,America/Los_Angeles
82,2023-08-29T18:21:00,https://alarmssaveandnotifyprod.blob.core.windows.net/snapshot/vu210550150310_1/2023/8/29/23/56/VU210550150310_1_1693333295,,0.0,123,Device,,RUN CAPACITY LIMITED-HIGH COMPRESSOR LIFT,Aug 29 2023  6:21PM,False,True,False,,,,,,,ALARM_01,CH_ALARM_01,,,,AlertAlarm/2301Q65746/2023,2301Q65746,,America/Los_Angeles
83,,,,,2,Device,,,8/29/2023 11:26:25 AM -07:00,False,True,False,1.0,,,,,,SYS_ALM,SystemAlertAlarm,,,,AlertAlarm/2301Q65746/2023,2301Q65746,,America/Los_Angeles
84,2023-08-29T18:31:00,,,0.0,2,Device,,System Alert /Alarm,Aug 29 2023  6:31PM,False,False,True,,,,,,,SYS_ALM,SystemAlertAlarm,,,,AlertAlarm/2301Q65746/2023,2301Q65746,,America/Los_Angeles
85,2023-08-29T18:31:00,,,0.0,123,Device,,RUN CAPACITY LIMITED-HIGH COMPRESSOR LIFT,Aug 29 2023  6:31PM,False,True,True,,,,,,,ALARM_01,CH_ALARM_01,,,,AlertAlarm/2301Q65746/2023,2301Q65746,,America/Los_Angeles
86,,,,,2,Device,,,8/29/2023 3:01:25 PM -07:00,False,True,False,1.0,,,,,,SYS_ALM,SystemAlertAlarm,,,,AlertAlarm/2301Q65746/2023,2301Q65746,,America/Los_Angeles
87,2023-08-29T22:06:00,,,0.0,2,Device,,System Alert /Alarm,Aug 29 2023 10:06PM,False,False,True,,,,,,,SYS_ALM,SystemAlertAlarm,,,,AlertAlarm/2301Q65746/2023,2301Q65746,,America/Los_Angeles
88,,,,,2,Device,,,8/30/2023 2:52:30 PM -07:00,False,True,False,1.0,,,,,,SYS_ALM,SystemAlertAlarm,,,,AlertAlarm/2301Q65746/2023,2301Q65746,,America/Los_Angeles
89,2023-08-30T21:59:00,,,0.0,2,Device,,System Alert /Alarm,Aug 30 2023  9:59PM,False,False,True,,,,,,,SYS_ALM,SystemAlertAlarm,,,,AlertAlarm/2301Q65746/2023,2301Q65746,,America/Los_Angeles
90,,,,,2,Device,,,8/30/2023 3:09:30 PM -07:00,False,True,False,1.0,,,,,,SYS_ALM,SystemAlertAlarm,,,,AlertAlarm/2301Q65746/2023,2301Q65746,,America/Los_Angeles
91,2023-08-30T23:14:00,,,0.0,2,Device,,System Alert /Alarm,Aug 30 2023 11:14PM,False,False,True,,,,,,,SYS_ALM,SystemAlertAlarm,,,,AlertAlarm/2301Q65746/2023,2301Q65746,,America/Los_Angeles
92,,,,,2,Device,,,8/30/2023 4:34:30 PM -07:00,False,True,False,1.0,,,,,,SYS_ALM,SystemAlertAlarm,,,,AlertAlarm/2301Q65746/2023,2301Q65746,,America/Los_Angeles
93,2023-09-04T10:01:00,,,0.0,2,Device,,System Alert /Alarm,Sep  4 2023 10:01AM,False,False,True,,,,,,,SYS_ALM,SystemAlertAlarm,,,,AlertAlarm/2301Q65746/2023,2301Q65746,,America/Los_Angeles
94,2023-09-04T10:01:00,https://alarmssaveandnotifyprod.blob.core.windows.net/snapshot/vu210550150310_1/2023/9/8/9/10/VU210550150310_1_1693821690,,0.0,165,Device,,MACHINE ALERT-HIGH COND WATER FLOW,Sep  4 2023 10:01AM,False,True,False,,,,,,,ALARM_01,CH_ALARM_01,,,,AlertAlarm/2301Q65746/2023,2301Q65746,,America/Los_Angeles
95,2023-09-04T10:21:00,https://alarmssaveandnotifyprod.blob.core.windows.net/snapshot/vu210550150310_1/2023/9/8/9/14/VU210550150310_1_1693822861,,0.0,143,Device,,AUTORESTART PENDING-LINE PHASE LOSS,Sep  4 2023 10:21AM,False,True,False,,,,,,,ALARM_02,CH_ALARM_02,,,,AlertAlarm/2301Q65746/2023,2301Q65746,,America/Los_Angeles
96,,,,,2,Device,,,9/8/2023 12:54:14 PM -07:00,False,True,False,1.0,,,,,,SYS_ALM,SystemAlertAlarm,,,,AlertAlarm/2301Q65746/2023,2301Q65746,,America/Los_Angeles
97,,,,,2,Device,,,9/8/2023 1:47:14 PM -07:00,False,True,False,1.0,,,,,,SYS_ALM,SystemAlertAlarm,,,,AlertAlarm/2301Q65746/2023,2301Q65746,,America/Los_Angeles
98,2023-09-08T20:42:00,,,0.0,165,Device,,MACHINE ALERT-HIGH COND WATER FLOW,Sep  8 2023  8:42PM,False,True,True,,,,,,,ALARM_01,CH_ALARM_01,,,,AlertAlarm/2301Q65746/2023,2301Q65746,,America/Los_Angeles
99,2023-09-08T20:42:00,,,0.0,143,Device,,AUTORESTART PENDING-LINE PHASE LOSS,Sep  8 2023  8:42PM,False,True,True,,,,,,,ALARM_02,CH_ALARM_02,,,,AlertAlarm/2301Q65746/2023,2301Q65746,,America/Los_Angeles
100,2023-09-08T21:52:00,,,0.0,2,Device,,System Alert /Alarm,Sep  8 2023  9:52PM,False,False,True,,,,,,,SYS_ALM,SystemAlertAlarm,,,,AlertAlarm/2301Q65746/2023,2301Q65746,,America/Los_Angeles
101,,,,,2,Device,,,9/10/2023 12:58:10 PM -07:00,False,True,False,1.0,,,,,,SYS_ALM,SystemAlertAlarm,,,,AlertAlarm/2301Q65746/2023,2301Q65746,,America/Los_Angeles
102,2023-09-10T19:54:00,,,0.0,2,Device,,System Alert /Alarm,Sep 10 2023  7:54PM,False,False,True,,,,,,,SYS_ALM,SystemAlertAlarm,,,,AlertAlarm/2301Q65746/2023,2301Q65746,,America/Los_Angeles
103,2023-09-10T19:54:00,https://alarmssaveandnotifyprod.blob.core.windows.net/snapshot/vu210550150310_1/2023/9/12/9/47/VU210550150310_1_1694375698,,0.0,123,Device,,RUN CAPACITY LIMITED-HIGH COMPRESSOR LIFT,Sep 10 2023  7:54PM,False,True,False,,,,,,,ALARM_01,CH_ALARM_01,,,,AlertAlarm/2301Q65746/2023,2301Q65746,,America/Los_Angeles
104,2023-09-10T19:54:00,,,0.0,2,Device,,System Alert /Alarm,Sep 10 2023  7:54PM,False,False,True,,,,,,,SYS_ALM,SystemAlertAlarm,,,,AlertAlarm/2301Q65746/2023,2301Q65746,,America/Los_Angeles
105,2023-09-10T21:21:00,,,0.0,2,Device,,System Alert /Alarm,Sep 10 2023  9:21PM,False,False,True,,,,,,,SYS_ALM,SystemAlertAlarm,,,,AlertAlarm/2301Q65746/2023,2301Q65746,,America/Los_Angeles
106,2023-09-10T21:21:00,,,0.0,123,Device,,RUN CAPACITY LIMITED-HIGH COMPRESSOR LIFT,Sep 10 2023  9:21PM,False,True,True,,,,,,,ALARM_01,CH_ALARM_01,,,,AlertAlarm/2301Q65746/2023,2301Q65746,,America/Los_Angeles
107,2023-09-18T13:41:00,https://alarmssaveandnotifyprod.blob.core.windows.net/snapshot/vu210550150310_1/2023/9/18/13/41/VU210550150310_1_1695044472,,0.0,229,Device,,PROTECTIVE LIMIT-LOW CHILLED WATER  FLOW,Sep 18 2023  1:41PM,True,False,False,,,,,,,ALARM_01,CH_ALARM_01,,,,AlertAlarm/2301Q65746/2023,2301Q65746,,America/Los_Angeles
108,,,,,3,Device,,,9/18/2023 6:41:52 AM -07:00,True,False,False,1.0,,,,,,SYS_ALM,SystemAlertAlarm,,,,AlertAlarm/2301Q65746/2023,2301Q65746,,America/Los_Angeles
109,2023-09-18T14:01:00,,,0.0,3,Device,,System Alert /Alarm,Sep 18 2023  2:01PM,False,False,True,,,,,,,SYS_ALM,SystemAlertAlarm,,,,AlertAlarm/2301Q65746/2023,2301Q65746,,America/Los_Angeles
110,2023-09-18T14:01:00,,,0.0,229,Device,,PROTECTIVE LIMIT-LOW CHILLED WATER  FLOW,Sep 18 2023  2:01PM,True,False,True,,,,,,,ALARM_01,CH_ALARM_01,,,,AlertAlarm/2301Q65746/2023,2301Q65746,,America/Los_Angeles
111,2023-09-30T03:04:00,https://alarmssaveandnotifyprod.blob.core.windows.net/snapshot/vu210550150310_1/2023/9/30/3/4/VU210550150310_1_1696043080,,0.0,229,Device,,PROTECTIVE LIMIT-LOW CHILLED WATER  FLOW,Sep 30 2023  3:04AM,True,False,False,,,,,,,ALARM_01,CH_ALARM_01,,,,AlertAlarm/2301Q65746/2023,2301Q65746,,America/Los_Angeles
112,,,,,3,Device,,,9/29/2023 8:08:44 PM -07:00,True,False,False,1.0,,,,,,SYS_ALM,SystemAlertAlarm,,,,AlertAlarm/2301Q65746/2023,2301Q65746,,America/Los_Angeles
113,2023-09-30T03:13:00,,,0.0,3,Device,,System Alert /Alarm,Sep 30 2023  3:13AM,False,False,True,,,,,,,SYS_ALM,SystemAlertAlarm,,,,AlertAlarm/2301Q65746/2023,2301Q65746,,America/Los_Angeles
114,2023-09-30T03:13:00,,,0.0,229,Device,,PROTECTIVE LIMIT-LOW CHILLED WATER  FLOW,Sep 30 2023  3:13AM,True,False,True,,,,,,,ALARM_01,CH_ALARM_01,,,,AlertAlarm/2301Q65746/2023,2301Q65746,,America/Los_Angeles
115,2023-10-02T10:06:00,https://alarmssaveandnotifyprod.blob.core.windows.net/snapshot/vu210550150310_1/2023/10/2/14/30/VU210550150310_1_1696241207,,0.0,165,Device,,MACHINE ALERT-HIGH COND WATER FLOW,Oct  2 2023 10:06AM,False,True,False,,,,,,,ALARM_01,CH_ALARM_01,,,,AlertAlarm/2301Q65746/2023,2301Q65746,,America/Los_Angeles
116,2023-10-24T22:21:00,,,0.0,165,Device,,MACHINE ALERT-HIGH COND WATER FLOW,Oct 24 2023 10:21PM,False,True,True,,,,,,,ALARM_01,CH_ALARM_01,,,,AlertAlarm/2301Q65746/2023,2301Q65746,,America/Los_Angeles
117,2023-10-24T22:21:00,https://alarmssaveandnotifyprod.blob.core.windows.net/snapshot/vu210550150310_1/2023/10/25/3/56/VU210550150310_1_1698186111,,0.0,123,Device,,RUN CAPACITY LIMITED-HIGH COMPRESSOR LIFT,Oct 24 2023 10:21PM,False,True,False,,,,,,,ALARM_01,CH_ALARM_01,,,,AlertAlarm/2301Q65746/2023,2301Q65746,,America/Los_Angeles
118,2023-10-24T22:36:00,,,0.0,123,Device,,RUN CAPACITY LIMITED-HIGH COMPRESSOR LIFT,Oct 24 2023 10:36PM,False,True,True,,,,,,,ALARM_01,CH_ALARM_01,,,,AlertAlarm/2301Q65746/2023,2301Q65746,,America/Los_Angeles
119,,,,,2,Device,,,10/24/2023 3:26:49 PM -07:00,False,True,False,1.0,,,,,,SYS_ALM,SystemAlertAlarm,,,,AlertAlarm/2301Q65746/2023,2301Q65746,,America/Los_Angeles
120,2023-10-25T20:01:00,,,0.0,2,Device,,System Alert /Alarm,Oct 25 2023  8:01PM,False,False,True,,,,,,,SYS_ALM,SystemAlertAlarm,,,,AlertAlarm/2301Q65746/2023,2301Q65746,,America/Los_Angeles
121,2023-10-25T20:01:00,https://alarmssaveandnotifyprod.blob.core.windows.net/snapshot/vu210550150310_1/2023/10/25/20/2/VU210550150310_1_1698264117,,0.0,123,Device,,RUN CAPACITY LIMITED-HIGH COMPRESSOR LIFT,Oct 25 2023  8:01PM,False,True,False,,,,,,,ALARM_01,CH_ALARM_01,,,,AlertAlarm/2301Q65746/2023,2301Q65746,,America/Los_Angeles
122,,,,,2,Device,,,10/25/2023 1:06:56 PM -07:00,False,True,False,1.0,,,,,,SYS_ALM,SystemAlertAlarm,,,,AlertAlarm/2301Q65746/2023,2301Q65746,,America/Los_Angeles
123,,,,,3,Device,,,10/25/2023 1:26:56 PM -07:00,True,False,False,2.0,,,,,,SYS_ALM,SystemAlertAlarm,,,,AlertAlarm/2301Q65746/2023,2301Q65746,,America/Los_Angeles
124,2023-10-25T20:28:00,,,0.0,3,Device,,System Alert /Alarm,Oct 25 2023  8:28PM,False,False,True,,,,,,,SYS_ALM,SystemAlertAlarm,,,,AlertAlarm/2301Q65746/2023,2301Q65746,,America/Los_Angeles
125,2023-10-25T20:28:00,,,0.0,2,Device,,System Alert /Alarm,Oct 25 2023  8:28PM,False,False,True,,,,,,,SYS_ALM,SystemAlertAlarm,,,,AlertAlarm/2301Q65746/2023,2301Q65746,,America/Los_Angeles
126,2023-10-25T20:28:00,https://alarmssaveandnotifyprod.blob.core.windows.net/snapshot/vu210550150310_1/2023/10/25/20/28/VU210550150310_1_1698265705,,0.0,238,Device,,PROTECTIVE LIMIT-EXCESSIVE COMPR SURGE,Oct 25 2023  8:28PM,True,False,False,,,,,,,ALARM_02,CH_ALARM_02,,,,AlertAlarm/2301Q65746/2023,2301Q65746,,America/Los_Angeles
127,2023-10-25T20:31:00,,,0.0,238,Device,,PROTECTIVE LIMIT-EXCESSIVE COMPR SURGE,Oct 25 2023  8:31PM,True,False,True,,,,,,,ALARM_02,CH_ALARM_02,,,,AlertAlarm/2301Q65746/2023,2301Q65746,,America/Los_Angeles
128,2023-10-25T20:31:00,,,0.0,123,Device,,RUN CAPACITY LIMITED-HIGH COMPRESSOR LIFT,Oct 25 2023  8:31PM,False,True,True,,,,,,,ALARM_01,CH_ALARM_01,,,,AlertAlarm/2301Q65746/2023,2301Q65746,,America/Los_Angeles
129,,,,,2,Device,,,10/25/2023 1:36:56 PM -07:00,False,True,False,1.0,,,,,,SYS_ALM,SystemAlertAlarm,,,,AlertAlarm/2301Q65746/2023,2301Q65746,,America/Los_Angeles
130,2023-10-25T20:41:00,,,0.0,2,Device,,System Alert /Alarm,Oct 25 2023  8:41PM,False,False,True,,,,,,,SYS_ALM,SystemAlertAlarm,,,,AlertAlarm/2301Q65746/2023,2301Q65746,,America/Los_Angeles
131,,,,,2,Device,,,10/25/2023 2:01:56 PM -07:00,False,True,False,1.0,,,,,,SYS_ALM,SystemAlertAlarm,,,,AlertAlarm/2301Q65746/2023,2301Q65746,,America/Los_Angeles
132,2023-10-25T21:31:00,,,0.0,2,Device,,System Alert /Alarm,Oct 25 2023  9:31PM,False,False,True,,,,,,,SYS_ALM,SystemAlertAlarm,,,,AlertAlarm/2301Q65746/2023,2301Q65746,,America/Los_Angeles
133,,,,,2,Device,,,10/25/2023 2:41:57 PM -07:00,False,True,False,1.0,,,,,,SYS_ALM,SystemAlertAlarm,,,,AlertAlarm/2301Q65746/2023,2301Q65746,,America/Los_Angeles
134,,,,,2,Device,,,10/25/2023 3:09:57 PM -07:00,False,True,False,1.0,,,,,,SYS_ALM,SystemAlertAlarm,,,,AlertAlarm/2301Q65746/2023,2301Q65746,,America/Los_Angeles
135,,,,,3,Device,,,10/25/2023 3:14:57 PM -07:00,True,False,False,2.0,,,,,,SYS_ALM,SystemAlertAlarm,,,,AlertAlarm/2301Q65746/2023,2301Q65746,,America/Los_Angeles
136,2023-10-25T22:19:00,,,0.0,2,Device,,System Alert /Alarm,Oct 25 2023 10:19PM,False,False,True,,,,,,,SYS_ALM,SystemAlertAlarm,,,,AlertAlarm/2301Q65746/2023,2301Q65746,,America/Los_Angeles
137,,,,,2,Device,,,10/25/2023 4:57:57 PM -07:00,False,True,False,1.0,,,,,,SYS_ALM,SystemAlertAlarm,,,,AlertAlarm/2301Q65746/2023,2301Q65746,,America/Los_Angeles
138,,,,,3,Device,,,10/25/2023 5:12:57 PM -07:00,True,False,False,2.0,,,,,,SYS_ALM,SystemAlertAlarm,,,,AlertAlarm/2301Q65746/2023,2301Q65746,,America/Los_Angeles
139,2023-10-26T01:27:00,,,0.0,3,Device,,System Alert /Alarm,Oct 26 2023  1:27AM,False,False,True,,,,,,,SYS_ALM,SystemAlertAlarm,,,,AlertAlarm/2301Q65746/2023,2301Q65746,,America/Los_Angeles
140,2023-10-26T01:27:00,,,0.0,2,Device,,System Alert /Alarm,Oct 26 2023  1:27AM,False,False,True,,,,,,,SYS_ALM,SystemAlertAlarm,,,,AlertAlarm/2301Q65746/2023,2301Q65746,,America/Los_Angeles
141,2023-10-26T15:54:00,https://alarmssaveandnotifyprod.blob.core.windows.net/snapshot/vu210550150310_1/2023/10/26/18/9/VU210550150310_1_1698335678,,0.0,123,Device,,RUN CAPACITY LIMITED-HIGH COMPRESSOR LIFT,Oct 26 2023  3:54PM,False,True,False,,,,,,,ALARM_01,CH_ALARM_01,,,,AlertAlarm/2301Q65746/2023,2301Q65746,,America/Los_Angeles
142,,,,,2,Device,,,10/26/2023 8:59:48 AM -07:00,False,True,False,1.0,,,,,,SYS_ALM,SystemAlertAlarm,,,,AlertAlarm/2301Q65746/2023,2301Q65746,,America/Los_Angeles
143,2023-10-26T18:27:00,,,0.0,2,Device,,System Alert /Alarm,Oct 26 2023  6:27PM,False,False,True,,,,,,,SYS_ALM,SystemAlertAlarm,,,,AlertAlarm/2301Q65746/2023,2301Q65746,,America/Los_Angeles
144,2023-10-26T18:27:00,,,0.0,123,Device,,RUN CAPACITY LIMITED-HIGH COMPRESSOR LIFT,Oct 26 2023  6:27PM,False,True,True,,,,,,,ALARM_01,CH_ALARM_01,,,,AlertAlarm/2301Q65746/2023,2301Q65746,,America/Los_Angeles
145,2023-10-28T03:14:00,https://alarmssaveandnotifyprod.blob.core.windows.net/snapshot/vu210550150310_1/2023/10/28/3/14/VU210550150310_1_1698462857,,0.0,123,Device,,RUN CAPACITY LIMITED-HIGH COMPRESSOR LIFT,Oct 28 2023  3:14AM,False,True,False,,,,,,,ALARM_01,CH_ALARM_01,,,,AlertAlarm/2301Q65746/2023,2301Q65746,,America/Los_Angeles
146,2023-10-28T03:14:00,https://alarmssaveandnotifyprod.blob.core.windows.net/snapshot/vu210550150310_1/2023/10/28/3/14/VU210550150310_1_1698462857,,0.0,229,Device,,PROTECTIVE LIMIT-LOW CHILLED WATER  FLOW,Oct 28 2023  3:14AM,True,False,False,,,,,,,ALARM_02,CH_ALARM_02,,,,AlertAlarm/2301Q65746/2023,2301Q65746,,America/Los_Angeles
147,,,,,3,Device,,,10/27/2023 8:17:54 PM -07:00,True,False,False,1.0,,,,,,SYS_ALM,SystemAlertAlarm,,,,AlertAlarm/2301Q65746/2023,2301Q65746,,America/Los_Angeles
148,2023-10-28T03:27:00,,,0.0,123,Device,,RUN CAPACITY LIMITED-HIGH COMPRESSOR LIFT,Oct 28 2023  3:27AM,False,True,True,,,,,,,ALARM_01,CH_ALARM_01,,,,AlertAlarm/2301Q65746/2023,2301Q65746,,America/Los_Angeles
149,2023-10-28T03:27:00,,,0.0,3,Device,,System Alert /Alarm,Oct 28 2023  3:27AM,False,False,True,,,,,,,SYS_ALM,SystemAlertAlarm,,,,AlertAlarm/2301Q65746/2023,2301Q65746,,America/Los_Angeles
150,2023-10-28T03:27:00,,,0.0,229,Device,,PROTECTIVE LIMIT-LOW CHILLED WATER  FLOW,Oct 28 2023  3:27AM,True,False,True,,,,,,,ALARM_02,CH_ALARM_02,,,,AlertAlarm/2301Q65746/2023,2301Q65746,,America/Los_Angeles
151,2023-11-06T11:06:00,https://alarmssaveandnotifyprod.blob.core.windows.net/snapshot/vu210550150310_1/2023/11/6/11/42/VU210550150310_1_1699268817,,0.0,143,Device,,AUTORESTART PENDING-LINE PHASE LOSS,Nov  6 2023 11:06AM,False,True,False,,,,,,,ALARM_01,CH_ALARM_01,,,,AlertAlarm/2301Q65746/2023,2301Q65746,,America/Los_Angeles
152,2023-11-20T18:30:00,,,0.0,143,Device,,AUTORESTART PENDING-LINE PHASE LOSS,Nov 20 2023  6:30PM,False,True,True,,,,,,,ALARM_01,CH_ALARM_01,,,,AlertAlarm/2301Q65746/2023,2301Q65746,,America/Los_Angeles
153,2023-11-20T18:30:00,https://alarmssaveandnotifyprod.blob.core.windows.net/snapshot/vu210550150310_1/2023/11/20/18/46/VU210550150310_1_1700505053,,0.0,165,Device,,MACHINE ALERT-HIGH COND WATER FLOW,Nov 20 2023  6:30PM,False,True,False,,,,,,,ALARM_01,CH_ALARM_01,,,,AlertAlarm/2301Q65746/2023,2301Q65746,,America/Los_Angeles
154,2023-11-20T18:30:00,https://alarmssaveandnotifyprod.blob.core.windows.net/snapshot/vu210550150310_1/2023/11/20/18/46/VU210550150310_1_1700505053,,0.0,229,Device,,PROTECTIVE LIMIT-LOW CHILLED WATER  FLOW,Nov 20 2023  6:30PM,True,False,False,,,,,,,ALARM_02,CH_ALARM_02,,,,AlertAlarm/2301Q65746/2023,2301Q65746,,America/Los_Angeles
155,2023-11-20T18:42:00,,,0.0,165,Device,,MACHINE ALERT-HIGH COND WATER FLOW,Nov 20 2023  6:42PM,False,True,True,,,,,,,ALARM_01,CH_ALARM_01,,,,AlertAlarm/2301Q65746/2023,2301Q65746,,America/Los_Angeles
156,2023-11-20T18:42:00,,,0.0,229,Device,,PROTECTIVE LIMIT-LOW CHILLED WATER  FLOW,Nov 20 2023  6:42PM,True,False,True,,,,,,,ALARM_02,CH_ALARM_02,,,,AlertAlarm/2301Q65746/2023,2301Q65746,,America/Los_Angeles
157,,,,,3,Device,,,11/20/2023 10:32:51 AM -08:00,True,False,False,1.0,,,,,,SYS_ALM,SystemAlertAlarm,,,,AlertAlarm/2301Q65746/2023,2301Q65746,,America/Los_Angeles
158,2023-12-08T23:57:00,,,0.0,3,Device,,System Alert /Alarm,Dec  8 2023 11:57PM,False,False,True,,,,,,,SYS_ALM,SystemAlertAlarm,,,,AlertAlarm/2301Q65746/2023,2301Q65746,,America/Los_Angeles
159,2023-12-08T23:57:00,https://alarmssaveandnotifyprod.blob.core.windows.net/snapshot/vu210550150310_1/2023/12/8/23/58/VU210550150310_1_1702079876,,0.0,123,Device,,RUN CAPACITY LIMITED-HIGH COMPRESSOR LIFT,Dec  8 2023 11:57PM,False,True,False,,,,,,,ALARM_01,CH_ALARM_01,,,,AlertAlarm/2301Q65746/2023,2301Q65746,,America/Los_Angeles
160,,,,,2,Device,,,12/12/2023 1:04:15 PM -08:00,False,True,False,1.0,,,,,,SYS_ALM,SystemAlertAlarm,,,,AlertAlarm/2301Q65746/2023,2301Q65746,,America/Los_Angeles
161,2023-12-13T04:29:00,,,0.0,2,Device,,System Alert /Alarm,Dec 13 2023  4:29AM,False,False,True,,,,,,,SYS_ALM,SystemAlertAlarm,,,,AlertAlarm/2301Q65746/2023,2301Q65746,,America/Los_Angeles
162,2023-12-13T04:29:00,,,0.0,123,Device,,RUN CAPACITY LIMITED-HIGH COMPRESSOR LIFT,Dec 13 2023  4:29AM,False,True,True,,,,,,,ALARM_01,CH_ALARM_01,,,,AlertAlarm/2301Q65746/2023,2301Q65746,,America/Los_Angeles
163,2023-12-20T16:12:00,https://alarmssaveandnotifyprod.blob.core.windows.net/snapshot/vu210550150310_1/2023/12/20/16/12/VU210550150310_1_1703088758,,0.0,123,Device,,RUN CAPACITY LIMITED-HIGH COMPRESSOR LIFT,Dec 20 2023  4:12PM,False,True,False,,,,,,,ALARM_01,CH_ALARM_01,,,,AlertAlarm/2301Q65746/2023,2301Q65746,,America/Los_Angeles
164,,,,,2,Device,,,12/20/2023 8:15:15 AM -08:00,False,True,False,1.0,,,,,,SYS_ALM,SystemAlertAlarm,,,,AlertAlarm/2301Q65746/2023,2301Q65746,,America/Los_Angeles
165,2023-12-20T16:18:00,,,0.0,2,Device,,System Alert /Alarm,Dec 20 2023  4:18PM,False,False,True,,,,,,,SYS_ALM,SystemAlertAlarm,,,,AlertAlarm/2301Q65746/2023,2301Q65746,,America/Los_Angeles
166,2023-12-20T16:18:00,https://alarmssaveandnotifyprod.blob.core.windows.net/snapshot/vu210550150310_1/2023/12/20/16/18/VU210550150310_1_1703089082,,0.0,163,Device,,SENSOR ALERT-CONDENSER APPROACH,Dec 20 2023  4:18PM,False,True,False,,,,,,,ALARM_02,CH_ALARM_02,,,,AlertAlarm/2301Q65746/2023,2301Q65746,,America/Los_Angeles
167,2023-12-20T16:20:00,,,0.0,123,Device,,RUN CAPACITY LIMITED-HIGH COMPRESSOR LIFT,Dec 20 2023  4:20PM,False,True,True,,,,,,,ALARM_01,CH_ALARM_01,,,,AlertAlarm/2301Q65746/2023,2301Q65746,,America/Los_Angeles
168,2023-12-20T16:20:00,,,0.0,163,Device,,SENSOR ALERT-CONDENSER APPROACH,Dec 20 2023  4:20PM,False,True,True,,,,,,,ALARM_02,CH_ALARM_02,,,,AlertAlarm/2301Q65746/2023,2301Q65746,,America/Los_Angeles
169,2023-12-20T16:31:00,https://alarmssaveandnotifyprod.blob.core.windows.net/snapshot/vu210550150310_1/2023/12/20/16/31/VU210550150310_1_1703089897,,0.0,123,Device,,RUN CAPACITY LIMITED-HIGH COMPRESSOR LIFT,Dec 20 2023  4:31PM,False,True,False,,,,,,,ALARM_01,CH_ALARM_01,,,,AlertAlarm/2301Q65746/2023,2301Q65746,,America/Los_Angeles
170,2023-12-20T16:31:00,https://alarmssaveandnotifyprod.blob.core.windows.net/snapshot/vu210550150310_1/2023/12/20/16/31/VU210550150310_1_1703089897,,0.0,163,Device,,SENSOR ALERT-CONDENSER APPROACH,Dec 20 2023  4:31PM,False,True,False,,,,,,,ALARM_02,CH_ALARM_02,,,,AlertAlarm/2301Q65746/2023,2301Q65746,,America/Los_Angeles
171,2023-12-20T16:31:00,https://alarmssaveandnotifyprod.blob.core.windows.net/snapshot/vu210550150310_1/2023/12/20/16/31/VU210550150310_1_1703089897,,0.0,229,Device,,PROTECTIVE LIMIT-LOW CHILLED WATER  FLOW,Dec 20 2023  4:31PM,True,False,False,,,,,,,ALARM_03,CH_ALARM_03,,,,AlertAlarm/2301Q65746/2023,2301Q65746,,America/Los_Angeles
172,,,,,3,Device,,,12/20/2023 9:20:15 AM -08:00,True,False,False,1.0,,,,,,SYS_ALM,SystemAlertAlarm,,,,AlertAlarm/2301Q65746/2023,2301Q65746,,America/Los_Angeles
173,2023-12-20T17:30:00,,,0.0,3,Device,,System Alert /Alarm,Dec 20 2023  5:30PM,False,False,True,,,,,,,SYS_ALM,SystemAlertAlarm,,,,AlertAlarm/2301Q65746/2023,2301Q65746,,America/Los_Angeles
174,2023-12-20T17:30:00,,,0.0,229,Device,,PROTECTIVE LIMIT-LOW CHILLED WATER  FLOW,Dec 20 2023  5:30PM,True,False,True,,,,,,,ALARM_03,CH_ALARM_03,,,,AlertAlarm/2301Q65746/2023,2301Q65746,,America/Los_Angeles
175,2023-12-20T17:30:00,,,0.0,123,Device,,RUN CAPACITY LIMITED-HIGH COMPRESSOR LIFT,Dec 20 2023  5:30PM,False,True,True,,,,,,,ALARM_01,CH_ALARM_01,,,,AlertAlarm/2301Q65746/2023,2301Q65746,,America/Los_Angeles
176,2023-12-20T17:30:00,,,0.0,163,Device,,SENSOR ALERT-CONDENSER APPROACH,Dec 20 2023  5:30PM,False,True,True,,,,,,,ALARM_02,CH_ALARM_02,,,,AlertAlarm/2301Q65746/2023,2301Q65746,,America/Los_Angeles
0,2024-01-23T03:30:00,https://alarmssaveandnotifyprod.blob.core.windows.net/snapshot/vu210550150310_1/2024/1/23/3/30/VU210550150310_1_1705980626,,0.0,229,Device,,PROTECTIVE LIMIT-LOW CHILLED WATER  FLOW,Jan 23 2024  3:30AM,True,False,False,,,,,,,ALARM_01,CH_ALARM_01,,,,AlertAlarm/2301Q65746/2024,2301Q65746,,America/Los_Angeles
1,2024-01-23T04:00:00,,,0.0,229,Device,,PROTECTIVE LIMIT-LOW CHILLED WATER  FLOW,Jan 23 2024  4:00AM,True,False,True,,,,,,,ALARM_01,CH_ALARM_01,,,,AlertAlarm/2301Q65746/2024,2301Q65746,,America/Los_Angeles
