,AlertAlarmDateTime,SnapshotUrl,TimeZoneAbreviation,UtcOffsetMinutes,adjustedvalue,alertalarmtype,algorithm,description,eventdatetime,isalarm,isalert,isreset,lastvalue,maxalarmthresholdvalue,maxwarningthresholdvalue,metricName,metricNameChinese,metricid,metrickey,metricshortname,metrictype,minalarmthresholdvalue,minwarningthresholdvalue,path,serialnumber,targetvalue,timezone
0,,,,,2,Device,,,1/12/2023 7:46:14 PM -05:00,False,True,False,1.0,,,,,,SYS_ALM,SystemAlertAlarm,,,,AlertAlarm/4004Q69950/2023,4004Q69950,,America/New_York
1,2023-01-13T00:56:00,,,0.0,2,Device,,System Alert /Alarm,Jan 13 2023 12:56AM,False,False,True,,,,,,,SYS_ALM,SystemAlertAlarm,,,,AlertAlarm/4004Q69950/2023,4004Q69950,,America/New_York
2,,,,,2,Device,,,1/12/2023 8:11:14 PM -05:00,False,True,False,1.0,,,,,,SYS_ALM,SystemAlertAlarm,,,,AlertAlarm/4004Q69950/2023,4004Q69950,,America/New_York
3,2023-01-13T02:01:00,,,0.0,2,Device,,System Alert /Alarm,Jan 13 2023  2:01AM,False,False,True,,,,,,,SYS_ALM,SystemAlertAlarm,,,,AlertAlarm/4004Q69950/2023,4004Q69950,,America/New_York
4,2023-02-19T09:20:00,,,0.0,2,Device,,System Alert /Alarm,Feb 19 2023  9:20AM,False,False,True,,,,,,,SYS_ALM,SystemAlertAlarm,,,,AlertAlarm/4004Q69950/2023,4004Q69950,,America/New_York
5,2023-04-17T12:22:00,,,0.0,162,Device,,SENSOR ALERT-EVAPORATOR APPROACH,Apr 17 2023 12:22PM,False,True,True,,,,,,,ALARM_02,CH_ALARM_02,,,,AlertAlarm/4004Q69950/2023,4004Q69950,,America/New_York
6,2023-04-17T12:22:00,https://alarmssaveandnotifyprod.blob.core.windows.net/snapshot/vu139530540410_42/2023/4/17/15/15/VU139530540410_42_1681734178,,0.0,148,Device,,AUTORESTART PENDING-POWER LOSS,Apr 17 2023 12:22PM,False,True,False,,,,,,,ALARM_01,CH_ALARM_01,,,,AlertAlarm/4004Q69950/2023,4004Q69950,,America/New_York
7,2023-04-19T20:19:00,https://alarmssaveandnotifyprod.blob.core.windows.net/snapshot/vu139530540410_42/2023/4/19/20/47/VU139530540410_42_1681935585,,0.0,163,Device,,SENSOR ALERT-CONDENSER APPROACH,Apr 19 2023  8:19PM,False,True,False,,,,,,,ALARM_03,CH_ALARM_03,,,,AlertAlarm/4004Q69950/2023,4004Q69950,,America/New_York
8,2023-04-19T20:31:00,https://alarmssaveandnotifyprod.blob.core.windows.net/snapshot/vu139530540410_42/2023/4/19/20/47/VU139530540410_42_1681936301,,0.0,230,Device,,PROTECTIVE LIMIT-LOW CONDENSER WATER FLOW,Apr 19 2023  8:31PM,True,False,False,,,,,,,ALARM_04,CH_ALARM_04,,,,AlertAlarm/4004Q69950/2023,4004Q69950,,America/New_York
9,,,,,3,Device,,,4/19/2023 4:35:40 PM -04:00,True,False,False,1.0,,,,,,SYS_ALM,SystemAlertAlarm,,,,AlertAlarm/4004Q69950/2023,4004Q69950,,America/New_York
10,2023-04-20T02:25:00,,,0.0,3,Device,,System Alert /Alarm,Apr 20 2023  2:25AM,False,False,True,,,,,,,SYS_ALM,SystemAlertAlarm,,,,AlertAlarm/4004Q69950/2023,4004Q69950,,America/New_York
11,2023-04-20T02:25:00,,,0.0,230,Device,,PROTECTIVE LIMIT-LOW CONDENSER WATER FLOW,Apr 20 2023  2:25AM,True,False,True,,,,,,,ALARM_04,CH_ALARM_04,,,,AlertAlarm/4004Q69950/2023,4004Q69950,,America/New_York
12,,,,,1,Device,,,4/19/2023 10:30:41 PM -04:00,True,False,False,0.0,,,,,,ALM,CH_ALARMRELAY,,,,AlertAlarm/4004Q69950/2023,4004Q69950,,America/New_York
13,,,,,1,Device,,,4/19/2023 10:55:41 PM -04:00,True,False,False,0.0,,,,,,ALM,CH_ALARMRELAY,,,,AlertAlarm/4004Q69950/2023,4004Q69950,,America/New_York
14,2023-04-20T09:45:00,,,0.0,1,Device,,Alarm Relay,Apr 20 2023  9:45AM,False,False,True,,,,,,,ALM,CH_ALARMRELAY,,,,AlertAlarm/4004Q69950/2023,4004Q69950,,America/New_York
15,,,,,1,Device,,,4/20/2023 5:50:42 AM -04:00,True,False,False,0.0,,,,,,ALM,CH_ALARMRELAY,,,,AlertAlarm/4004Q69950/2023,4004Q69950,,America/New_York
16,2023-04-20T10:15:00,,,0.0,1,Device,,Alarm Relay,Apr 20 2023 10:15AM,False,False,True,,,,,,,ALM,CH_ALARMRELAY,,,,AlertAlarm/4004Q69950/2023,4004Q69950,,America/New_York
17,,,,,1,Device,,,4/20/2023 6:20:42 AM -04:00,True,False,False,0.0,,,,,,ALM,CH_ALARMRELAY,,,,AlertAlarm/4004Q69950/2023,4004Q69950,,America/New_York
18,2023-04-20T11:40:00,,,0.0,1,Device,,Alarm Relay,Apr 20 2023 11:40AM,False,False,True,,,,,,,ALM,CH_ALARMRELAY,,,,AlertAlarm/4004Q69950/2023,4004Q69950,,America/New_York
19,2023-04-20T11:40:00,,,0.0,148,Device,,AUTORESTART PENDING-POWER LOSS,Apr 20 2023 11:40AM,False,True,True,,,,,,,ALARM_01,CH_ALARM_01,,,,AlertAlarm/4004Q69950/2023,4004Q69950,,America/New_York
20,2023-04-20T11:40:00,,,0.0,162,Device,,SENSOR ALERT-EVAPORATOR APPROACH,Apr 20 2023 11:40AM,False,True,True,,,,,,,ALARM_02,CH_ALARM_02,,,,AlertAlarm/4004Q69950/2023,4004Q69950,,America/New_York
21,2023-04-20T11:40:00,,,0.0,163,Device,,SENSOR ALERT-CONDENSER APPROACH,Apr 20 2023 11:40AM,False,True,True,,,,,,,ALARM_03,CH_ALARM_03,,,,AlertAlarm/4004Q69950/2023,4004Q69950,,America/New_York
22,2023-04-25T09:40:00,https://alarmssaveandnotifyprod.blob.core.windows.net/snapshot/vu139530540410_42/2023/4/25/10/48/VU139530540410_42_1682415614,,0.0,162,Device,,SENSOR ALERT-EVAPORATOR APPROACH,Apr 25 2023  9:40AM,False,True,False,,,,,,,ALARM_01,CH_ALARM_01,,,,AlertAlarm/4004Q69950/2023,4004Q69950,,America/New_York
23,2023-05-21T09:40:00,,,0.0,162,Device,,SENSOR ALERT-EVAPORATOR APPROACH,May 21 2023  9:40AM,False,True,True,,,,,,,ALARM_01,CH_ALARM_01,,,,AlertAlarm/4004Q69950/2023,4004Q69950,,America/New_York
24,2023-05-21T09:40:00,https://alarmssaveandnotifyprod.blob.core.windows.net/snapshot/vu139530540410_42/2023/5/21/9/40/VU139530540410_42_1684662049,,0.0,253,Device,,PROTECTIVE LIMIT-GUIDE VANE CALIBRATION,May 21 2023  9:40AM,True,False,False,,,,,,,ALARM_01,CH_ALARM_01,,,,AlertAlarm/4004Q69950/2023,4004Q69950,,America/New_York
25,,,,,3,Device,,,5/21/2023 5:41:53 AM -04:00,True,False,False,1.0,,,,,,SYS_ALM,SystemAlertAlarm,,,,AlertAlarm/4004Q69950/2023,4004Q69950,,America/New_York
26,2023-05-21T14:47:00,,,0.0,3,Device,,System Alert /Alarm,May 21 2023  2:47PM,False,False,True,,,,,,,SYS_ALM,SystemAlertAlarm,,,,AlertAlarm/4004Q69950/2023,4004Q69950,,America/New_York
27,2023-05-21T14:47:00,,,0.0,253,Device,,PROTECTIVE LIMIT-GUIDE VANE CALIBRATION,May 21 2023  2:47PM,True,False,True,,,,,,,ALARM_01,CH_ALARM_01,,,,AlertAlarm/4004Q69950/2023,4004Q69950,,America/New_York
28,2023-05-21T14:47:00,https://alarmssaveandnotifyprod.blob.core.windows.net/snapshot/vu139530540410_42/2023/5/21/15/15/VU139530540410_42_1684680459,,0.0,162,Device,,SENSOR ALERT-EVAPORATOR APPROACH,May 21 2023  2:47PM,False,True,False,,,,,,,ALARM_01,CH_ALARM_01,,,,AlertAlarm/4004Q69950/2023,4004Q69950,,America/New_York
29,,,,,1,Device,,,5/21/2023 7:51:53 AM -04:00,True,False,False,0.0,,,,,,ALM,CH_ALARMRELAY,,,,AlertAlarm/4004Q69950/2023,4004Q69950,,America/New_York
30,2023-05-21T13:16:00,,,0.0,1,Device,,Alarm Relay,May 21 2023  1:16PM,False,False,True,,,,,,,ALM,CH_ALARMRELAY,,,,AlertAlarm/4004Q69950/2023,4004Q69950,,America/New_York
31,,,,,1,Device,,,5/21/2023 9:21:54 AM -04:00,True,False,False,0.0,,,,,,ALM,CH_ALARMRELAY,,,,AlertAlarm/4004Q69950/2023,4004Q69950,,America/New_York
32,2023-05-21T14:01:00,,,0.0,1,Device,,Alarm Relay,May 21 2023  2:01PM,False,False,True,,,,,,,ALM,CH_ALARMRELAY,,,,AlertAlarm/4004Q69950/2023,4004Q69950,,America/New_York
33,2023-05-27T10:35:00,https://alarmssaveandnotifyprod.blob.core.windows.net/snapshot/vu139530540410_42/2023/5/27/10/48/VU139530540410_42_1685183709,,0.0,163,Device,,SENSOR ALERT-CONDENSER APPROACH,May 27 2023 10:35AM,False,True,False,,,,,,,ALARM_02,CH_ALARM_02,,,,AlertAlarm/4004Q69950/2023,4004Q69950,,America/New_York
34,2023-06-06T10:40:00,,,0.0,163,Device,,SENSOR ALERT-CONDENSER APPROACH,Jun  6 2023 10:40AM,False,True,True,,,,,,,ALARM_02,CH_ALARM_02,,,,AlertAlarm/4004Q69950/2023,4004Q69950,,America/New_York
35,2023-06-18T14:35:00,https://alarmssaveandnotifyprod.blob.core.windows.net/snapshot/vu139530540410_42/2023/6/18/16/56/VU139530540410_42_1687098927,,0.0,120,Device,,RUN CAPACITY LIMITED-HIGH CONDENSER PRESSURE,Jun 18 2023  2:35PM,False,True,False,,,,,,,ALARM_03,CH_ALARM_03,,,,AlertAlarm/4004Q69950/2023,4004Q69950,,America/New_York
36,2023-06-09T15:15:00,https://alarmssaveandnotifyprod.blob.core.windows.net/snapshot/vu139530540410_42/2023/6/18/16/56/VU139530540410_42_1686323703,,0.0,123,Device,,RUN CAPACITY LIMITED-HIGH COMPRESSOR LIFT,Jun  9 2023  3:15PM,False,True,False,,,,,,,ALARM_02,CH_ALARM_02,,,,AlertAlarm/4004Q69950/2023,4004Q69950,,America/New_York
37,,,,,2,Device,,,6/18/2023 10:41:09 AM -04:00,False,True,False,1.0,,,,,,SYS_ALM,SystemAlertAlarm,,,,AlertAlarm/4004Q69950/2023,4004Q69950,,America/New_York
38,2023-06-18T17:01:00,,,0.0,2,Device,,System Alert /Alarm,Jun 18 2023  5:01PM,False,False,True,,,,,,,SYS_ALM,SystemAlertAlarm,,,,AlertAlarm/4004Q69950/2023,4004Q69950,,America/New_York
39,2023-06-18T17:01:00,,,0.0,162,Device,,SENSOR ALERT-EVAPORATOR APPROACH,Jun 18 2023  5:01PM,False,True,True,,,,,,,ALARM_01,CH_ALARM_01,,,,AlertAlarm/4004Q69950/2023,4004Q69950,,America/New_York
40,2023-06-18T17:01:00,,,0.0,123,Device,,RUN CAPACITY LIMITED-HIGH COMPRESSOR LIFT,Jun 18 2023  5:01PM,False,True,True,,,,,,,ALARM_02,CH_ALARM_02,,,,AlertAlarm/4004Q69950/2023,4004Q69950,,America/New_York
41,2023-06-18T22:33:00,,,0.0,120,Device,,RUN CAPACITY LIMITED-HIGH CONDENSER PRESSURE,Jun 18 2023 10:33PM,False,True,True,,,,,,,ALARM_03,CH_ALARM_03,,,,AlertAlarm/4004Q69950/2023,4004Q69950,,America/New_York
42,,,,,2,Device,,,6/19/2023 9:24:01 AM -04:00,False,True,False,1.0,,,,,,SYS_ALM,SystemAlertAlarm,,,,AlertAlarm/4004Q69950/2023,4004Q69950,,America/New_York
43,2023-06-19T16:34:00,,,0.0,2,Device,,System Alert /Alarm,Jun 19 2023  4:34PM,False,False,True,,,,,,,SYS_ALM,SystemAlertAlarm,,,,AlertAlarm/4004Q69950/2023,4004Q69950,,America/New_York
44,,,,,2,Device,,,6/19/2023 1:34:02 PM -04:00,False,True,False,1.0,,,,,,SYS_ALM,SystemAlertAlarm,,,,AlertAlarm/4004Q69950/2023,4004Q69950,,America/New_York
45,,,,,2,Device,,,6/19/2023 2:24:02 PM -04:00,False,True,False,1.0,,,,,,SYS_ALM,SystemAlertAlarm,,,,AlertAlarm/4004Q69950/2023,4004Q69950,,America/New_York
46,2023-06-19T18:19:00,,,0.0,2,Device,,System Alert /Alarm,Jun 19 2023  6:19PM,False,False,True,,,,,,,SYS_ALM,SystemAlertAlarm,,,,AlertAlarm/4004Q69950/2023,4004Q69950,,America/New_York
47,2023-06-19T18:54:00,,,0.0,2,Device,,System Alert /Alarm,Jun 19 2023  6:54PM,False,False,True,,,,,,,SYS_ALM,SystemAlertAlarm,,,,AlertAlarm/4004Q69950/2023,4004Q69950,,America/New_York
48,,,,,2,Device,,,6/20/2023 10:34:05 AM -04:00,False,True,False,1.0,,,,,,SYS_ALM,SystemAlertAlarm,,,,AlertAlarm/4004Q69950/2023,4004Q69950,,America/New_York
49,2023-06-20T16:34:00,,,0.0,2,Device,,System Alert /Alarm,Jun 20 2023  4:34PM,False,False,True,,,,,,,SYS_ALM,SystemAlertAlarm,,,,AlertAlarm/4004Q69950/2023,4004Q69950,,America/New_York
50,,,,,2,Device,,,6/20/2023 12:39:06 PM -04:00,False,True,False,1.0,,,,,,SYS_ALM,SystemAlertAlarm,,,,AlertAlarm/4004Q69950/2023,4004Q69950,,America/New_York
51,2023-06-20T16:44:00,,,0.0,2,Device,,System Alert /Alarm,Jun 20 2023  4:44PM,False,False,True,,,,,,,SYS_ALM,SystemAlertAlarm,,,,AlertAlarm/4004Q69950/2023,4004Q69950,,America/New_York
52,,,,,2,Device,,,6/22/2023 12:04:13 PM -04:00,False,True,False,1.0,,,,,,SYS_ALM,SystemAlertAlarm,,,,AlertAlarm/4004Q69950/2023,4004Q69950,,America/New_York
53,2023-06-22T16:49:00,,,0.0,2,Device,,System Alert /Alarm,Jun 22 2023  4:49PM,False,False,True,,,,,,,SYS_ALM,SystemAlertAlarm,,,,AlertAlarm/4004Q69950/2023,4004Q69950,,America/New_York
54,,,,,2,Device,,,6/22/2023 12:54:13 PM -04:00,False,True,False,1.0,,,,,,SYS_ALM,SystemAlertAlarm,,,,AlertAlarm/4004Q69950/2023,4004Q69950,,America/New_York
55,2023-06-22T18:59:00,,,0.0,2,Device,,System Alert /Alarm,Jun 22 2023  6:59PM,False,False,True,,,,,,,SYS_ALM,SystemAlertAlarm,,,,AlertAlarm/4004Q69950/2023,4004Q69950,,America/New_York
56,,,,,2,Device,,,6/24/2023 5:19:23 PM -04:00,False,True,False,1.0,,,,,,SYS_ALM,SystemAlertAlarm,,,,AlertAlarm/4004Q69950/2023,4004Q69950,,America/New_York
57,2023-06-24T21:59:00,,,0.0,2,Device,,System Alert /Alarm,Jun 24 2023  9:59PM,False,False,True,,,,,,,SYS_ALM,SystemAlertAlarm,,,,AlertAlarm/4004Q69950/2023,4004Q69950,,America/New_York
58,2023-06-25T09:29:00,https://alarmssaveandnotifyprod.blob.core.windows.net/snapshot/vu139530540410_42/2023/6/25/11/1/VU139530540410_42_1687685389,,0.0,120,Device,,RUN CAPACITY LIMITED-HIGH CONDENSER PRESSURE,Jun 25 2023  9:29AM,False,True,False,,,,,,,ALARM_01,CH_ALARM_01,,,,AlertAlarm/4004Q69950/2023,4004Q69950,,America/New_York
59,2023-06-25T09:29:00,https://alarmssaveandnotifyprod.blob.core.windows.net/snapshot/vu139530540410_42/2023/6/25/11/1/VU139530540410_42_1687685389,,0.0,163,Device,,SENSOR ALERT-CONDENSER APPROACH,Jun 25 2023  9:29AM,False,True,False,,,,,,,ALARM_02,CH_ALARM_02,,,,AlertAlarm/4004Q69950/2023,4004Q69950,,America/New_York
60,,,,,2,Device,,,6/26/2023 11:04:29 AM -04:00,False,True,False,1.0,,,,,,SYS_ALM,SystemAlertAlarm,,,,AlertAlarm/4004Q69950/2023,4004Q69950,,America/New_York
61,2023-06-26T15:29:00,,,0.0,2,Device,,System Alert /Alarm,Jun 26 2023  3:29PM,False,False,True,,,,,,,SYS_ALM,SystemAlertAlarm,,,,AlertAlarm/4004Q69950/2023,4004Q69950,,America/New_York
62,2023-06-26T15:29:00,,,0.0,120,Device,,RUN CAPACITY LIMITED-HIGH CONDENSER PRESSURE,Jun 26 2023  3:29PM,False,True,True,,,,,,,ALARM_01,CH_ALARM_01,,,,AlertAlarm/4004Q69950/2023,4004Q69950,,America/New_York
63,2023-06-26T15:29:00,,,0.0,163,Device,,SENSOR ALERT-CONDENSER APPROACH,Jun 26 2023  3:29PM,False,True,True,,,,,,,ALARM_02,CH_ALARM_02,,,,AlertAlarm/4004Q69950/2023,4004Q69950,,America/New_York
64,,,,,2,Device,,,6/26/2023 11:34:30 AM -04:00,False,True,False,1.0,,,,,,SYS_ALM,SystemAlertAlarm,,,,AlertAlarm/4004Q69950/2023,4004Q69950,,America/New_York
65,2023-06-26T15:44:00,,,0.0,2,Device,,System Alert /Alarm,Jun 26 2023  3:44PM,False,False,True,,,,,,,SYS_ALM,SystemAlertAlarm,,,,AlertAlarm/4004Q69950/2023,4004Q69950,,America/New_York
66,2023-06-27T14:10:00,https://alarmssaveandnotifyprod.blob.core.windows.net/snapshot/vu139530540410_42/2023/6/27/14/34/VU139530540410_42_1687875059,,0.0,120,Device,,RUN CAPACITY LIMITED-HIGH CONDENSER PRESSURE,Jun 27 2023  2:10PM,False,True,False,,,,,,,ALARM_01,CH_ALARM_01,,,,AlertAlarm/4004Q69950/2023,4004Q69950,,America/New_York
67,2023-06-27T14:10:00,https://alarmssaveandnotifyprod.blob.core.windows.net/snapshot/vu139530540410_42/2023/6/27/14/34/VU139530540410_42_1687875059,,0.0,163,Device,,SENSOR ALERT-CONDENSER APPROACH,Jun 27 2023  2:10PM,False,True,False,,,,,,,ALARM_02,CH_ALARM_02,,,,AlertAlarm/4004Q69950/2023,4004Q69950,,America/New_York
68,2023-06-27T14:10:00,https://alarmssaveandnotifyprod.blob.core.windows.net/snapshot/vu139530540410_42/2023/6/27/14/34/VU139530540410_42_1687875059,,0.0,162,Device,,SENSOR ALERT-EVAPORATOR APPROACH,Jun 27 2023  2:10PM,False,True,False,,,,,,,ALARM_03,CH_ALARM_03,,,,AlertAlarm/4004Q69950/2023,4004Q69950,,America/New_York
69,2023-06-27T21:25:00,https://alarmssaveandnotifyprod.blob.core.windows.net/snapshot/vu139530540410_42/2023/6/27/21/25/VU139530540410_42_1687901129,,0.0,123,Device,,RUN CAPACITY LIMITED-HIGH COMPRESSOR LIFT,Jun 27 2023  9:25PM,False,True,False,,,,,,,ALARM_04,CH_ALARM_04,,,,AlertAlarm/4004Q69950/2023,4004Q69950,,America/New_York
70,2023-06-28T21:49:00,,,0.0,120,Device,,RUN CAPACITY LIMITED-HIGH CONDENSER PRESSURE,Jun 28 2023  9:49PM,False,True,True,,,,,,,ALARM_01,CH_ALARM_01,,,,AlertAlarm/4004Q69950/2023,4004Q69950,,America/New_York
71,2023-06-28T21:49:00,,,0.0,163,Device,,SENSOR ALERT-CONDENSER APPROACH,Jun 28 2023  9:49PM,False,True,True,,,,,,,ALARM_02,CH_ALARM_02,,,,AlertAlarm/4004Q69950/2023,4004Q69950,,America/New_York
72,2023-06-28T21:49:00,,,0.0,162,Device,,SENSOR ALERT-EVAPORATOR APPROACH,Jun 28 2023  9:49PM,False,True,True,,,,,,,ALARM_03,CH_ALARM_03,,,,AlertAlarm/4004Q69950/2023,4004Q69950,,America/New_York
73,2023-06-28T21:49:00,,,0.0,123,Device,,RUN CAPACITY LIMITED-HIGH COMPRESSOR LIFT,Jun 28 2023  9:49PM,False,True,True,,,,,,,ALARM_04,CH_ALARM_04,,,,AlertAlarm/4004Q69950/2023,4004Q69950,,America/New_York
74,,,,,2,Device,,,6/28/2023 5:44:39 PM -04:00,False,True,False,1.0,,,,,,SYS_ALM,SystemAlertAlarm,,,,AlertAlarm/4004Q69950/2023,4004Q69950,,America/New_York
75,,,,,2,Device,,,6/28/2023 5:54:39 PM -04:00,False,True,False,1.0,,,,,,SYS_ALM,SystemAlertAlarm,,,,AlertAlarm/4004Q69950/2023,4004Q69950,,America/New_York
76,2023-06-28T22:09:00,,,0.0,2,Device,,System Alert /Alarm,Jun 28 2023 10:09PM,False,False,True,,,,,,,SYS_ALM,SystemAlertAlarm,,,,AlertAlarm/4004Q69950/2023,4004Q69950,,America/New_York
77,2023-07-05T09:56:00,https://alarmssaveandnotifyprod.blob.core.windows.net/snapshot/vu139530540410_42/2023/7/5/9/56/VU139530540410_42_1688550980,,0.0,150,Device,,SENSOR ALERT-HIGH BEARING TEMPERATURE,Jul  5 2023  9:56AM,False,True,False,,,,,,,ALARM_01,CH_ALARM_01,,,,AlertAlarm/4004Q69950/2023,4004Q69950,,America/New_York
78,2023-07-05T10:13:00,https://alarmssaveandnotifyprod.blob.core.windows.net/snapshot/vu139530540410_42/2023/7/5/11/1/VU139530540410_42_1688552014,,0.0,120,Device,,RUN CAPACITY LIMITED-HIGH CONDENSER PRESSURE,Jul  5 2023 10:13AM,False,True,False,,,,,,,ALARM_02,CH_ALARM_02,,,,AlertAlarm/4004Q69950/2023,4004Q69950,,America/New_York
79,2023-07-05T10:25:00,,,0.0,150,Device,,SENSOR ALERT-HIGH BEARING TEMPERATURE,Jul  5 2023 10:25AM,False,True,True,,,,,,,ALARM_01,CH_ALARM_01,,,,AlertAlarm/4004Q69950/2023,4004Q69950,,America/New_York
80,2023-07-05T10:25:00,,,0.0,120,Device,,RUN CAPACITY LIMITED-HIGH CONDENSER PRESSURE,Jul  5 2023 10:25AM,False,True,True,,,,,,,ALARM_02,CH_ALARM_02,,,,AlertAlarm/4004Q69950/2023,4004Q69950,,America/New_York
81,,,,,2,Device,,,7/5/2023 6:15:38 AM -04:00,False,True,False,1.0,,,,,,SYS_ALM,SystemAlertAlarm,,,,AlertAlarm/4004Q69950/2023,4004Q69950,,America/New_York
82,2023-07-09T13:12:00,,,0.0,2,Device,,System Alert /Alarm,Jul  9 2023  1:12PM,False,False,True,,,,,,,SYS_ALM,SystemAlertAlarm,,,,AlertAlarm/4004Q69950/2023,4004Q69950,,America/New_York
83,2023-07-09T13:12:00,https://alarmssaveandnotifyprod.blob.core.windows.net/snapshot/vu139530540410_42/2023/7/9/13/26/VU139530540410_42_1688908342,,0.0,150,Device,,SENSOR ALERT-HIGH BEARING TEMPERATURE,Jul  9 2023  1:12PM,False,True,False,,,,,,,ALARM_01,CH_ALARM_01,,,,AlertAlarm/4004Q69950/2023,4004Q69950,,America/New_York
84,2023-07-09T13:12:00,https://alarmssaveandnotifyprod.blob.core.windows.net/snapshot/vu139530540410_42/2023/7/9/13/26/VU139530540410_42_1688908342,,0.0,120,Device,,RUN CAPACITY LIMITED-HIGH CONDENSER PRESSURE,Jul  9 2023  1:12PM,False,True,False,,,,,,,ALARM_02,CH_ALARM_02,,,,AlertAlarm/4004Q69950/2023,4004Q69950,,America/New_York
85,2023-07-09T13:12:00,https://alarmssaveandnotifyprod.blob.core.windows.net/snapshot/vu139530540410_42/2023/7/9/13/26/VU139530540410_42_1688908342,,0.0,123,Device,,RUN CAPACITY LIMITED-HIGH COMPRESSOR LIFT,Jul  9 2023  1:12PM,False,True,False,,,,,,,ALARM_03,CH_ALARM_03,,,,AlertAlarm/4004Q69950/2023,4004Q69950,,America/New_York
86,,,,,2,Device,,,7/9/2023 9:15:55 AM -04:00,False,True,False,1.0,,,,,,SYS_ALM,SystemAlertAlarm,,,,AlertAlarm/4004Q69950/2023,4004Q69950,,America/New_York
87,2023-07-09T14:10:00,,,0.0,2,Device,,System Alert /Alarm,Jul  9 2023  2:10PM,False,False,True,,,,,,,SYS_ALM,SystemAlertAlarm,,,,AlertAlarm/4004Q69950/2023,4004Q69950,,America/New_York
88,2023-07-09T14:10:00,,,0.0,150,Device,,SENSOR ALERT-HIGH BEARING TEMPERATURE,Jul  9 2023  2:10PM,False,True,True,,,,,,,ALARM_01,CH_ALARM_01,,,,AlertAlarm/4004Q69950/2023,4004Q69950,,America/New_York
89,2023-07-09T14:10:00,,,0.0,120,Device,,RUN CAPACITY LIMITED-HIGH CONDENSER PRESSURE,Jul  9 2023  2:10PM,False,True,True,,,,,,,ALARM_02,CH_ALARM_02,,,,AlertAlarm/4004Q69950/2023,4004Q69950,,America/New_York
90,2023-07-09T14:10:00,,,0.0,123,Device,,RUN CAPACITY LIMITED-HIGH COMPRESSOR LIFT,Jul  9 2023  2:10PM,False,True,True,,,,,,,ALARM_03,CH_ALARM_03,,,,AlertAlarm/4004Q69950/2023,4004Q69950,,America/New_York
91,,,,,2,Device,,,7/9/2023 12:00:55 PM -04:00,False,True,False,1.0,,,,,,SYS_ALM,SystemAlertAlarm,,,,AlertAlarm/4004Q69950/2023,4004Q69950,,America/New_York
92,2023-07-09T16:25:00,,,0.0,2,Device,,System Alert /Alarm,Jul  9 2023  4:25PM,False,False,True,,,,,,,SYS_ALM,SystemAlertAlarm,,,,AlertAlarm/4004Q69950/2023,4004Q69950,,America/New_York
93,2023-07-09T18:21:00,https://alarmssaveandnotifyprod.blob.core.windows.net/snapshot/vu139530540410_42/2023/7/9/18/34/VU139530540410_42_1688926866,,0.0,150,Device,,SENSOR ALERT-HIGH BEARING TEMPERATURE,Jul  9 2023  6:21PM,False,True,False,,,,,,,ALARM_01,CH_ALARM_01,,,,AlertAlarm/4004Q69950/2023,4004Q69950,,America/New_York
94,2023-07-09T18:21:00,https://alarmssaveandnotifyprod.blob.core.windows.net/snapshot/vu139530540410_42/2023/7/9/18/34/VU139530540410_42_1688926866,,0.0,120,Device,,RUN CAPACITY LIMITED-HIGH CONDENSER PRESSURE,Jul  9 2023  6:21PM,False,True,False,,,,,,,ALARM_02,CH_ALARM_02,,,,AlertAlarm/4004Q69950/2023,4004Q69950,,America/New_York
95,2023-07-09T18:21:00,https://alarmssaveandnotifyprod.blob.core.windows.net/snapshot/vu139530540410_42/2023/7/9/18/34/VU139530540410_42_1688926866,,0.0,123,Device,,RUN CAPACITY LIMITED-HIGH COMPRESSOR LIFT,Jul  9 2023  6:21PM,False,True,False,,,,,,,ALARM_03,CH_ALARM_03,,,,AlertAlarm/4004Q69950/2023,4004Q69950,,America/New_York
96,2023-07-09T18:21:00,https://alarmssaveandnotifyprod.blob.core.windows.net/snapshot/vu139530540410_42/2023/7/9/18/34/VU139530540410_42_1688926866,,0.0,162,Device,,SENSOR ALERT-EVAPORATOR APPROACH,Jul  9 2023  6:21PM,False,True,False,,,,,,,ALARM_04,CH_ALARM_04,,,,AlertAlarm/4004Q69950/2023,4004Q69950,,America/New_York
97,2023-07-10T21:31:00,,,0.0,150,Device,,SENSOR ALERT-HIGH BEARING TEMPERATURE,Jul 10 2023  9:31PM,False,True,True,,,,,,,ALARM_01,CH_ALARM_01,,,,AlertAlarm/4004Q69950/2023,4004Q69950,,America/New_York
98,2023-07-10T21:31:00,,,0.0,120,Device,,RUN CAPACITY LIMITED-HIGH CONDENSER PRESSURE,Jul 10 2023  9:31PM,False,True,True,,,,,,,ALARM_02,CH_ALARM_02,,,,AlertAlarm/4004Q69950/2023,4004Q69950,,America/New_York
99,2023-07-10T21:31:00,,,0.0,123,Device,,RUN CAPACITY LIMITED-HIGH COMPRESSOR LIFT,Jul 10 2023  9:31PM,False,True,True,,,,,,,ALARM_03,CH_ALARM_03,,,,AlertAlarm/4004Q69950/2023,4004Q69950,,America/New_York
100,2023-07-10T21:31:00,,,0.0,162,Device,,SENSOR ALERT-EVAPORATOR APPROACH,Jul 10 2023  9:31PM,False,True,True,,,,,,,ALARM_04,CH_ALARM_04,,,,AlertAlarm/4004Q69950/2023,4004Q69950,,America/New_York
101,,,,,2,Device,,,7/10/2023 5:26:00 PM -04:00,False,True,False,1.0,,,,,,SYS_ALM,SystemAlertAlarm,,,,AlertAlarm/4004Q69950/2023,4004Q69950,,America/New_York
102,,,,,2,Device,,,7/14/2023 4:51:16 PM -04:00,False,True,False,1.0,,,,,,SYS_ALM,SystemAlertAlarm,,,,AlertAlarm/4004Q69950/2023,4004Q69950,,America/New_York
103,,,,,2,Device,,,7/15/2023 10:51:19 AM -04:00,False,True,False,1.0,,,,,,SYS_ALM,SystemAlertAlarm,,,,AlertAlarm/4004Q69950/2023,4004Q69950,,America/New_York
104,,,,,2,Device,,,7/15/2023 4:51:20 PM -04:00,False,True,False,1.0,,,,,,SYS_ALM,SystemAlertAlarm,,,,AlertAlarm/4004Q69950/2023,4004Q69950,,America/New_York
105,2023-07-15T21:06:00,,,0.0,2,Device,,System Alert /Alarm,Jul 15 2023  9:06PM,False,False,True,,,,,,,SYS_ALM,SystemAlertAlarm,,,,AlertAlarm/4004Q69950/2023,4004Q69950,,America/New_York
106,,,,,2,Device,,,7/15/2023 10:11:22 PM -04:00,False,True,False,1.0,,,,,,SYS_ALM,SystemAlertAlarm,,,,AlertAlarm/4004Q69950/2023,4004Q69950,,America/New_York
107,2023-07-16T02:16:00,,,0.0,2,Device,,System Alert /Alarm,Jul 16 2023  2:16AM,False,False,True,,,,,,,SYS_ALM,SystemAlertAlarm,,,,AlertAlarm/4004Q69950/2023,4004Q69950,,America/New_York
108,2023-07-16T22:27:00,https://alarmssaveandnotifyprod.blob.core.windows.net/snapshot/vu139530540410_42/2023/7/16/22/27/VU139530540410_42_1689546448,,0.0,123,Device,,RUN CAPACITY LIMITED-HIGH COMPRESSOR LIFT,Jul 16 2023 10:27PM,False,True,False,,,,,,,ALARM_01,CH_ALARM_01,,,,AlertAlarm/4004Q69950/2023,4004Q69950,,America/New_York
109,,,,,2,Device,,,7/16/2023 6:30:43 PM -04:00,False,True,False,1.0,,,,,,SYS_ALM,SystemAlertAlarm,,,,AlertAlarm/4004Q69950/2023,4004Q69950,,America/New_York
110,2023-07-16T23:15:00,,,0.0,2,Device,,System Alert /Alarm,Jul 16 2023 11:15PM,False,False,True,,,,,,,SYS_ALM,SystemAlertAlarm,,,,AlertAlarm/4004Q69950/2023,4004Q69950,,America/New_York
111,2023-07-16T23:15:00,,,0.0,123,Device,,RUN CAPACITY LIMITED-HIGH COMPRESSOR LIFT,Jul 16 2023 11:15PM,False,True,True,,,,,,,ALARM_01,CH_ALARM_01,,,,AlertAlarm/4004Q69950/2023,4004Q69950,,America/New_York
112,,,,,2,Device,,,7/17/2023 5:25:47 PM -04:00,False,True,False,1.0,,,,,,SYS_ALM,SystemAlertAlarm,,,,AlertAlarm/4004Q69950/2023,4004Q69950,,America/New_York
113,2023-07-17T21:35:00,,,0.0,2,Device,,System Alert /Alarm,Jul 17 2023  9:35PM,False,False,True,,,,,,,SYS_ALM,SystemAlertAlarm,,,,AlertAlarm/4004Q69950/2023,4004Q69950,,America/New_York
114,2023-07-18T21:40:00,https://alarmssaveandnotifyprod.blob.core.windows.net/snapshot/vu139530540410_42/2023/7/18/21/58/VU139530540410_42_1689716404,,0.0,123,Device,,RUN CAPACITY LIMITED-HIGH COMPRESSOR LIFT,Jul 18 2023  9:40PM,False,True,False,,,,,,,ALARM_01,CH_ALARM_01,,,,AlertAlarm/4004Q69950/2023,4004Q69950,,America/New_York
115,2023-07-18T21:40:00,https://alarmssaveandnotifyprod.blob.core.windows.net/snapshot/vu139530540410_42/2023/7/18/21/58/VU139530540410_42_1689716404,,0.0,162,Device,,SENSOR ALERT-EVAPORATOR APPROACH,Jul 18 2023  9:40PM,False,True,False,,,,,,,ALARM_02,CH_ALARM_02,,,,AlertAlarm/4004Q69950/2023,4004Q69950,,America/New_York
116,,,,,2,Device,,,7/18/2023 5:25:50 PM -04:00,False,True,False,1.0,,,,,,SYS_ALM,SystemAlertAlarm,,,,AlertAlarm/4004Q69950/2023,4004Q69950,,America/New_York
117,,,,,2,Device,,,7/19/2023 5:25:54 PM -04:00,False,True,False,1.0,,,,,,SYS_ALM,SystemAlertAlarm,,,,AlertAlarm/4004Q69950/2023,4004Q69950,,America/New_York
118,2023-07-19T21:30:00,,,0.0,2,Device,,System Alert /Alarm,Jul 19 2023  9:30PM,False,False,True,,,,,,,SYS_ALM,SystemAlertAlarm,,,,AlertAlarm/4004Q69950/2023,4004Q69950,,America/New_York
119,2023-07-19T21:30:00,,,0.0,123,Device,,RUN CAPACITY LIMITED-HIGH COMPRESSOR LIFT,Jul 19 2023  9:30PM,False,True,True,,,,,,,ALARM_01,CH_ALARM_01,,,,AlertAlarm/4004Q69950/2023,4004Q69950,,America/New_York
120,2023-07-19T21:30:00,,,0.0,162,Device,,SENSOR ALERT-EVAPORATOR APPROACH,Jul 19 2023  9:30PM,False,True,True,,,,,,,ALARM_02,CH_ALARM_02,,,,AlertAlarm/4004Q69950/2023,4004Q69950,,America/New_York
121,2023-07-20T10:13:00,https://alarmssaveandnotifyprod.blob.core.windows.net/snapshot/vu139530540410_42/2023/7/20/10/14/VU139530540410_42_1689848038,,0.0,123,Device,,RUN CAPACITY LIMITED-HIGH COMPRESSOR LIFT,Jul 20 2023 10:13AM,False,True,False,,,,,,,ALARM_01,CH_ALARM_01,,,,AlertAlarm/4004Q69950/2023,4004Q69950,,America/New_York
122,2023-07-20T10:13:00,https://alarmssaveandnotifyprod.blob.core.windows.net/snapshot/vu139530540410_42/2023/7/20/10/14/VU139530540410_42_1689848038,,0.0,162,Device,,SENSOR ALERT-EVAPORATOR APPROACH,Jul 20 2023 10:13AM,False,True,False,,,,,,,ALARM_02,CH_ALARM_02,,,,AlertAlarm/4004Q69950/2023,4004Q69950,,America/New_York
123,2023-07-20T10:13:00,https://alarmssaveandnotifyprod.blob.core.windows.net/snapshot/vu139530540410_42/2023/7/20/10/14/VU139530540410_42_1689848038,,0.0,120,Device,,RUN CAPACITY LIMITED-HIGH CONDENSER PRESSURE,Jul 20 2023 10:13AM,False,True,False,,,,,,,ALARM_03,CH_ALARM_03,,,,AlertAlarm/4004Q69950/2023,4004Q69950,,America/New_York
124,,,,,2,Device,,,7/20/2023 6:15:56 AM -04:00,False,True,False,1.0,,,,,,SYS_ALM,SystemAlertAlarm,,,,AlertAlarm/4004Q69950/2023,4004Q69950,,America/New_York
125,2023-07-20T10:35:00,,,0.0,2,Device,,System Alert /Alarm,Jul 20 2023 10:35AM,False,False,True,,,,,,,SYS_ALM,SystemAlertAlarm,,,,AlertAlarm/4004Q69950/2023,4004Q69950,,America/New_York
126,2023-07-20T10:35:00,,,0.0,123,Device,,RUN CAPACITY LIMITED-HIGH COMPRESSOR LIFT,Jul 20 2023 10:35AM,False,True,True,,,,,,,ALARM_01,CH_ALARM_01,,,,AlertAlarm/4004Q69950/2023,4004Q69950,,America/New_York
127,2023-07-20T10:35:00,,,0.0,162,Device,,SENSOR ALERT-EVAPORATOR APPROACH,Jul 20 2023 10:35AM,False,True,True,,,,,,,ALARM_02,CH_ALARM_02,,,,AlertAlarm/4004Q69950/2023,4004Q69950,,America/New_York
128,2023-07-20T10:35:00,,,0.0,120,Device,,RUN CAPACITY LIMITED-HIGH CONDENSER PRESSURE,Jul 20 2023 10:35AM,False,True,True,,,,,,,ALARM_03,CH_ALARM_03,,,,AlertAlarm/4004Q69950/2023,4004Q69950,,America/New_York
129,2023-07-20T22:25:00,,,0.0,2,Device,,System Alert /Alarm,Jul 20 2023 10:25PM,False,False,True,,,,,,,SYS_ALM,SystemAlertAlarm,,,,AlertAlarm/4004Q69950/2023,4004Q69950,,America/New_York
130,,,,,2,Device,,,7/20/2023 6:20:58 PM -04:00,False,True,False,1.0,,,,,,SYS_ALM,SystemAlertAlarm,,,,AlertAlarm/4004Q69950/2023,4004Q69950,,America/New_York
131,,,,,2,Device,,,7/22/2023 4:41:06 PM -04:00,False,True,False,1.0,,,,,,SYS_ALM,SystemAlertAlarm,,,,AlertAlarm/4004Q69950/2023,4004Q69950,,America/New_York
132,2023-07-22T20:46:00,,,0.0,2,Device,,System Alert /Alarm,Jul 22 2023  8:46PM,False,False,True,,,,,,,SYS_ALM,SystemAlertAlarm,,,,AlertAlarm/4004Q69950/2023,4004Q69950,,America/New_York
133,,,,,2,Device,,,7/25/2023 5:26:18 PM -04:00,False,True,False,1.0,,,,,,SYS_ALM,SystemAlertAlarm,,,,AlertAlarm/4004Q69950/2023,4004Q69950,,America/New_York
134,2023-07-25T21:36:00,,,0.0,2,Device,,System Alert /Alarm,Jul 25 2023  9:36PM,False,False,True,,,,,,,SYS_ALM,SystemAlertAlarm,,,,AlertAlarm/4004Q69950/2023,4004Q69950,,America/New_York
135,,,,,2,Device,,,7/26/2023 5:26:22 PM -04:00,False,True,False,1.0,,,,,,SYS_ALM,SystemAlertAlarm,,,,AlertAlarm/4004Q69950/2023,4004Q69950,,America/New_York
136,2023-07-26T21:36:00,,,0.0,2,Device,,System Alert /Alarm,Jul 26 2023  9:36PM,False,False,True,,,,,,,SYS_ALM,SystemAlertAlarm,,,,AlertAlarm/4004Q69950/2023,4004Q69950,,America/New_York
137,,,,,2,Device,,,7/28/2023 5:56:30 PM -04:00,False,True,False,1.0,,,,,,SYS_ALM,SystemAlertAlarm,,,,AlertAlarm/4004Q69950/2023,4004Q69950,,America/New_York
138,2023-07-28T22:11:00,,,0.0,2,Device,,System Alert /Alarm,Jul 28 2023 10:11PM,False,False,True,,,,,,,SYS_ALM,SystemAlertAlarm,,,,AlertAlarm/4004Q69950/2023,4004Q69950,,America/New_York
139,,,,,2,Device,,,7/28/2023 6:46:30 PM -04:00,False,True,False,1.0,,,,,,SYS_ALM,SystemAlertAlarm,,,,AlertAlarm/4004Q69950/2023,4004Q69950,,America/New_York
140,2023-07-28T22:51:00,,,0.0,2,Device,,System Alert /Alarm,Jul 28 2023 10:51PM,False,False,True,,,,,,,SYS_ALM,SystemAlertAlarm,,,,AlertAlarm/4004Q69950/2023,4004Q69950,,America/New_York
141,,,,,2,Device,,,7/30/2023 12:01:37 PM -04:00,False,True,False,1.0,,,,,,SYS_ALM,SystemAlertAlarm,,,,AlertAlarm/4004Q69950/2023,4004Q69950,,America/New_York
142,2023-07-30T16:21:00,,,0.0,2,Device,,System Alert /Alarm,Jul 30 2023  4:21PM,False,False,True,,,,,,,SYS_ALM,SystemAlertAlarm,,,,AlertAlarm/4004Q69950/2023,4004Q69950,,America/New_York
143,2023-07-30T18:02:00,https://alarmssaveandnotifyprod.blob.core.windows.net/snapshot/vu139530540410_42/2023/7/30/18/3/VU139530540410_42_1690740175,,0.0,162,Device,,SENSOR ALERT-EVAPORATOR APPROACH,Jul 30 2023  6:02PM,False,True,False,,,,,,,ALARM_01,CH_ALARM_01,,,,AlertAlarm/4004Q69950/2023,4004Q69950,,America/New_York
144,2023-08-01T10:58:00,https://alarmssaveandnotifyprod.blob.core.windows.net/snapshot/vu139530540410_42/2023/8/1/10/58/VU139530540410_42_1690887530,,0.0,150,Device,,SENSOR ALERT-HIGH BEARING TEMPERATURE,Aug  1 2023 10:58AM,False,True,False,,,,,,,ALARM_02,CH_ALARM_02,,,,AlertAlarm/4004Q69950/2023,4004Q69950,,America/New_York
145,2023-08-02T21:51:00,https://alarmssaveandnotifyprod.blob.core.windows.net/snapshot/vu139530540410_42/2023/8/3/1/51/VU139530540410_42_1691013066,,0.0,123,Device,,RUN CAPACITY LIMITED-HIGH COMPRESSOR LIFT,Aug  2 2023  9:51PM,False,True,False,,,,,,,ALARM_03,CH_ALARM_03,,,,AlertAlarm/4004Q69950/2023,4004Q69950,,America/New_York
146,,,,,2,Device,,,8/3/2023 5:54:12 PM -04:00,False,True,False,1.0,,,,,,SYS_ALM,SystemAlertAlarm,,,,AlertAlarm/4004Q69950/2023,4004Q69950,,America/New_York
147,2023-08-03T22:04:00,,,0.0,2,Device,,System Alert /Alarm,Aug  3 2023 10:04PM,False,False,True,,,,,,,SYS_ALM,SystemAlertAlarm,,,,AlertAlarm/4004Q69950/2023,4004Q69950,,America/New_York
148,2023-08-03T22:04:00,,,0.0,162,Device,,SENSOR ALERT-EVAPORATOR APPROACH,Aug  3 2023 10:04PM,False,True,True,,,,,,,ALARM_01,CH_ALARM_01,,,,AlertAlarm/4004Q69950/2023,4004Q69950,,America/New_York
149,2023-08-03T22:04:00,,,0.0,150,Device,,SENSOR ALERT-HIGH BEARING TEMPERATURE,Aug  3 2023 10:04PM,False,True,True,,,,,,,ALARM_02,CH_ALARM_02,,,,AlertAlarm/4004Q69950/2023,4004Q69950,,America/New_York
150,2023-08-03T22:04:00,,,0.0,123,Device,,RUN CAPACITY LIMITED-HIGH COMPRESSOR LIFT,Aug  3 2023 10:04PM,False,True,True,,,,,,,ALARM_03,CH_ALARM_03,,,,AlertAlarm/4004Q69950/2023,4004Q69950,,America/New_York
151,,,,,2,Device,,,8/4/2023 5:54:16 PM -04:00,False,True,False,1.0,,,,,,SYS_ALM,SystemAlertAlarm,,,,AlertAlarm/4004Q69950/2023,4004Q69950,,America/New_York
152,2023-08-04T22:24:00,,,0.0,2,Device,,System Alert /Alarm,Aug  4 2023 10:24PM,False,False,True,,,,,,,SYS_ALM,SystemAlertAlarm,,,,AlertAlarm/4004Q69950/2023,4004Q69950,,America/New_York
153,,,,,2,Device,,,8/7/2023 7:04:28 AM -04:00,False,True,False,1.0,,,,,,SYS_ALM,SystemAlertAlarm,,,,AlertAlarm/4004Q69950/2023,4004Q69950,,America/New_York
154,,,,,2,Device,,,8/7/2023 8:14:30 PM -04:00,False,True,False,1.0,,,,,,SYS_ALM,SystemAlertAlarm,,,,AlertAlarm/4004Q69950/2023,4004Q69950,,America/New_York
155,2023-08-08T00:44:00,,,0.0,2,Device,,System Alert /Alarm,Aug  8 2023 12:44AM,False,False,True,,,,,,,SYS_ALM,SystemAlertAlarm,,,,AlertAlarm/4004Q69950/2023,4004Q69950,,America/New_York
156,,,,,2,Device,,,8/8/2023 7:04:32 AM -04:00,False,True,False,1.0,,,,,,SYS_ALM,SystemAlertAlarm,,,,AlertAlarm/4004Q69950/2023,4004Q69950,,America/New_York
157,,,,,2,Device,,,8/8/2023 5:54:34 PM -04:00,False,True,False,1.0,,,,,,SYS_ALM,SystemAlertAlarm,,,,AlertAlarm/4004Q69950/2023,4004Q69950,,America/New_York
158,2023-08-08T22:04:00,,,0.0,2,Device,,System Alert /Alarm,Aug  8 2023 10:04PM,False,False,True,,,,,,,SYS_ALM,SystemAlertAlarm,,,,AlertAlarm/4004Q69950/2023,4004Q69950,,America/New_York
159,,,,,2,Device,,,8/9/2023 7:04:37 AM -04:00,False,True,False,1.0,,,,,,SYS_ALM,SystemAlertAlarm,,,,AlertAlarm/4004Q69950/2023,4004Q69950,,America/New_York
160,,,,,2,Device,,,8/9/2023 5:54:38 PM -04:00,False,True,False,1.0,,,,,,SYS_ALM,SystemAlertAlarm,,,,AlertAlarm/4004Q69950/2023,4004Q69950,,America/New_York
161,,,,,2,Device,,,8/10/2023 7:04:41 AM -04:00,False,True,False,1.0,,,,,,SYS_ALM,SystemAlertAlarm,,,,AlertAlarm/4004Q69950/2023,4004Q69950,,America/New_York
162,2023-08-10T11:19:00,,,0.0,2,Device,,System Alert /Alarm,Aug 10 2023 11:19AM,False,False,True,,,,,,,SYS_ALM,SystemAlertAlarm,,,,AlertAlarm/4004Q69950/2023,4004Q69950,,America/New_York
163,,,,,2,Device,,,8/10/2023 5:54:43 PM -04:00,False,True,False,1.0,,,,,,SYS_ALM,SystemAlertAlarm,,,,AlertAlarm/4004Q69950/2023,4004Q69950,,America/New_York
164,2023-08-10T23:04:00,,,0.0,2,Device,,System Alert /Alarm,Aug 10 2023 11:04PM,False,False,True,,,,,,,SYS_ALM,SystemAlertAlarm,,,,AlertAlarm/4004Q69950/2023,4004Q69950,,America/New_York
165,,,,,2,Device,,,8/11/2023 7:09:45 AM -04:00,False,True,False,1.0,,,,,,SYS_ALM,SystemAlertAlarm,,,,AlertAlarm/4004Q69950/2023,4004Q69950,,America/New_York
166,2023-08-11T11:14:00,,,0.0,2,Device,,System Alert /Alarm,Aug 11 2023 11:14AM,False,False,True,,,,,,,SYS_ALM,SystemAlertAlarm,,,,AlertAlarm/4004Q69950/2023,4004Q69950,,America/New_York
167,2023-08-14T11:04:00,https://alarmssaveandnotifyprod.blob.core.windows.net/snapshot/vu139530540410_42/2023/8/14/11/54/VU139530540410_42_1692011056,,0.0,120,Device,,RUN CAPACITY LIMITED-HIGH CONDENSER PRESSURE,Aug 14 2023 11:04AM,False,True,False,,,,,,,ALARM_01,CH_ALARM_01,,,,AlertAlarm/4004Q69950/2023,4004Q69950,,America/New_York
168,2023-08-14T11:15:00,,,0.0,120,Device,,RUN CAPACITY LIMITED-HIGH CONDENSER PRESSURE,Aug 14 2023 11:15AM,False,True,True,,,,,,,ALARM_01,CH_ALARM_01,,,,AlertAlarm/4004Q69950/2023,4004Q69950,,America/New_York
169,,,,,2,Device,,,8/14/2023 7:10:06 AM -04:00,False,True,False,1.0,,,,,,SYS_ALM,SystemAlertAlarm,,,,AlertAlarm/4004Q69950/2023,4004Q69950,,America/New_York
170,2023-08-15T21:51:00,,,0.0,2,Device,,System Alert /Alarm,Aug 15 2023  9:51PM,False,False,True,,,,,,,SYS_ALM,SystemAlertAlarm,,,,AlertAlarm/4004Q69950/2023,4004Q69950,,America/New_York
171,2023-08-15T21:51:00,https://alarmssaveandnotifyprod.blob.core.windows.net/snapshot/vu139530540410_42/2023/8/15/21/51/VU139530540410_42_1692136280,,0.0,120,Device,,RUN CAPACITY LIMITED-HIGH CONDENSER PRESSURE,Aug 15 2023  9:51PM,False,True,False,,,,,,,ALARM_01,CH_ALARM_01,,,,AlertAlarm/4004Q69950/2023,4004Q69950,,America/New_York
172,2023-08-15T21:51:00,https://alarmssaveandnotifyprod.blob.core.windows.net/snapshot/vu139530540410_42/2023/8/15/21/51/VU139530540410_42_1692136280,,0.0,123,Device,,RUN CAPACITY LIMITED-HIGH COMPRESSOR LIFT,Aug 15 2023  9:51PM,False,True,False,,,,,,,ALARM_02,CH_ALARM_02,,,,AlertAlarm/4004Q69950/2023,4004Q69950,,America/New_York
173,,,,,2,Device,,,8/15/2023 5:55:13 PM -04:00,False,True,False,1.0,,,,,,SYS_ALM,SystemAlertAlarm,,,,AlertAlarm/4004Q69950/2023,4004Q69950,,America/New_York
174,2023-08-15T22:45:00,,,0.0,2,Device,,System Alert /Alarm,Aug 15 2023 10:45PM,False,False,True,,,,,,,SYS_ALM,SystemAlertAlarm,,,,AlertAlarm/4004Q69950/2023,4004Q69950,,America/New_York
175,2023-08-15T22:45:00,,,0.0,120,Device,,RUN CAPACITY LIMITED-HIGH CONDENSER PRESSURE,Aug 15 2023 10:45PM,False,True,True,,,,,,,ALARM_01,CH_ALARM_01,,,,AlertAlarm/4004Q69950/2023,4004Q69950,,America/New_York
176,2023-08-15T22:45:00,,,0.0,123,Device,,RUN CAPACITY LIMITED-HIGH COMPRESSOR LIFT,Aug 15 2023 10:45PM,False,True,True,,,,,,,ALARM_02,CH_ALARM_02,,,,AlertAlarm/4004Q69950/2023,4004Q69950,,America/New_York
177,2023-08-16T01:22:00,https://alarmssaveandnotifyprod.blob.core.windows.net/snapshot/vu139530540410_42/2023/8/16/1/22/VU139530540410_42_1692148960,,0.0,120,Device,,RUN CAPACITY LIMITED-HIGH CONDENSER PRESSURE,Aug 16 2023  1:22AM,False,True,False,,,,,,,ALARM_01,CH_ALARM_01,,,,AlertAlarm/4004Q69950/2023,4004Q69950,,America/New_York
178,2023-08-16T01:22:00,https://alarmssaveandnotifyprod.blob.core.windows.net/snapshot/vu139530540410_42/2023/8/16/1/22/VU139530540410_42_1692148960,,0.0,123,Device,,RUN CAPACITY LIMITED-HIGH COMPRESSOR LIFT,Aug 16 2023  1:22AM,False,True,False,,,,,,,ALARM_02,CH_ALARM_02,,,,AlertAlarm/4004Q69950/2023,4004Q69950,,America/New_York
179,2023-08-16T01:22:00,https://alarmssaveandnotifyprod.blob.core.windows.net/snapshot/vu139530540410_42/2023/8/16/1/22/VU139530540410_42_1692148960,,0.0,162,Device,,SENSOR ALERT-EVAPORATOR APPROACH,Aug 16 2023  1:22AM,False,True,False,,,,,,,ALARM_03,CH_ALARM_03,,,,AlertAlarm/4004Q69950/2023,4004Q69950,,America/New_York
180,2023-08-19T01:32:00,https://alarmssaveandnotifyprod.blob.core.windows.net/snapshot/vu139530540410_42/2023/8/19/2/21/VU139530540410_42_1692408749,,0.0,150,Device,,SENSOR ALERT-HIGH BEARING TEMPERATURE,Aug 19 2023  1:32AM,False,True,False,,,,,,,ALARM_04,CH_ALARM_04,,,,AlertAlarm/4004Q69950/2023,4004Q69950,,America/New_York
181,2023-08-21T21:49:00,,,0.0,120,Device,,RUN CAPACITY LIMITED-HIGH CONDENSER PRESSURE,Aug 21 2023  9:49PM,False,True,True,,,,,,,ALARM_01,CH_ALARM_01,,,,AlertAlarm/4004Q69950/2023,4004Q69950,,America/New_York
182,2023-08-21T21:49:00,,,0.0,162,Device,,SENSOR ALERT-EVAPORATOR APPROACH,Aug 21 2023  9:49PM,False,True,True,,,,,,,ALARM_03,CH_ALARM_03,,,,AlertAlarm/4004Q69950/2023,4004Q69950,,America/New_York
183,2023-08-21T21:49:00,,,0.0,150,Device,,SENSOR ALERT-HIGH BEARING TEMPERATURE,Aug 21 2023  9:49PM,False,True,True,,,,,,,ALARM_04,CH_ALARM_04,,,,AlertAlarm/4004Q69950/2023,4004Q69950,,America/New_York
184,,,,,2,Device,,,8/21/2023 5:51:00 PM -04:00,False,True,False,1.0,,,,,,SYS_ALM,SystemAlertAlarm,,,,AlertAlarm/4004Q69950/2023,4004Q69950,,America/New_York
185,2023-08-21T21:56:00,,,0.0,2,Device,,System Alert /Alarm,Aug 21 2023  9:56PM,False,False,True,,,,,,,SYS_ALM,SystemAlertAlarm,,,,AlertAlarm/4004Q69950/2023,4004Q69950,,America/New_York
186,2023-08-21T21:56:00,,,0.0,123,Device,,RUN CAPACITY LIMITED-HIGH COMPRESSOR LIFT,Aug 21 2023  9:56PM,False,True,True,,,,,,,ALARM_02,CH_ALARM_02,,,,AlertAlarm/4004Q69950/2023,4004Q69950,,America/New_York
187,2023-08-22T01:35:00,https://alarmssaveandnotifyprod.blob.core.windows.net/snapshot/vu139530540410_42/2023/8/22/1/35/VU139530540410_42_1692668149,,0.0,123,Device,,RUN CAPACITY LIMITED-HIGH COMPRESSOR LIFT,Aug 22 2023  1:35AM,False,True,False,,,,,,,ALARM_01,CH_ALARM_01,,,,AlertAlarm/4004Q69950/2023,4004Q69950,,America/New_York
188,2023-08-22T01:35:00,https://alarmssaveandnotifyprod.blob.core.windows.net/snapshot/vu139530540410_42/2023/8/22/1/35/VU139530540410_42_1692668149,,0.0,150,Device,,SENSOR ALERT-HIGH BEARING TEMPERATURE,Aug 22 2023  1:35AM,False,True,False,,,,,,,ALARM_02,CH_ALARM_02,,,,AlertAlarm/4004Q69950/2023,4004Q69950,,America/New_York
189,,,,,2,Device,,,8/22/2023 5:51:04 PM -04:00,False,True,False,1.0,,,,,,SYS_ALM,SystemAlertAlarm,,,,AlertAlarm/4004Q69950/2023,4004Q69950,,America/New_York
190,2023-08-22T21:56:00,,,0.0,2,Device,,System Alert /Alarm,Aug 22 2023  9:56PM,False,False,True,,,,,,,SYS_ALM,SystemAlertAlarm,,,,AlertAlarm/4004Q69950/2023,4004Q69950,,America/New_York
191,2023-08-22T21:56:00,,,0.0,123,Device,,RUN CAPACITY LIMITED-HIGH COMPRESSOR LIFT,Aug 22 2023  9:56PM,False,True,True,,,,,,,ALARM_01,CH_ALARM_01,,,,AlertAlarm/4004Q69950/2023,4004Q69950,,America/New_York
192,2023-08-22T21:56:00,,,0.0,150,Device,,SENSOR ALERT-HIGH BEARING TEMPERATURE,Aug 22 2023  9:56PM,False,True,True,,,,,,,ALARM_02,CH_ALARM_02,,,,AlertAlarm/4004Q69950/2023,4004Q69950,,America/New_York
193,,,,,2,Device,,,8/23/2023 5:51:09 PM -04:00,False,True,False,1.0,,,,,,SYS_ALM,SystemAlertAlarm,,,,AlertAlarm/4004Q69950/2023,4004Q69950,,America/New_York
194,2023-08-24T10:58:00,,,0.0,2,Device,,System Alert /Alarm,Aug 24 2023 10:58AM,False,False,True,,,,,,,SYS_ALM,SystemAlertAlarm,,,,AlertAlarm/4004Q69950/2023,4004Q69950,,America/New_York
195,2023-08-24T10:58:00,https://alarmssaveandnotifyprod.blob.core.windows.net/snapshot/vu139530540410_42/2023/8/24/10/59/VU139530540410_42_1692874738,,0.0,123,Device,,RUN CAPACITY LIMITED-HIGH COMPRESSOR LIFT,Aug 24 2023 10:58AM,False,True,False,,,,,,,ALARM_01,CH_ALARM_01,,,,AlertAlarm/4004Q69950/2023,4004Q69950,,America/New_York
196,2023-08-24T10:58:00,https://alarmssaveandnotifyprod.blob.core.windows.net/snapshot/vu139530540410_42/2023/8/24/10/59/VU139530540410_42_1692874738,,0.0,150,Device,,SENSOR ALERT-HIGH BEARING TEMPERATURE,Aug 24 2023 10:58AM,False,True,False,,,,,,,ALARM_02,CH_ALARM_02,,,,AlertAlarm/4004Q69950/2023,4004Q69950,,America/New_York
197,2023-08-24T10:58:00,https://alarmssaveandnotifyprod.blob.core.windows.net/snapshot/vu139530540410_42/2023/8/24/10/59/VU139530540410_42_1692874738,,0.0,120,Device,,RUN CAPACITY LIMITED-HIGH CONDENSER PRESSURE,Aug 24 2023 10:58AM,False,True,False,,,,,,,ALARM_03,CH_ALARM_03,,,,AlertAlarm/4004Q69950/2023,4004Q69950,,America/New_York
198,,,,,2,Device,,,8/24/2023 7:06:11 AM -04:00,False,True,False,1.0,,,,,,SYS_ALM,SystemAlertAlarm,,,,AlertAlarm/4004Q69950/2023,4004Q69950,,America/New_York
199,2023-08-24T11:11:00,,,0.0,2,Device,,System Alert /Alarm,Aug 24 2023 11:11AM,False,False,True,,,,,,,SYS_ALM,SystemAlertAlarm,,,,AlertAlarm/4004Q69950/2023,4004Q69950,,America/New_York
200,2023-08-24T11:11:00,,,0.0,123,Device,,RUN CAPACITY LIMITED-HIGH COMPRESSOR LIFT,Aug 24 2023 11:11AM,False,True,True,,,,,,,ALARM_01,CH_ALARM_01,,,,AlertAlarm/4004Q69950/2023,4004Q69950,,America/New_York
201,2023-08-24T11:11:00,,,0.0,150,Device,,SENSOR ALERT-HIGH BEARING TEMPERATURE,Aug 24 2023 11:11AM,False,True,True,,,,,,,ALARM_02,CH_ALARM_02,,,,AlertAlarm/4004Q69950/2023,4004Q69950,,America/New_York
202,2023-08-24T11:11:00,,,0.0,120,Device,,RUN CAPACITY LIMITED-HIGH CONDENSER PRESSURE,Aug 24 2023 11:11AM,False,True,True,,,,,,,ALARM_03,CH_ALARM_03,,,,AlertAlarm/4004Q69950/2023,4004Q69950,,America/New_York
203,,,,,2,Device,,,8/24/2023 5:51:13 PM -04:00,False,True,False,1.0,,,,,,SYS_ALM,SystemAlertAlarm,,,,AlertAlarm/4004Q69950/2023,4004Q69950,,America/New_York
204,2023-08-24T21:56:00,,,0.0,2,Device,,System Alert /Alarm,Aug 24 2023  9:56PM,False,False,True,,,,,,,SYS_ALM,SystemAlertAlarm,,,,AlertAlarm/4004Q69950/2023,4004Q69950,,America/New_York
205,,,,,2,Device,,,8/25/2023 5:51:17 PM -04:00,False,True,False,1.0,,,,,,SYS_ALM,SystemAlertAlarm,,,,AlertAlarm/4004Q69950/2023,4004Q69950,,America/New_York
206,2023-08-25T21:56:00,,,0.0,2,Device,,System Alert /Alarm,Aug 25 2023  9:56PM,False,False,True,,,,,,,SYS_ALM,SystemAlertAlarm,,,,AlertAlarm/4004Q69950/2023,4004Q69950,,America/New_York
207,2023-08-27T19:49:00,https://alarmssaveandnotifyprod.blob.core.windows.net/snapshot/vu139530540410_42/2023/8/27/21/8/VU139530540410_42_1693165751,,0.0,123,Device,,RUN CAPACITY LIMITED-HIGH COMPRESSOR LIFT,Aug 27 2023  7:49PM,False,True,False,,,,,,,ALARM_01,CH_ALARM_01,,,,AlertAlarm/4004Q69950/2023,4004Q69950,,America/New_York
208,,,,,2,Device,,,8/27/2023 3:46:12 PM -04:00,False,True,False,1.0,,,,,,SYS_ALM,SystemAlertAlarm,,,,AlertAlarm/4004Q69950/2023,4004Q69950,,America/New_York
209,2023-08-27T20:46:00,,,0.0,2,Device,,System Alert /Alarm,Aug 27 2023  8:46PM,False,False,True,,,,,,,SYS_ALM,SystemAlertAlarm,,,,AlertAlarm/4004Q69950/2023,4004Q69950,,America/New_York
210,2023-08-27T20:46:00,,,0.0,123,Device,,RUN CAPACITY LIMITED-HIGH COMPRESSOR LIFT,Aug 27 2023  8:46PM,False,True,True,,,,,,,ALARM_01,CH_ALARM_01,,,,AlertAlarm/4004Q69950/2023,4004Q69950,,America/New_York
211,2023-08-28T10:49:00,https://alarmssaveandnotifyprod.blob.core.windows.net/snapshot/vu139530540410_42/2023/8/28/11/35/VU139530540410_42_1693219755,,0.0,123,Device,,RUN CAPACITY LIMITED-HIGH COMPRESSOR LIFT,Aug 28 2023 10:49AM,False,True,False,,,,,,,ALARM_01,CH_ALARM_01,,,,AlertAlarm/4004Q69950/2023,4004Q69950,,America/New_York
212,2023-08-28T10:49:00,https://alarmssaveandnotifyprod.blob.core.windows.net/snapshot/vu139530540410_42/2023/8/28/11/35/VU139530540410_42_1693219755,,0.0,120,Device,,RUN CAPACITY LIMITED-HIGH CONDENSER PRESSURE,Aug 28 2023 10:49AM,False,True,False,,,,,,,ALARM_02,CH_ALARM_02,,,,AlertAlarm/4004Q69950/2023,4004Q69950,,America/New_York
213,,,,,2,Device,,,8/28/2023 6:51:14 AM -04:00,False,True,False,1.0,,,,,,SYS_ALM,SystemAlertAlarm,,,,AlertAlarm/4004Q69950/2023,4004Q69950,,America/New_York
214,2023-08-28T11:16:00,,,0.0,2,Device,,System Alert /Alarm,Aug 28 2023 11:16AM,False,False,True,,,,,,,SYS_ALM,SystemAlertAlarm,,,,AlertAlarm/4004Q69950/2023,4004Q69950,,America/New_York
215,2023-08-28T11:16:00,,,0.0,123,Device,,RUN CAPACITY LIMITED-HIGH COMPRESSOR LIFT,Aug 28 2023 11:16AM,False,True,True,,,,,,,ALARM_01,CH_ALARM_01,,,,AlertAlarm/4004Q69950/2023,4004Q69950,,America/New_York
216,2023-08-28T11:16:00,,,0.0,120,Device,,RUN CAPACITY LIMITED-HIGH CONDENSER PRESSURE,Aug 28 2023 11:16AM,False,True,True,,,,,,,ALARM_02,CH_ALARM_02,,,,AlertAlarm/4004Q69950/2023,4004Q69950,,America/New_York
217,2023-08-28T13:23:00,https://alarmssaveandnotifyprod.blob.core.windows.net/snapshot/vu139530540410_42/2023/8/28/13/52/VU139530540410_42_1693228981,,0.0,123,Device,,RUN CAPACITY LIMITED-HIGH COMPRESSOR LIFT,Aug 28 2023  1:23PM,False,True,False,,,,,,,ALARM_01,CH_ALARM_01,,,,AlertAlarm/4004Q69950/2023,4004Q69950,,America/New_York
218,2023-08-28T13:23:00,https://alarmssaveandnotifyprod.blob.core.windows.net/snapshot/vu139530540410_42/2023/8/28/13/52/VU139530540410_42_1693228981,,0.0,120,Device,,RUN CAPACITY LIMITED-HIGH CONDENSER PRESSURE,Aug 28 2023  1:23PM,False,True,False,,,,,,,ALARM_02,CH_ALARM_02,,,,AlertAlarm/4004Q69950/2023,4004Q69950,,America/New_York
219,2023-08-28T13:23:00,https://alarmssaveandnotifyprod.blob.core.windows.net/snapshot/vu139530540410_42/2023/8/28/13/52/VU139530540410_42_1693228981,,0.0,143,Device,,AUTORESTART PENDING-LINE PHASE LOSS,Aug 28 2023  1:23PM,False,True,False,,,,,,,ALARM_03,CH_ALARM_03,,,,AlertAlarm/4004Q69950/2023,4004Q69950,,America/New_York
220,,,,,2,Device,,,8/29/2023 7:06:19 AM -04:00,False,True,False,1.0,,,,,,SYS_ALM,SystemAlertAlarm,,,,AlertAlarm/4004Q69950/2023,4004Q69950,,America/New_York
221,2023-08-29T11:16:00,,,0.0,2,Device,,System Alert /Alarm,Aug 29 2023 11:16AM,False,False,True,,,,,,,SYS_ALM,SystemAlertAlarm,,,,AlertAlarm/4004Q69950/2023,4004Q69950,,America/New_York
222,2023-08-29T11:16:00,,,0.0,123,Device,,RUN CAPACITY LIMITED-HIGH COMPRESSOR LIFT,Aug 29 2023 11:16AM,False,True,True,,,,,,,ALARM_01,CH_ALARM_01,,,,AlertAlarm/4004Q69950/2023,4004Q69950,,America/New_York
223,2023-08-29T11:16:00,,,0.0,120,Device,,RUN CAPACITY LIMITED-HIGH CONDENSER PRESSURE,Aug 29 2023 11:16AM,False,True,True,,,,,,,ALARM_02,CH_ALARM_02,,,,AlertAlarm/4004Q69950/2023,4004Q69950,,America/New_York
224,2023-08-29T11:16:00,,,0.0,143,Device,,AUTORESTART PENDING-LINE PHASE LOSS,Aug 29 2023 11:16AM,False,True,True,,,,,,,ALARM_03,CH_ALARM_03,,,,AlertAlarm/4004Q69950/2023,4004Q69950,,America/New_York
225,,,,,2,Device,,,8/29/2023 5:51:21 PM -04:00,False,True,False,1.0,,,,,,SYS_ALM,SystemAlertAlarm,,,,AlertAlarm/4004Q69950/2023,4004Q69950,,America/New_York
226,2023-08-29T22:17:00,https://alarmssaveandnotifyprod.blob.core.windows.net/snapshot/vu139530540410_42/2023/8/30/1/37/VU139530540410_42_1693347449,,0.0,123,Device,,RUN CAPACITY LIMITED-HIGH COMPRESSOR LIFT,Aug 29 2023 10:17PM,False,True,False,,,,,,,ALARM_01,CH_ALARM_01,,,,AlertAlarm/4004Q69950/2023,4004Q69950,,America/New_York
227,2023-08-29T22:17:00,https://alarmssaveandnotifyprod.blob.core.windows.net/snapshot/vu139530540410_42/2023/8/30/1/37/VU139530540410_42_1693347449,,0.0,120,Device,,RUN CAPACITY LIMITED-HIGH CONDENSER PRESSURE,Aug 29 2023 10:17PM,False,True,False,,,,,,,ALARM_02,CH_ALARM_02,,,,AlertAlarm/4004Q69950/2023,4004Q69950,,America/New_York
228,2023-08-29T22:17:00,https://alarmssaveandnotifyprod.blob.core.windows.net/snapshot/vu139530540410_42/2023/8/30/1/37/VU139530540410_42_1693347449,,0.0,143,Device,,AUTORESTART PENDING-LINE PHASE LOSS,Aug 29 2023 10:17PM,False,True,False,,,,,,,ALARM_03,CH_ALARM_03,,,,AlertAlarm/4004Q69950/2023,4004Q69950,,America/New_York
229,2023-08-29T22:17:00,https://alarmssaveandnotifyprod.blob.core.windows.net/snapshot/vu139530540410_42/2023/8/30/1/37/VU139530540410_42_1693347449,,0.0,162,Device,,SENSOR ALERT-EVAPORATOR APPROACH,Aug 29 2023 10:17PM,False,True,False,,,,,,,ALARM_04,CH_ALARM_04,,,,AlertAlarm/4004Q69950/2023,4004Q69950,,America/New_York
230,,,,,2,Device,,,8/30/2023 6:51:23 AM -04:00,False,True,False,1.0,,,,,,SYS_ALM,SystemAlertAlarm,,,,AlertAlarm/4004Q69950/2023,4004Q69950,,America/New_York
231,2023-08-30T11:16:00,,,0.0,2,Device,,System Alert /Alarm,Aug 30 2023 11:16AM,False,False,True,,,,,,,SYS_ALM,SystemAlertAlarm,,,,AlertAlarm/4004Q69950/2023,4004Q69950,,America/New_York
232,2023-08-30T11:16:00,,,0.0,123,Device,,RUN CAPACITY LIMITED-HIGH COMPRESSOR LIFT,Aug 30 2023 11:16AM,False,True,True,,,,,,,ALARM_01,CH_ALARM_01,,,,AlertAlarm/4004Q69950/2023,4004Q69950,,America/New_York
233,2023-08-30T11:16:00,,,0.0,120,Device,,RUN CAPACITY LIMITED-HIGH CONDENSER PRESSURE,Aug 30 2023 11:16AM,False,True,True,,,,,,,ALARM_02,CH_ALARM_02,,,,AlertAlarm/4004Q69950/2023,4004Q69950,,America/New_York
234,2023-08-30T11:16:00,,,0.0,143,Device,,AUTORESTART PENDING-LINE PHASE LOSS,Aug 30 2023 11:16AM,False,True,True,,,,,,,ALARM_03,CH_ALARM_03,,,,AlertAlarm/4004Q69950/2023,4004Q69950,,America/New_York
235,2023-08-30T11:16:00,,,0.0,162,Device,,SENSOR ALERT-EVAPORATOR APPROACH,Aug 30 2023 11:16AM,False,True,True,,,,,,,ALARM_04,CH_ALARM_04,,,,AlertAlarm/4004Q69950/2023,4004Q69950,,America/New_York
236,,,,,2,Device,,,8/30/2023 12:51:24 PM -04:00,False,True,False,1.0,,,,,,SYS_ALM,SystemAlertAlarm,,,,AlertAlarm/4004Q69950/2023,4004Q69950,,America/New_York
237,2023-08-30T17:01:00,,,0.0,2,Device,,System Alert /Alarm,Aug 30 2023  5:01PM,False,False,True,,,,,,,SYS_ALM,SystemAlertAlarm,,,,AlertAlarm/4004Q69950/2023,4004Q69950,,America/New_York
238,2023-08-30T21:56:00,https://alarmssaveandnotifyprod.blob.core.windows.net/snapshot/vu139530540410_42/2023/8/31/0/6/VU139530540410_42_1693432618,,0.0,123,Device,,RUN CAPACITY LIMITED-HIGH COMPRESSOR LIFT,Aug 30 2023  9:56PM,False,True,False,,,,,,,ALARM_01,CH_ALARM_01,,,,AlertAlarm/4004Q69950/2023,4004Q69950,,America/New_York
239,2023-08-30T21:56:00,https://alarmssaveandnotifyprod.blob.core.windows.net/snapshot/vu139530540410_42/2023/8/31/0/6/VU139530540410_42_1693432618,,0.0,120,Device,,RUN CAPACITY LIMITED-HIGH CONDENSER PRESSURE,Aug 30 2023  9:56PM,False,True,False,,,,,,,ALARM_02,CH_ALARM_02,,,,AlertAlarm/4004Q69950/2023,4004Q69950,,America/New_York
240,2023-08-30T21:56:00,https://alarmssaveandnotifyprod.blob.core.windows.net/snapshot/vu139530540410_42/2023/8/31/0/6/VU139530540410_42_1693432618,,0.0,143,Device,,AUTORESTART PENDING-LINE PHASE LOSS,Aug 30 2023  9:56PM,False,True,False,,,,,,,ALARM_03,CH_ALARM_03,,,,AlertAlarm/4004Q69950/2023,4004Q69950,,America/New_York
241,2023-08-30T21:56:00,https://alarmssaveandnotifyprod.blob.core.windows.net/snapshot/vu139530540410_42/2023/8/31/0/6/VU139530540410_42_1693432618,,0.0,162,Device,,SENSOR ALERT-EVAPORATOR APPROACH,Aug 30 2023  9:56PM,False,True,False,,,,,,,ALARM_04,CH_ALARM_04,,,,AlertAlarm/4004Q69950/2023,4004Q69950,,America/New_York
242,2023-08-30T21:56:00,https://alarmssaveandnotifyprod.blob.core.windows.net/snapshot/vu139530540410_42/2023/8/31/0/6/VU139530540410_42_1693432618,,0.0,150,Device,,SENSOR ALERT-HIGH BEARING TEMPERATURE,Aug 30 2023  9:56PM,False,True,False,,,,,,,ALARM_05,CH_ALARM_05,,,,AlertAlarm/4004Q69950/2023,4004Q69950,,America/New_York
243,,,,,2,Device,,,8/30/2023 5:51:25 PM -04:00,False,True,False,1.0,,,,,,SYS_ALM,SystemAlertAlarm,,,,AlertAlarm/4004Q69950/2023,4004Q69950,,America/New_York
244,2023-08-30T22:01:00,,,0.0,2,Device,,System Alert /Alarm,Aug 30 2023 10:01PM,False,False,True,,,,,,,SYS_ALM,SystemAlertAlarm,,,,AlertAlarm/4004Q69950/2023,4004Q69950,,America/New_York
245,2023-08-30T22:01:00,,,0.0,123,Device,,RUN CAPACITY LIMITED-HIGH COMPRESSOR LIFT,Aug 30 2023 10:01PM,False,True,True,,,,,,,ALARM_01,CH_ALARM_01,,,,AlertAlarm/4004Q69950/2023,4004Q69950,,America/New_York
246,2023-08-30T22:01:00,,,0.0,120,Device,,RUN CAPACITY LIMITED-HIGH CONDENSER PRESSURE,Aug 30 2023 10:01PM,False,True,True,,,,,,,ALARM_02,CH_ALARM_02,,,,AlertAlarm/4004Q69950/2023,4004Q69950,,America/New_York
247,2023-08-30T22:01:00,,,0.0,143,Device,,AUTORESTART PENDING-LINE PHASE LOSS,Aug 30 2023 10:01PM,False,True,True,,,,,,,ALARM_03,CH_ALARM_03,,,,AlertAlarm/4004Q69950/2023,4004Q69950,,America/New_York
248,2023-08-30T22:01:00,,,0.0,162,Device,,SENSOR ALERT-EVAPORATOR APPROACH,Aug 30 2023 10:01PM,False,True,True,,,,,,,ALARM_04,CH_ALARM_04,,,,AlertAlarm/4004Q69950/2023,4004Q69950,,America/New_York
249,2023-08-30T22:01:00,,,0.0,150,Device,,SENSOR ALERT-HIGH BEARING TEMPERATURE,Aug 30 2023 10:01PM,False,True,True,,,,,,,ALARM_05,CH_ALARM_05,,,,AlertAlarm/4004Q69950/2023,4004Q69950,,America/New_York
250,,,,,2,Device,,,9/1/2023 6:41:32 AM -04:00,False,True,False,1.0,,,,,,SYS_ALM,SystemAlertAlarm,,,,AlertAlarm/4004Q69950/2023,4004Q69950,,America/New_York
251,2023-09-01T11:11:00,,,0.0,2,Device,,System Alert /Alarm,Sep  1 2023 11:11AM,False,False,True,,,,,,,SYS_ALM,SystemAlertAlarm,,,,AlertAlarm/4004Q69950/2023,4004Q69950,,America/New_York
252,2023-09-05T21:52:00,https://alarmssaveandnotifyprod.blob.core.windows.net/snapshot/vu139530540410_42/2023/9/8/19/42/VU139530540410_42_1693950764,,0.0,123,Device,,RUN CAPACITY LIMITED-HIGH COMPRESSOR LIFT,Sep  5 2023  9:52PM,False,True,False,,,,,,,ALARM_01,CH_ALARM_01,,,,AlertAlarm/4004Q69950/2023,4004Q69950,,America/New_York
253,2023-09-07T12:01:00,https://alarmssaveandnotifyprod.blob.core.windows.net/snapshot/vu139530540410_42/2023/9/9/9/29/VU139530540410_42_1694088065,,0.0,162,Device,,SENSOR ALERT-EVAPORATOR APPROACH,Sep  7 2023 12:01PM,False,True,False,,,,,,,ALARM_02,CH_ALARM_02,,,,AlertAlarm/4004Q69950/2023,4004Q69950,,America/New_York
254,2023-09-10T13:24:00,,,0.0,123,Device,,RUN CAPACITY LIMITED-HIGH COMPRESSOR LIFT,Sep 10 2023  1:24PM,False,True,True,,,,,,,ALARM_01,CH_ALARM_01,,,,AlertAlarm/4004Q69950/2023,4004Q69950,,America/New_York
255,2023-09-10T13:24:00,,,0.0,162,Device,,SENSOR ALERT-EVAPORATOR APPROACH,Sep 10 2023  1:24PM,False,True,True,,,,,,,ALARM_02,CH_ALARM_02,,,,AlertAlarm/4004Q69950/2023,4004Q69950,,America/New_York
256,2023-09-10T13:24:00,https://alarmssaveandnotifyprod.blob.core.windows.net/snapshot/vu139530540410_42/2023/9/10/14/16/VU139530540410_42_1694352265,,0.0,143,Device,,AUTORESTART PENDING-LINE PHASE LOSS,Sep 10 2023  1:24PM,False,True,False,,,,,,,ALARM_01,CH_ALARM_01,,,,AlertAlarm/4004Q69950/2023,4004Q69950,,America/New_York
257,2023-09-11T21:48:00,,,0.0,143,Device,,AUTORESTART PENDING-LINE PHASE LOSS,Sep 11 2023  9:48PM,False,True,True,,,,,,,ALARM_01,CH_ALARM_01,,,,AlertAlarm/4004Q69950/2023,4004Q69950,,America/New_York
258,2023-09-11T21:48:00,https://alarmssaveandnotifyprod.blob.core.windows.net/snapshot/vu139530540410_42/2023/9/12/4/1/VU139530540410_42_1694468932,,0.0,123,Device,,RUN CAPACITY LIMITED-HIGH COMPRESSOR LIFT,Sep 11 2023  9:48PM,False,True,False,,,,,,,ALARM_01,CH_ALARM_01,,,,AlertAlarm/4004Q69950/2023,4004Q69950,,America/New_York
259,,,,,2,Device,,,9/11/2023 5:51:19 PM -04:00,False,True,False,1.0,,,,,,SYS_ALM,SystemAlertAlarm,,,,AlertAlarm/4004Q69950/2023,4004Q69950,,America/New_York
260,2023-09-13T23:51:00,,,0.0,2,Device,,System Alert /Alarm,Sep 13 2023 11:51PM,False,False,True,,,,,,,SYS_ALM,SystemAlertAlarm,,,,AlertAlarm/4004Q69950/2023,4004Q69950,,America/New_York
261,,,,,2,Device,,,9/13/2023 7:50:00 PM -04:00,False,True,False,1.0,,,,,,SYS_ALM,SystemAlertAlarm,,,,AlertAlarm/4004Q69950/2023,4004Q69950,,America/New_York
262,2023-09-15T23:50:00,https://alarmssaveandnotifyprod.blob.core.windows.net/snapshot/vu139530540410_42/2023/9/16/1/20/VU139530540410_42_1694821835,,0.0,123,Device,,RUN CAPACITY LIMITED-HIGH COMPRESSOR LIFT,Sep 15 2023 11:50PM,False,True,False,,,,,,,ALARM_01,CH_ALARM_01,,,,AlertAlarm/4004Q69950/2023,4004Q69950,,America/New_York
263,,,,,2,Device,,,9/15/2023 7:47:44 PM -04:00,False,True,False,1.0,,,,,,SYS_ALM,SystemAlertAlarm,,,,AlertAlarm/4004Q69950/2023,4004Q69950,,America/New_York
264,2023-09-15T23:57:00,,,0.0,2,Device,,System Alert /Alarm,Sep 15 2023 11:57PM,False,False,True,,,,,,,SYS_ALM,SystemAlertAlarm,,,,AlertAlarm/4004Q69950/2023,4004Q69950,,America/New_York
265,2023-09-15T23:57:00,,,0.0,123,Device,,RUN CAPACITY LIMITED-HIGH COMPRESSOR LIFT,Sep 15 2023 11:57PM,False,True,True,,,,,,,ALARM_01,CH_ALARM_01,,,,AlertAlarm/4004Q69950/2023,4004Q69950,,America/New_York
266,2023-09-18T21:47:00,https://alarmssaveandnotifyprod.blob.core.windows.net/snapshot/vu139530540410_42/2023/9/18/22/27/VU139530540410_42_1695073622,,0.0,123,Device,,RUN CAPACITY LIMITED-HIGH COMPRESSOR LIFT,Sep 18 2023  9:47PM,False,True,False,,,,,,,ALARM_01,CH_ALARM_01,,,,AlertAlarm/4004Q69950/2023,4004Q69950,,America/New_York
267,,,,,2,Device,,,9/18/2023 5:49:15 PM -04:00,False,True,False,1.0,,,,,,SYS_ALM,SystemAlertAlarm,,,,AlertAlarm/4004Q69950/2023,4004Q69950,,America/New_York
268,2023-09-18T21:54:00,,,0.0,2,Device,,System Alert /Alarm,Sep 18 2023  9:54PM,False,False,True,,,,,,,SYS_ALM,SystemAlertAlarm,,,,AlertAlarm/4004Q69950/2023,4004Q69950,,America/New_York
269,2023-09-18T21:54:00,,,0.0,123,Device,,RUN CAPACITY LIMITED-HIGH COMPRESSOR LIFT,Sep 18 2023  9:54PM,False,True,True,,,,,,,ALARM_01,CH_ALARM_01,,,,AlertAlarm/4004Q69950/2023,4004Q69950,,America/New_York
270,2023-09-20T21:47:00,https://alarmssaveandnotifyprod.blob.core.windows.net/snapshot/vu139530540410_42/2023/9/20/21/47/VU139530540410_42_1695246423,,0.0,123,Device,,RUN CAPACITY LIMITED-HIGH COMPRESSOR LIFT,Sep 20 2023  9:47PM,False,True,False,,,,,,,ALARM_01,CH_ALARM_01,,,,AlertAlarm/4004Q69950/2023,4004Q69950,,America/New_York
271,2023-09-22T21:44:00,https://alarmssaveandnotifyprod.blob.core.windows.net/snapshot/vu139530540410_42/2023/9/23/1/54/VU139530540410_42_1695419074,,0.0,163,Device,,SENSOR ALERT-CONDENSER APPROACH,Sep 22 2023  9:44PM,False,True,False,,,,,,,ALARM_02,CH_ALARM_02,,,,AlertAlarm/4004Q69950/2023,4004Q69950,,America/New_York
272,,,,,2,Device,,,9/22/2023 9:50:28 PM -04:00,False,True,False,1.0,,,,,,SYS_ALM,SystemAlertAlarm,,,,AlertAlarm/4004Q69950/2023,4004Q69950,,America/New_York
273,,,,,2,Device,,,9/22/2023 9:50:28 PM -04:00,False,True,False,1.0,,,,,,SYS_ALM,SystemAlertAlarm,,,,AlertAlarm/4004Q69950/2023,4004Q69950,,America/New_York
274,2023-09-23T02:05:00,,,0.0,2,Device,,System Alert /Alarm,Sep 23 2023  2:05AM,False,False,True,,,,,,,SYS_ALM,SystemAlertAlarm,,,,AlertAlarm/4004Q69950/2023,4004Q69950,,America/New_York
275,2023-09-23T02:05:00,,,0.0,123,Device,,RUN CAPACITY LIMITED-HIGH COMPRESSOR LIFT,Sep 23 2023  2:05AM,False,True,True,,,,,,,ALARM_01,CH_ALARM_01,,,,AlertAlarm/4004Q69950/2023,4004Q69950,,America/New_York
276,2023-09-23T02:05:00,,,0.0,163,Device,,SENSOR ALERT-CONDENSER APPROACH,Sep 23 2023  2:05AM,False,True,True,,,,,,,ALARM_02,CH_ALARM_02,,,,AlertAlarm/4004Q69950/2023,4004Q69950,,America/New_York
277,2023-09-23T02:10:00,https://alarmssaveandnotifyprod.blob.core.windows.net/snapshot/vu139530540410_42/2023/9/23/2/10/VU139530540410_42_1695435019,,0.0,123,Device,,RUN CAPACITY LIMITED-HIGH COMPRESSOR LIFT,Sep 23 2023  2:10AM,False,True,False,,,,,,,ALARM_01,CH_ALARM_01,,,,AlertAlarm/4004Q69950/2023,4004Q69950,,America/New_York
278,2023-09-23T02:10:00,https://alarmssaveandnotifyprod.blob.core.windows.net/snapshot/vu139530540410_42/2023/9/23/2/10/VU139530540410_42_1695435019,,0.0,163,Device,,SENSOR ALERT-CONDENSER APPROACH,Sep 23 2023  2:10AM,False,True,False,,,,,,,ALARM_02,CH_ALARM_02,,,,AlertAlarm/4004Q69950/2023,4004Q69950,,America/New_York
279,2023-09-23T02:10:00,https://alarmssaveandnotifyprod.blob.core.windows.net/snapshot/vu139530540410_42/2023/9/23/2/10/VU139530540410_42_1695435019,,0.0,120,Device,,RUN CAPACITY LIMITED-HIGH CONDENSER PRESSURE,Sep 23 2023  2:10AM,False,True,False,,,,,,,ALARM_03,CH_ALARM_03,,,,AlertAlarm/4004Q69950/2023,4004Q69950,,America/New_York
280,2023-09-23T02:10:00,https://alarmssaveandnotifyprod.blob.core.windows.net/snapshot/vu139530540410_42/2023/9/23/2/10/VU139530540410_42_1695435019,,0.0,238,Device,,PROTECTIVE LIMIT-EXCESSIVE COMPR SURGE,Sep 23 2023  2:10AM,True,False,False,,,,,,,ALARM_04,CH_ALARM_04,,,,AlertAlarm/4004Q69950/2023,4004Q69950,,America/New_York
281,,,,,3,Device,,,9/22/2023 10:10:28 PM -04:00,True,False,False,1.0,,,,,,SYS_ALM,SystemAlertAlarm,,,,AlertAlarm/4004Q69950/2023,4004Q69950,,America/New_York
282,,,,,1,Device,,,9/22/2023 10:15:28 PM -04:00,True,False,False,0.0,,,,,,ALM,CH_ALARMRELAY,,,,AlertAlarm/4004Q69950/2023,4004Q69950,,America/New_York
283,2023-09-23T03:05:00,,,0.0,1,Device,,Alarm Relay,Sep 23 2023  3:05AM,False,False,True,,,,,,,ALM,CH_ALARMRELAY,,,,AlertAlarm/4004Q69950/2023,4004Q69950,,America/New_York
284,2023-09-23T03:05:00,,,0.0,3,Device,,System Alert /Alarm,Sep 23 2023  3:05AM,False,False,True,,,,,,,SYS_ALM,SystemAlertAlarm,,,,AlertAlarm/4004Q69950/2023,4004Q69950,,America/New_York
285,2023-09-23T03:05:00,,,0.0,238,Device,,PROTECTIVE LIMIT-EXCESSIVE COMPR SURGE,Sep 23 2023  3:05AM,True,False,True,,,,,,,ALARM_04,CH_ALARM_04,,,,AlertAlarm/4004Q69950/2023,4004Q69950,,America/New_York
286,,,,,1,Device,,,9/22/2023 11:10:28 PM -04:00,True,False,False,0.0,,,,,,ALM,CH_ALARMRELAY,,,,AlertAlarm/4004Q69950/2023,4004Q69950,,America/New_York
287,2023-09-23T04:10:00,,,0.0,1,Device,,Alarm Relay,Sep 23 2023  4:10AM,False,False,True,,,,,,,ALM,CH_ALARMRELAY,,,,AlertAlarm/4004Q69950/2023,4004Q69950,,America/New_York
288,2023-09-23T04:10:00,,,0.0,1,Device,,Alarm Relay,Sep 23 2023  4:10AM,False,False,True,,,,,,,ALM,CH_ALARMRELAY,,,,AlertAlarm/4004Q69950/2023,4004Q69950,,America/New_York
289,,,,,1,Device,,,9/23/2023 12:15:29 AM -04:00,True,False,False,0.0,,,,,,ALM,CH_ALARMRELAY,,,,AlertAlarm/4004Q69950/2023,4004Q69950,,America/New_York
290,2023-09-23T04:45:00,,,0.0,1,Device,,Alarm Relay,Sep 23 2023  4:45AM,False,False,True,,,,,,,ALM,CH_ALARMRELAY,,,,AlertAlarm/4004Q69950/2023,4004Q69950,,America/New_York
291,,,,,1,Device,,,9/23/2023 12:50:29 AM -04:00,True,False,False,0.0,,,,,,ALM,CH_ALARMRELAY,,,,AlertAlarm/4004Q69950/2023,4004Q69950,,America/New_York
292,2023-09-23T07:05:00,,,0.0,1,Device,,Alarm Relay,Sep 23 2023  7:05AM,False,False,True,,,,,,,ALM,CH_ALARMRELAY,,,,AlertAlarm/4004Q69950/2023,4004Q69950,,America/New_York
293,,,,,1,Device,,,9/23/2023 3:10:29 AM -04:00,True,False,False,0.0,,,,,,ALM,CH_ALARMRELAY,,,,AlertAlarm/4004Q69950/2023,4004Q69950,,America/New_York
294,2023-09-23T11:03:00,,,0.0,1,Device,,Alarm Relay,Sep 23 2023 11:03AM,False,False,True,,,,,,,ALM,CH_ALARMRELAY,,,,AlertAlarm/4004Q69950/2023,4004Q69950,,America/New_York
295,2023-09-23T11:03:00,,,0.0,123,Device,,RUN CAPACITY LIMITED-HIGH COMPRESSOR LIFT,Sep 23 2023 11:03AM,False,True,True,,,,,,,ALARM_01,CH_ALARM_01,,,,AlertAlarm/4004Q69950/2023,4004Q69950,,America/New_York
296,2023-09-23T11:03:00,,,0.0,163,Device,,SENSOR ALERT-CONDENSER APPROACH,Sep 23 2023 11:03AM,False,True,True,,,,,,,ALARM_02,CH_ALARM_02,,,,AlertAlarm/4004Q69950/2023,4004Q69950,,America/New_York
297,2023-09-23T11:03:00,,,0.0,120,Device,,RUN CAPACITY LIMITED-HIGH CONDENSER PRESSURE,Sep 23 2023 11:03AM,False,True,True,,,,,,,ALARM_03,CH_ALARM_03,,,,AlertAlarm/4004Q69950/2023,4004Q69950,,America/New_York
298,2023-09-23T11:03:00,https://alarmssaveandnotifyprod.blob.core.windows.net/snapshot/vu139530540410_42/2023/9/23/11/3/VU139530540410_42_1695466991,,0.0,238,Device,,PROTECTIVE LIMIT-EXCESSIVE COMPR SURGE,Sep 23 2023 11:03AM,True,False,False,,,,,,,ALARM_01,CH_ALARM_01,,,,AlertAlarm/4004Q69950/2023,4004Q69950,,America/New_York
299,2023-09-23T12:38:00,,,0.0,238,Device,,PROTECTIVE LIMIT-EXCESSIVE COMPR SURGE,Sep 23 2023 12:38PM,True,False,True,,,,,,,ALARM_01,CH_ALARM_01,,,,AlertAlarm/4004Q69950/2023,4004Q69950,,America/New_York
300,,,,,1,Device,,,9/23/2023 8:43:48 AM -04:00,True,False,False,0.0,,,,,,ALM,CH_ALARMRELAY,,,,AlertAlarm/4004Q69950/2023,4004Q69950,,America/New_York
301,2023-09-23T18:03:00,,,0.0,1,Device,,Alarm Relay,Sep 23 2023  6:03PM,False,False,True,,,,,,,ALM,CH_ALARMRELAY,,,,AlertAlarm/4004Q69950/2023,4004Q69950,,America/New_York
302,,,,,1,Device,,,9/23/2023 2:08:49 PM -04:00,True,False,False,0.0,,,,,,ALM,CH_ALARMRELAY,,,,AlertAlarm/4004Q69950/2023,4004Q69950,,America/New_York
303,2023-09-23T19:08:00,,,0.0,1,Device,,Alarm Relay,Sep 23 2023  7:08PM,False,False,True,,,,,,,ALM,CH_ALARMRELAY,,,,AlertAlarm/4004Q69950/2023,4004Q69950,,America/New_York
304,,,,,1,Device,,,9/23/2023 3:13:49 PM -04:00,True,False,False,0.0,,,,,,ALM,CH_ALARMRELAY,,,,AlertAlarm/4004Q69950/2023,4004Q69950,,America/New_York
305,2023-09-23T23:08:00,,,0.0,1,Device,,Alarm Relay,Sep 23 2023 11:08PM,False,False,True,,,,,,,ALM,CH_ALARMRELAY,,,,AlertAlarm/4004Q69950/2023,4004Q69950,,America/New_York
306,,,,,1,Device,,,9/23/2023 7:13:50 PM -04:00,True,False,False,0.0,,,,,,ALM,CH_ALARMRELAY,,,,AlertAlarm/4004Q69950/2023,4004Q69950,,America/New_York
307,2023-09-24T03:08:00,,,0.0,1,Device,,Alarm Relay,Sep 24 2023  3:08AM,False,False,True,,,,,,,ALM,CH_ALARMRELAY,,,,AlertAlarm/4004Q69950/2023,4004Q69950,,America/New_York
308,,,,,1,Device,,,9/23/2023 11:13:50 PM -04:00,True,False,False,0.0,,,,,,ALM,CH_ALARMRELAY,,,,AlertAlarm/4004Q69950/2023,4004Q69950,,America/New_York
309,2023-09-24T04:13:00,,,0.0,1,Device,,Alarm Relay,Sep 24 2023  4:13AM,False,False,True,,,,,,,ALM,CH_ALARMRELAY,,,,AlertAlarm/4004Q69950/2023,4004Q69950,,America/New_York
310,,,,,1,Device,,,9/24/2023 12:18:51 AM -04:00,True,False,False,0.0,,,,,,ALM,CH_ALARMRELAY,,,,AlertAlarm/4004Q69950/2023,4004Q69950,,America/New_York
311,2023-09-24T10:33:00,,,0.0,1,Device,,Alarm Relay,Sep 24 2023 10:33AM,False,False,True,,,,,,,ALM,CH_ALARMRELAY,,,,AlertAlarm/4004Q69950/2023,4004Q69950,,America/New_York
312,,,,,1,Device,,,9/24/2023 6:38:52 AM -04:00,True,False,False,0.0,,,,,,ALM,CH_ALARMRELAY,,,,AlertAlarm/4004Q69950/2023,4004Q69950,,America/New_York
313,2023-09-24T13:33:00,,,0.0,1,Device,,Alarm Relay,Sep 24 2023  1:33PM,False,False,True,,,,,,,ALM,CH_ALARMRELAY,,,,AlertAlarm/4004Q69950/2023,4004Q69950,,America/New_York
314,2023-09-26T21:51:00,https://alarmssaveandnotifyprod.blob.core.windows.net/snapshot/vu139530540410_42/2023/9/26/22/24/VU139530540410_42_1695765071,,0.0,123,Device,,RUN CAPACITY LIMITED-HIGH COMPRESSOR LIFT,Sep 26 2023  9:51PM,False,True,False,,,,,,,ALARM_01,CH_ALARM_01,,,,AlertAlarm/4004Q69950/2023,4004Q69950,,America/New_York
315,,,,,2,Device,,,9/26/2023 5:51:28 PM -04:00,False,True,False,1.0,,,,,,SYS_ALM,SystemAlertAlarm,,,,AlertAlarm/4004Q69950/2023,4004Q69950,,America/New_York
316,2023-09-26T22:16:00,,,0.0,2,Device,,System Alert /Alarm,Sep 26 2023 10:16PM,False,False,True,,,,,,,SYS_ALM,SystemAlertAlarm,,,,AlertAlarm/4004Q69950/2023,4004Q69950,,America/New_York
317,2023-09-26T22:16:00,,,0.0,123,Device,,RUN CAPACITY LIMITED-HIGH COMPRESSOR LIFT,Sep 26 2023 10:16PM,False,True,True,,,,,,,ALARM_01,CH_ALARM_01,,,,AlertAlarm/4004Q69950/2023,4004Q69950,,America/New_York
318,2023-09-27T21:46:00,https://alarmssaveandnotifyprod.blob.core.windows.net/snapshot/vu139530540410_42/2023/9/27/22/26/VU139530540410_42_1695851213,,0.0,123,Device,,RUN CAPACITY LIMITED-HIGH COMPRESSOR LIFT,Sep 27 2023  9:46PM,False,True,False,,,,,,,ALARM_01,CH_ALARM_01,,,,AlertAlarm/4004Q69950/2023,4004Q69950,,America/New_York
319,,,,,2,Device,,,9/27/2023 5:50:48 PM -04:00,False,True,False,1.0,,,,,,SYS_ALM,SystemAlertAlarm,,,,AlertAlarm/4004Q69950/2023,4004Q69950,,America/New_York
320,2023-09-27T22:00:00,,,0.0,2,Device,,System Alert /Alarm,Sep 27 2023 10:00PM,False,False,True,,,,,,,SYS_ALM,SystemAlertAlarm,,,,AlertAlarm/4004Q69950/2023,4004Q69950,,America/New_York
321,2023-09-27T22:00:00,,,0.0,123,Device,,RUN CAPACITY LIMITED-HIGH COMPRESSOR LIFT,Sep 27 2023 10:00PM,False,True,True,,,,,,,ALARM_01,CH_ALARM_01,,,,AlertAlarm/4004Q69950/2023,4004Q69950,,America/New_York
322,2023-09-30T11:47:00,https://alarmssaveandnotifyprod.blob.core.windows.net/snapshot/vu139530540410_42/2023/9/30/13/29/VU139530540410_42_1696074457,,0.0,162,Device,,SENSOR ALERT-EVAPORATOR APPROACH,Sep 30 2023 11:47AM,False,True,False,,,,,,,ALARM_01,CH_ALARM_01,,,,AlertAlarm/4004Q69950/2023,4004Q69950,,America/New_York
323,2023-10-03T01:38:00,,,0.0,162,Device,,SENSOR ALERT-EVAPORATOR APPROACH,Oct  3 2023  1:38AM,False,True,True,,,,,,,ALARM_01,CH_ALARM_01,,,,AlertAlarm/4004Q69950/2023,4004Q69950,,America/New_York
324,2023-10-03T01:38:00,https://alarmssaveandnotifyprod.blob.core.windows.net/snapshot/vu139530540410_42/2023/10/3/3/47/VU139530540410_42_1696297100,,0.0,150,Device,,SENSOR ALERT-HIGH BEARING TEMPERATURE,Oct  3 2023  1:38AM,False,True,False,,,,,,,ALARM_01,CH_ALARM_01,,,,AlertAlarm/4004Q69950/2023,4004Q69950,,America/New_York
325,2023-10-20T13:11:00,,,0.0,150,Device,,SENSOR ALERT-HIGH BEARING TEMPERATURE,Oct 20 2023  1:11PM,False,True,True,,,,,,,ALARM_01,CH_ALARM_01,,,,AlertAlarm/4004Q69950/2023,4004Q69950,,America/New_York
326,2023-10-20T13:11:00,https://alarmssaveandnotifyprod.blob.core.windows.net/snapshot/vu139530540410_42/2023/10/20/13/52/VU139530540410_42_1697807511,,0.0,163,Device,,SENSOR ALERT-CONDENSER APPROACH,Oct 20 2023  1:11PM,False,True,False,,,,,,,ALARM_01,CH_ALARM_01,,,,AlertAlarm/4004Q69950/2023,4004Q69950,,America/New_York
327,2023-10-27T01:50:00,,,0.0,163,Device,,SENSOR ALERT-CONDENSER APPROACH,Oct 27 2023  1:50AM,False,True,True,,,,,,,ALARM_01,CH_ALARM_01,,,,AlertAlarm/4004Q69950/2023,4004Q69950,,America/New_York
328,2023-10-27T01:50:00,https://alarmssaveandnotifyprod.blob.core.windows.net/snapshot/vu139530540410_42/2023/10/27/2/17/VU139530540410_42_1698371411,,0.0,150,Device,,SENSOR ALERT-HIGH BEARING TEMPERATURE,Oct 27 2023  1:50AM,False,True,False,,,,,,,ALARM_01,CH_ALARM_01,,,,AlertAlarm/4004Q69950/2023,4004Q69950,,America/New_York
329,,,,,2,Device,,,11/5/2023 4:33:31 PM -05:00,False,True,False,1.0,,,,,,SYS_ALM,SystemAlertAlarm,,,,AlertAlarm/4004Q69950/2023,4004Q69950,,America/New_York
330,2023-11-05T21:16:00,,,0.0,2,Device,,System Alert /Alarm,Nov  5 2023  9:16PM,False,False,True,,,,,,,SYS_ALM,SystemAlertAlarm,,,,AlertAlarm/4004Q69950/2023,4004Q69950,,America/New_York
331,2023-11-05T21:16:00,,,0.0,150,Device,,SENSOR ALERT-HIGH BEARING TEMPERATURE,Nov  5 2023  9:16PM,False,True,True,,,,,,,ALARM_01,CH_ALARM_01,,,,AlertAlarm/4004Q69950/2023,4004Q69950,,America/New_York
332,2023-11-05T21:16:00,https://alarmssaveandnotifyprod.blob.core.windows.net/snapshot/vu139530540410_42/2023/11/5/21/37/VU139530540410_42_1699219005,,0.0,163,Device,,SENSOR ALERT-CONDENSER APPROACH,Nov  5 2023  9:16PM,False,True,False,,,,,,,ALARM_01,CH_ALARM_01,,,,AlertAlarm/4004Q69950/2023,4004Q69950,,America/New_York
333,,,,,2,Device,,,11/5/2023 4:48:31 PM -05:00,False,True,False,1.0,,,,,,SYS_ALM,SystemAlertAlarm,,,,AlertAlarm/4004Q69950/2023,4004Q69950,,America/New_York
334,,,,,2,Device,,,11/5/2023 5:03:31 PM -05:00,False,True,False,1.0,,,,,,SYS_ALM,SystemAlertAlarm,,,,AlertAlarm/4004Q69950/2023,4004Q69950,,America/New_York
335,,,,,2,Device,,,11/5/2023 4:58:31 PM -05:00,False,True,False,1.0,,,,,,SYS_ALM,SystemAlertAlarm,,,,AlertAlarm/4004Q69950/2023,4004Q69950,,America/New_York
336,,,,,2,Device,,,11/5/2023 5:18:31 PM -05:00,False,True,False,1.0,,,,,,SYS_ALM,SystemAlertAlarm,,,,AlertAlarm/4004Q69950/2023,4004Q69950,,America/New_York
337,,,,,2,Device,,,11/5/2023 5:33:31 PM -05:00,False,True,False,1.0,,,,,,SYS_ALM,SystemAlertAlarm,,,,AlertAlarm/4004Q69950/2023,4004Q69950,,America/New_York
338,,,,,2,Device,,,11/5/2023 5:43:31 PM -05:00,False,True,False,1.0,,,,,,SYS_ALM,SystemAlertAlarm,,,,AlertAlarm/4004Q69950/2023,4004Q69950,,America/New_York
339,,,,,2,Device,,,11/5/2023 5:48:31 PM -05:00,False,True,False,1.0,,,,,,SYS_ALM,SystemAlertAlarm,,,,AlertAlarm/4004Q69950/2023,4004Q69950,,America/New_York
340,,,,,2,Device,,,11/5/2023 5:58:31 PM -05:00,False,True,False,1.0,,,,,,SYS_ALM,SystemAlertAlarm,,,,AlertAlarm/4004Q69950/2023,4004Q69950,,America/New_York
341,,,,,2,Device,,,11/5/2023 5:53:31 PM -05:00,False,True,False,1.0,,,,,,SYS_ALM,SystemAlertAlarm,,,,AlertAlarm/4004Q69950/2023,4004Q69950,,America/New_York
342,,,,,2,Device,,,11/5/2023 6:03:31 PM -05:00,False,True,False,1.0,,,,,,SYS_ALM,SystemAlertAlarm,,,,AlertAlarm/4004Q69950/2023,4004Q69950,,America/New_York
343,,,,,2,Device,,,11/5/2023 6:23:31 PM -05:00,False,True,False,1.0,,,,,,SYS_ALM,SystemAlertAlarm,,,,AlertAlarm/4004Q69950/2023,4004Q69950,,America/New_York
344,,,,,2,Device,,,11/5/2023 6:28:31 PM -05:00,False,True,False,1.0,,,,,,SYS_ALM,SystemAlertAlarm,,,,AlertAlarm/4004Q69950/2023,4004Q69950,,America/New_York
345,,,,,2,Device,,,11/5/2023 6:33:31 PM -05:00,False,True,False,1.0,,,,,,SYS_ALM,SystemAlertAlarm,,,,AlertAlarm/4004Q69950/2023,4004Q69950,,America/New_York
346,,,,,2,Device,,,11/5/2023 6:43:31 PM -05:00,False,True,False,1.0,,,,,,SYS_ALM,SystemAlertAlarm,,,,AlertAlarm/4004Q69950/2023,4004Q69950,,America/New_York
347,,,,,2,Device,,,11/5/2023 7:13:32 PM -05:00,False,True,False,1.0,,,,,,SYS_ALM,SystemAlertAlarm,,,,AlertAlarm/4004Q69950/2023,4004Q69950,,America/New_York
348,,,,,2,Device,,,11/5/2023 7:18:32 PM -05:00,False,True,False,1.0,,,,,,SYS_ALM,SystemAlertAlarm,,,,AlertAlarm/4004Q69950/2023,4004Q69950,,America/New_York
349,,,,,2,Device,,,11/5/2023 7:33:32 PM -05:00,False,True,False,1.0,,,,,,SYS_ALM,SystemAlertAlarm,,,,AlertAlarm/4004Q69950/2023,4004Q69950,,America/New_York
350,,,,,2,Device,,,11/5/2023 7:03:32 PM -05:00,False,True,False,1.0,,,,,,SYS_ALM,SystemAlertAlarm,,,,AlertAlarm/4004Q69950/2023,4004Q69950,,America/New_York
351,,,,,2,Device,,,11/5/2023 7:43:32 PM -05:00,False,True,False,1.0,,,,,,SYS_ALM,SystemAlertAlarm,,,,AlertAlarm/4004Q69950/2023,4004Q69950,,America/New_York
352,,,,,2,Device,,,11/5/2023 8:23:32 PM -05:00,False,True,False,1.0,,,,,,SYS_ALM,SystemAlertAlarm,,,,AlertAlarm/4004Q69950/2023,4004Q69950,,America/New_York
353,,,,,2,Device,,,11/5/2023 8:48:32 PM -05:00,False,True,False,1.0,,,,,,SYS_ALM,SystemAlertAlarm,,,,AlertAlarm/4004Q69950/2023,4004Q69950,,America/New_York
354,,,,,2,Device,,,11/5/2023 9:03:32 PM -05:00,False,True,False,1.0,,,,,,SYS_ALM,SystemAlertAlarm,,,,AlertAlarm/4004Q69950/2023,4004Q69950,,America/New_York
355,,,,,2,Device,,,11/5/2023 8:53:32 PM -05:00,False,True,False,1.0,,,,,,SYS_ALM,SystemAlertAlarm,,,,AlertAlarm/4004Q69950/2023,4004Q69950,,America/New_York
356,,,,,2,Device,,,11/5/2023 8:58:32 PM -05:00,False,True,False,1.0,,,,,,SYS_ALM,SystemAlertAlarm,,,,AlertAlarm/4004Q69950/2023,4004Q69950,,America/New_York
357,,,,,2,Device,,,11/5/2023 9:28:32 PM -05:00,False,True,False,1.0,,,,,,SYS_ALM,SystemAlertAlarm,,,,AlertAlarm/4004Q69950/2023,4004Q69950,,America/New_York
358,,,,,2,Device,,,11/5/2023 9:38:32 PM -05:00,False,True,False,1.0,,,,,,SYS_ALM,SystemAlertAlarm,,,,AlertAlarm/4004Q69950/2023,4004Q69950,,America/New_York
359,,,,,2,Device,,,11/5/2023 9:48:32 PM -05:00,False,True,False,1.0,,,,,,SYS_ALM,SystemAlertAlarm,,,,AlertAlarm/4004Q69950/2023,4004Q69950,,America/New_York
360,,,,,2,Device,,,11/5/2023 9:53:32 PM -05:00,False,True,False,1.0,,,,,,SYS_ALM,SystemAlertAlarm,,,,AlertAlarm/4004Q69950/2023,4004Q69950,,America/New_York
361,,,,,2,Device,,,11/5/2023 10:58:32 PM -04:00,False,True,False,1.0,,,,,,SYS_ALM,SystemAlertAlarm,,,,AlertAlarm/4004Q69950/2023,4004Q69950,,America/New_York
362,,,,,2,Device,,,11/5/2023 10:03:32 PM -05:00,False,True,False,1.0,,,,,,SYS_ALM,SystemAlertAlarm,,,,AlertAlarm/4004Q69950/2023,4004Q69950,,America/New_York
363,,,,,2,Device,,,11/5/2023 10:23:32 PM -05:00,False,True,False,1.0,,,,,,SYS_ALM,SystemAlertAlarm,,,,AlertAlarm/4004Q69950/2023,4004Q69950,,America/New_York
364,,,,,2,Device,,,11/5/2023 10:28:32 PM -05:00,False,True,False,1.0,,,,,,SYS_ALM,SystemAlertAlarm,,,,AlertAlarm/4004Q69950/2023,4004Q69950,,America/New_York
365,,,,,2,Device,,,11/5/2023 10:33:32 PM -05:00,False,True,False,1.0,,,,,,SYS_ALM,SystemAlertAlarm,,,,AlertAlarm/4004Q69950/2023,4004Q69950,,America/New_York
366,,,,,2,Device,,,11/5/2023 10:38:32 PM -05:00,False,True,False,1.0,,,,,,SYS_ALM,SystemAlertAlarm,,,,AlertAlarm/4004Q69950/2023,4004Q69950,,America/New_York
367,,,,,2,Device,,,11/5/2023 10:43:32 PM -05:00,False,True,False,1.0,,,,,,SYS_ALM,SystemAlertAlarm,,,,AlertAlarm/4004Q69950/2023,4004Q69950,,America/New_York
368,,,,,2,Device,,,11/5/2023 10:48:32 PM -05:00,False,True,False,1.0,,,,,,SYS_ALM,SystemAlertAlarm,,,,AlertAlarm/4004Q69950/2023,4004Q69950,,America/New_York
369,,,,,2,Device,,,11/5/2023 10:53:32 PM -05:00,False,True,False,1.0,,,,,,SYS_ALM,SystemAlertAlarm,,,,AlertAlarm/4004Q69950/2023,4004Q69950,,America/New_York
370,,,,,2,Device,,,11/5/2023 11:03:32 PM -05:00,False,True,False,1.0,,,,,,SYS_ALM,SystemAlertAlarm,,,,AlertAlarm/4004Q69950/2023,4004Q69950,,America/New_York
371,,,,,2,Device,,,11/5/2023 11:38:32 PM -05:00,False,True,False,1.0,,,,,,SYS_ALM,SystemAlertAlarm,,,,AlertAlarm/4004Q69950/2023,4004Q69950,,America/New_York
372,,,,,2,Device,,,11/5/2023 11:48:32 PM -05:00,False,True,False,1.0,,,,,,SYS_ALM,SystemAlertAlarm,,,,AlertAlarm/4004Q69950/2023,4004Q69950,,America/New_York
373,,,,,2,Device,,,11/5/2023 11:53:32 PM -05:00,False,True,False,1.0,,,,,,SYS_ALM,SystemAlertAlarm,,,,AlertAlarm/4004Q69950/2023,4004Q69950,,America/New_York
374,,,,,2,Device,,,11/6/2023 12:38:33 AM -05:00,False,True,False,1.0,,,,,,SYS_ALM,SystemAlertAlarm,,,,AlertAlarm/4004Q69950/2023,4004Q69950,,America/New_York
375,,,,,2,Device,,,11/6/2023 12:58:33 AM -05:00,False,True,False,1.0,,,,,,SYS_ALM,SystemAlertAlarm,,,,AlertAlarm/4004Q69950/2023,4004Q69950,,America/New_York
376,,,,,2,Device,,,11/6/2023 1:03:33 AM -05:00,False,True,False,1.0,,,,,,SYS_ALM,SystemAlertAlarm,,,,AlertAlarm/4004Q69950/2023,4004Q69950,,America/New_York
377,,,,,2,Device,,,11/6/2023 1:23:33 AM -05:00,False,True,False,1.0,,,,,,SYS_ALM,SystemAlertAlarm,,,,AlertAlarm/4004Q69950/2023,4004Q69950,,America/New_York
378,,,,,2,Device,,,11/6/2023 1:38:33 AM -05:00,False,True,False,1.0,,,,,,SYS_ALM,SystemAlertAlarm,,,,AlertAlarm/4004Q69950/2023,4004Q69950,,America/New_York
379,,,,,2,Device,,,11/6/2023 1:53:33 AM -05:00,False,True,False,1.0,,,,,,SYS_ALM,SystemAlertAlarm,,,,AlertAlarm/4004Q69950/2023,4004Q69950,,America/New_York
380,,,,,2,Device,,,11/6/2023 11:03:35 AM -05:00,False,True,False,1.0,,,,,,SYS_ALM,SystemAlertAlarm,,,,AlertAlarm/4004Q69950/2023,4004Q69950,,America/New_York
381,,,,,2,Device,,,11/6/2023 11:18:35 AM -05:00,False,True,False,1.0,,,,,,SYS_ALM,SystemAlertAlarm,,,,AlertAlarm/4004Q69950/2023,4004Q69950,,America/New_York
382,,,,,2,Device,,,11/6/2023 11:23:35 AM -05:00,False,True,False,1.0,,,,,,SYS_ALM,SystemAlertAlarm,,,,AlertAlarm/4004Q69950/2023,4004Q69950,,America/New_York
383,,,,,2,Device,,,11/6/2023 11:33:35 AM -05:00,False,True,False,1.0,,,,,,SYS_ALM,SystemAlertAlarm,,,,AlertAlarm/4004Q69950/2023,4004Q69950,,America/New_York
384,,,,,2,Device,,,11/6/2023 11:43:35 AM -05:00,False,True,False,1.0,,,,,,SYS_ALM,SystemAlertAlarm,,,,AlertAlarm/4004Q69950/2023,4004Q69950,,America/New_York
385,,,,,2,Device,,,11/6/2023 11:58:35 AM -05:00,False,True,False,1.0,,,,,,SYS_ALM,SystemAlertAlarm,,,,AlertAlarm/4004Q69950/2023,4004Q69950,,America/New_York
386,,,,,2,Device,,,11/6/2023 12:03:35 PM -05:00,False,True,False,1.0,,,,,,SYS_ALM,SystemAlertAlarm,,,,AlertAlarm/4004Q69950/2023,4004Q69950,,America/New_York
387,,,,,2,Device,,,11/6/2023 12:08:35 PM -05:00,False,True,False,1.0,,,,,,SYS_ALM,SystemAlertAlarm,,,,AlertAlarm/4004Q69950/2023,4004Q69950,,America/New_York
388,,,,,2,Device,,,11/6/2023 12:18:35 PM -05:00,False,True,False,1.0,,,,,,SYS_ALM,SystemAlertAlarm,,,,AlertAlarm/4004Q69950/2023,4004Q69950,,America/New_York
389,2023-11-06T17:29:00,,,0.0,2,Device,,System Alert /Alarm,Nov  6 2023  5:29PM,False,False,True,,,,,,,SYS_ALM,SystemAlertAlarm,,,,AlertAlarm/4004Q69950/2023,4004Q69950,,America/New_York
390,2023-11-06T17:29:00,https://alarmssaveandnotifyprod.blob.core.windows.net/snapshot/vu139530540410_42/2023/11/6/17/29/VU139530540410_42_1699291781,,0.0,123,Device,,RUN CAPACITY LIMITED-HIGH COMPRESSOR LIFT,Nov  6 2023  5:29PM,False,True,False,,,,,,,ALARM_02,CH_ALARM_02,,,,AlertAlarm/4004Q69950/2023,4004Q69950,,America/New_York
391,,,,,2,Device,,,11/6/2023 12:23:35 PM -05:00,False,True,False,1.0,,,,,,SYS_ALM,SystemAlertAlarm,,,,AlertAlarm/4004Q69950/2023,4004Q69950,,America/New_York
392,,,,,2,Device,,,11/6/2023 12:43:35 PM -05:00,False,True,False,1.0,,,,,,SYS_ALM,SystemAlertAlarm,,,,AlertAlarm/4004Q69950/2023,4004Q69950,,America/New_York
393,,,,,2,Device,,,11/6/2023 12:48:35 PM -05:00,False,True,False,1.0,,,,,,SYS_ALM,SystemAlertAlarm,,,,AlertAlarm/4004Q69950/2023,4004Q69950,,America/New_York
394,,,,,2,Device,,,11/6/2023 12:53:35 PM -05:00,False,True,False,1.0,,,,,,SYS_ALM,SystemAlertAlarm,,,,AlertAlarm/4004Q69950/2023,4004Q69950,,America/New_York
395,,,,,2,Device,,,11/6/2023 1:03:35 PM -05:00,False,True,False,1.0,,,,,,SYS_ALM,SystemAlertAlarm,,,,AlertAlarm/4004Q69950/2023,4004Q69950,,America/New_York
396,,,,,2,Device,,,11/6/2023 1:28:35 PM -05:00,False,True,False,1.0,,,,,,SYS_ALM,SystemAlertAlarm,,,,AlertAlarm/4004Q69950/2023,4004Q69950,,America/New_York
397,,,,,2,Device,,,11/6/2023 1:33:35 PM -05:00,False,True,False,1.0,,,,,,SYS_ALM,SystemAlertAlarm,,,,AlertAlarm/4004Q69950/2023,4004Q69950,,America/New_York
398,,,,,2,Device,,,11/6/2023 1:38:35 PM -05:00,False,True,False,1.0,,,,,,SYS_ALM,SystemAlertAlarm,,,,AlertAlarm/4004Q69950/2023,4004Q69950,,America/New_York
399,,,,,3,Device,,,11/6/2023 1:53:35 PM -05:00,True,False,False,1.0,,,,,,SYS_ALM,SystemAlertAlarm,,,,AlertAlarm/4004Q69950/2023,4004Q69950,,America/New_York
400,,,,,3,Device,,,11/6/2023 1:58:35 PM -05:00,True,False,False,1.0,,,,,,SYS_ALM,SystemAlertAlarm,,,,AlertAlarm/4004Q69950/2023,4004Q69950,,America/New_York
401,,,,,3,Device,,,11/6/2023 2:03:35 PM -05:00,True,False,False,1.0,,,,,,SYS_ALM,SystemAlertAlarm,,,,AlertAlarm/4004Q69950/2023,4004Q69950,,America/New_York
402,,,,,3,Device,,,11/6/2023 2:08:35 PM -05:00,True,False,False,1.0,,,,,,SYS_ALM,SystemAlertAlarm,,,,AlertAlarm/4004Q69950/2023,4004Q69950,,America/New_York
403,,,,,3,Device,,,11/6/2023 2:13:35 PM -05:00,True,False,False,1.0,,,,,,SYS_ALM,SystemAlertAlarm,,,,AlertAlarm/4004Q69950/2023,4004Q69950,,America/New_York
404,,,,,3,Device,,,11/6/2023 2:18:35 PM -05:00,True,False,False,1.0,,,,,,SYS_ALM,SystemAlertAlarm,,,,AlertAlarm/4004Q69950/2023,4004Q69950,,America/New_York
405,,,,,3,Device,,,11/6/2023 2:23:35 PM -05:00,True,False,False,1.0,,,,,,SYS_ALM,SystemAlertAlarm,,,,AlertAlarm/4004Q69950/2023,4004Q69950,,America/New_York
406,,,,,3,Device,,,11/6/2023 2:28:35 PM -05:00,True,False,False,1.0,,,,,,SYS_ALM,SystemAlertAlarm,,,,AlertAlarm/4004Q69950/2023,4004Q69950,,America/New_York
407,,,,,3,Device,,,11/6/2023 2:33:35 PM -05:00,True,False,False,1.0,,,,,,SYS_ALM,SystemAlertAlarm,,,,AlertAlarm/4004Q69950/2023,4004Q69950,,America/New_York
408,,,,,3,Device,,,11/6/2023 2:38:35 PM -05:00,True,False,False,1.0,,,,,,SYS_ALM,SystemAlertAlarm,,,,AlertAlarm/4004Q69950/2023,4004Q69950,,America/New_York
409,,,,,3,Device,,,11/6/2023 2:43:35 PM -05:00,True,False,False,1.0,,,,,,SYS_ALM,SystemAlertAlarm,,,,AlertAlarm/4004Q69950/2023,4004Q69950,,America/New_York
410,,,,,3,Device,,,11/6/2023 2:48:35 PM -05:00,True,False,False,1.0,,,,,,SYS_ALM,SystemAlertAlarm,,,,AlertAlarm/4004Q69950/2023,4004Q69950,,America/New_York
411,,,,,3,Device,,,11/6/2023 2:53:35 PM -05:00,True,False,False,1.0,,,,,,SYS_ALM,SystemAlertAlarm,,,,AlertAlarm/4004Q69950/2023,4004Q69950,,America/New_York
412,,,,,3,Device,,,11/6/2023 2:58:35 PM -05:00,True,False,False,1.0,,,,,,SYS_ALM,SystemAlertAlarm,,,,AlertAlarm/4004Q69950/2023,4004Q69950,,America/New_York
413,,,,,3,Device,,,11/6/2023 3:03:35 PM -05:00,True,False,False,1.0,,,,,,SYS_ALM,SystemAlertAlarm,,,,AlertAlarm/4004Q69950/2023,4004Q69950,,America/New_York
414,,,,,3,Device,,,11/6/2023 3:08:35 PM -05:00,True,False,False,1.0,,,,,,SYS_ALM,SystemAlertAlarm,,,,AlertAlarm/4004Q69950/2023,4004Q69950,,America/New_York
415,,,,,3,Device,,,11/6/2023 3:13:35 PM -05:00,True,False,False,1.0,,,,,,SYS_ALM,SystemAlertAlarm,,,,AlertAlarm/4004Q69950/2023,4004Q69950,,America/New_York
416,,,,,3,Device,,,11/6/2023 3:18:35 PM -05:00,True,False,False,1.0,,,,,,SYS_ALM,SystemAlertAlarm,,,,AlertAlarm/4004Q69950/2023,4004Q69950,,America/New_York
417,,,,,3,Device,,,11/6/2023 3:23:35 PM -05:00,True,False,False,1.0,,,,,,SYS_ALM,SystemAlertAlarm,,,,AlertAlarm/4004Q69950/2023,4004Q69950,,America/New_York
418,,,,,3,Device,,,11/6/2023 3:28:35 PM -05:00,True,False,False,1.0,,,,,,SYS_ALM,SystemAlertAlarm,,,,AlertAlarm/4004Q69950/2023,4004Q69950,,America/New_York
419,,,,,3,Device,,,11/6/2023 4:33:36 PM -04:00,True,False,False,1.0,,,,,,SYS_ALM,SystemAlertAlarm,,,,AlertAlarm/4004Q69950/2023,4004Q69950,,America/New_York
420,,,,,3,Device,,,11/6/2023 3:38:36 PM -05:00,True,False,False,1.0,,,,,,SYS_ALM,SystemAlertAlarm,,,,AlertAlarm/4004Q69950/2023,4004Q69950,,America/New_York
421,,,,,3,Device,,,11/6/2023 3:43:36 PM -05:00,True,False,False,1.0,,,,,,SYS_ALM,SystemAlertAlarm,,,,AlertAlarm/4004Q69950/2023,4004Q69950,,America/New_York
422,,,,,3,Device,,,11/6/2023 3:48:36 PM -05:00,True,False,False,1.0,,,,,,SYS_ALM,SystemAlertAlarm,,,,AlertAlarm/4004Q69950/2023,4004Q69950,,America/New_York
423,,,,,3,Device,,,11/6/2023 3:53:36 PM -05:00,True,False,False,1.0,,,,,,SYS_ALM,SystemAlertAlarm,,,,AlertAlarm/4004Q69950/2023,4004Q69950,,America/New_York
424,,,,,3,Device,,,11/6/2023 3:58:36 PM -05:00,True,False,False,1.0,,,,,,SYS_ALM,SystemAlertAlarm,,,,AlertAlarm/4004Q69950/2023,4004Q69950,,America/New_York
425,,,,,3,Device,,,11/6/2023 4:03:36 PM -05:00,True,False,False,1.0,,,,,,SYS_ALM,SystemAlertAlarm,,,,AlertAlarm/4004Q69950/2023,4004Q69950,,America/New_York
426,,,,,3,Device,,,11/6/2023 4:18:36 PM -05:00,True,False,False,1.0,,,,,,SYS_ALM,SystemAlertAlarm,,,,AlertAlarm/4004Q69950/2023,4004Q69950,,America/New_York
427,,,,,3,Device,,,11/6/2023 4:23:36 PM -05:00,True,False,False,1.0,,,,,,SYS_ALM,SystemAlertAlarm,,,,AlertAlarm/4004Q69950/2023,4004Q69950,,America/New_York
428,,,,,3,Device,,,11/6/2023 4:13:36 PM -05:00,True,False,False,1.0,,,,,,SYS_ALM,SystemAlertAlarm,,,,AlertAlarm/4004Q69950/2023,4004Q69950,,America/New_York
429,,,,,3,Device,,,11/6/2023 4:28:36 PM -05:00,True,False,False,1.0,,,,,,SYS_ALM,SystemAlertAlarm,,,,AlertAlarm/4004Q69950/2023,4004Q69950,,America/New_York
430,,,,,3,Device,,,11/6/2023 4:38:36 PM -05:00,True,False,False,1.0,,,,,,SYS_ALM,SystemAlertAlarm,,,,AlertAlarm/4004Q69950/2023,4004Q69950,,America/New_York
431,,,,,3,Device,,,11/6/2023 4:08:36 PM -05:00,True,False,False,1.0,,,,,,SYS_ALM,SystemAlertAlarm,,,,AlertAlarm/4004Q69950/2023,4004Q69950,,America/New_York
432,,,,,3,Device,,,11/6/2023 4:33:36 PM -05:00,True,False,False,1.0,,,,,,SYS_ALM,SystemAlertAlarm,,,,AlertAlarm/4004Q69950/2023,4004Q69950,,America/New_York
433,,,,,3,Device,,,11/6/2023 4:53:36 PM -05:00,True,False,False,1.0,,,,,,SYS_ALM,SystemAlertAlarm,,,,AlertAlarm/4004Q69950/2023,4004Q69950,,America/New_York
434,,,,,3,Device,,,11/6/2023 4:43:36 PM -05:00,True,False,False,1.0,,,,,,SYS_ALM,SystemAlertAlarm,,,,AlertAlarm/4004Q69950/2023,4004Q69950,,America/New_York
435,,,,,3,Device,,,11/6/2023 4:48:36 PM -05:00,True,False,False,1.0,,,,,,SYS_ALM,SystemAlertAlarm,,,,AlertAlarm/4004Q69950/2023,4004Q69950,,America/New_York
436,,,,,3,Device,,,11/6/2023 4:58:36 PM -05:00,True,False,False,1.0,,,,,,SYS_ALM,SystemAlertAlarm,,,,AlertAlarm/4004Q69950/2023,4004Q69950,,America/New_York
437,,,,,3,Device,,,11/6/2023 5:03:36 PM -05:00,True,False,False,1.0,,,,,,SYS_ALM,SystemAlertAlarm,,,,AlertAlarm/4004Q69950/2023,4004Q69950,,America/New_York
438,,,,,3,Device,,,11/6/2023 5:08:36 PM -05:00,True,False,False,1.0,,,,,,SYS_ALM,SystemAlertAlarm,,,,AlertAlarm/4004Q69950/2023,4004Q69950,,America/New_York
439,,,,,3,Device,,,11/6/2023 5:13:36 PM -05:00,True,False,False,1.0,,,,,,SYS_ALM,SystemAlertAlarm,,,,AlertAlarm/4004Q69950/2023,4004Q69950,,America/New_York
440,,,,,3,Device,,,11/6/2023 5:18:36 PM -05:00,True,False,False,1.0,,,,,,SYS_ALM,SystemAlertAlarm,,,,AlertAlarm/4004Q69950/2023,4004Q69950,,America/New_York
441,,,,,3,Device,,,11/6/2023 5:23:36 PM -05:00,True,False,False,1.0,,,,,,SYS_ALM,SystemAlertAlarm,,,,AlertAlarm/4004Q69950/2023,4004Q69950,,America/New_York
442,,,,,3,Device,,,11/6/2023 5:28:36 PM -05:00,True,False,False,1.0,,,,,,SYS_ALM,SystemAlertAlarm,,,,AlertAlarm/4004Q69950/2023,4004Q69950,,America/New_York
443,,,,,3,Device,,,11/6/2023 5:33:36 PM -05:00,True,False,False,1.0,,,,,,SYS_ALM,SystemAlertAlarm,,,,AlertAlarm/4004Q69950/2023,4004Q69950,,America/New_York
444,,,,,3,Device,,,11/6/2023 5:38:36 PM -05:00,True,False,False,1.0,,,,,,SYS_ALM,SystemAlertAlarm,,,,AlertAlarm/4004Q69950/2023,4004Q69950,,America/New_York
445,,,,,3,Device,,,11/6/2023 5:43:36 PM -05:00,True,False,False,1.0,,,,,,SYS_ALM,SystemAlertAlarm,,,,AlertAlarm/4004Q69950/2023,4004Q69950,,America/New_York
446,,,,,3,Device,,,11/6/2023 5:48:36 PM -05:00,True,False,False,1.0,,,,,,SYS_ALM,SystemAlertAlarm,,,,AlertAlarm/4004Q69950/2023,4004Q69950,,America/New_York
447,,,,,3,Device,,,11/6/2023 5:53:36 PM -05:00,True,False,False,1.0,,,,,,SYS_ALM,SystemAlertAlarm,,,,AlertAlarm/4004Q69950/2023,4004Q69950,,America/New_York
448,,,,,3,Device,,,11/6/2023 5:58:36 PM -05:00,True,False,False,1.0,,,,,,SYS_ALM,SystemAlertAlarm,,,,AlertAlarm/4004Q69950/2023,4004Q69950,,America/New_York
449,,,,,3,Device,,,11/6/2023 6:03:36 PM -05:00,True,False,False,1.0,,,,,,SYS_ALM,SystemAlertAlarm,,,,AlertAlarm/4004Q69950/2023,4004Q69950,,America/New_York
450,,,,,3,Device,,,11/6/2023 6:08:36 PM -05:00,True,False,False,1.0,,,,,,SYS_ALM,SystemAlertAlarm,,,,AlertAlarm/4004Q69950/2023,4004Q69950,,America/New_York
451,,,,,3,Device,,,11/6/2023 6:13:36 PM -05:00,True,False,False,1.0,,,,,,SYS_ALM,SystemAlertAlarm,,,,AlertAlarm/4004Q69950/2023,4004Q69950,,America/New_York
452,,,,,3,Device,,,11/6/2023 6:23:36 PM -05:00,True,False,False,1.0,,,,,,SYS_ALM,SystemAlertAlarm,,,,AlertAlarm/4004Q69950/2023,4004Q69950,,America/New_York
453,,,,,3,Device,,,11/6/2023 6:18:36 PM -05:00,True,False,False,1.0,,,,,,SYS_ALM,SystemAlertAlarm,,,,AlertAlarm/4004Q69950/2023,4004Q69950,,America/New_York
454,,,,,3,Device,,,11/6/2023 6:28:36 PM -05:00,True,False,False,1.0,,,,,,SYS_ALM,SystemAlertAlarm,,,,AlertAlarm/4004Q69950/2023,4004Q69950,,America/New_York
455,,,,,3,Device,,,11/6/2023 6:38:36 PM -05:00,True,False,False,1.0,,,,,,SYS_ALM,SystemAlertAlarm,,,,AlertAlarm/4004Q69950/2023,4004Q69950,,America/New_York
456,,,,,3,Device,,,11/6/2023 6:33:36 PM -05:00,True,False,False,1.0,,,,,,SYS_ALM,SystemAlertAlarm,,,,AlertAlarm/4004Q69950/2023,4004Q69950,,America/New_York
457,,,,,3,Device,,,11/6/2023 6:43:36 PM -05:00,True,False,False,1.0,,,,,,SYS_ALM,SystemAlertAlarm,,,,AlertAlarm/4004Q69950/2023,4004Q69950,,America/New_York
458,,,,,3,Device,,,11/6/2023 6:48:36 PM -05:00,True,False,False,1.0,,,,,,SYS_ALM,SystemAlertAlarm,,,,AlertAlarm/4004Q69950/2023,4004Q69950,,America/New_York
459,,,,,3,Device,,,11/6/2023 6:53:36 PM -05:00,True,False,False,1.0,,,,,,SYS_ALM,SystemAlertAlarm,,,,AlertAlarm/4004Q69950/2023,4004Q69950,,America/New_York
460,,,,,3,Device,,,11/6/2023 6:58:36 PM -05:00,True,False,False,1.0,,,,,,SYS_ALM,SystemAlertAlarm,,,,AlertAlarm/4004Q69950/2023,4004Q69950,,America/New_York
461,,,,,3,Device,,,11/6/2023 7:03:36 PM -05:00,True,False,False,1.0,,,,,,SYS_ALM,SystemAlertAlarm,,,,AlertAlarm/4004Q69950/2023,4004Q69950,,America/New_York
462,,,,,3,Device,,,11/6/2023 7:08:36 PM -05:00,True,False,False,1.0,,,,,,SYS_ALM,SystemAlertAlarm,,,,AlertAlarm/4004Q69950/2023,4004Q69950,,America/New_York
463,,,,,3,Device,,,11/6/2023 7:13:36 PM -05:00,True,False,False,1.0,,,,,,SYS_ALM,SystemAlertAlarm,,,,AlertAlarm/4004Q69950/2023,4004Q69950,,America/New_York
464,,,,,3,Device,,,11/6/2023 7:18:36 PM -05:00,True,False,False,1.0,,,,,,SYS_ALM,SystemAlertAlarm,,,,AlertAlarm/4004Q69950/2023,4004Q69950,,America/New_York
465,,,,,3,Device,,,11/6/2023 7:23:36 PM -05:00,True,False,False,1.0,,,,,,SYS_ALM,SystemAlertAlarm,,,,AlertAlarm/4004Q69950/2023,4004Q69950,,America/New_York
466,,,,,3,Device,,,11/6/2023 7:28:36 PM -05:00,True,False,False,1.0,,,,,,SYS_ALM,SystemAlertAlarm,,,,AlertAlarm/4004Q69950/2023,4004Q69950,,America/New_York
467,,,,,3,Device,,,11/6/2023 7:33:36 PM -05:00,True,False,False,1.0,,,,,,SYS_ALM,SystemAlertAlarm,,,,AlertAlarm/4004Q69950/2023,4004Q69950,,America/New_York
468,,,,,3,Device,,,11/6/2023 7:38:36 PM -05:00,True,False,False,1.0,,,,,,SYS_ALM,SystemAlertAlarm,,,,AlertAlarm/4004Q69950/2023,4004Q69950,,America/New_York
469,,,,,3,Device,,,11/6/2023 7:43:36 PM -05:00,True,False,False,1.0,,,,,,SYS_ALM,SystemAlertAlarm,,,,AlertAlarm/4004Q69950/2023,4004Q69950,,America/New_York
470,,,,,3,Device,,,11/6/2023 7:48:36 PM -05:00,True,False,False,1.0,,,,,,SYS_ALM,SystemAlertAlarm,,,,AlertAlarm/4004Q69950/2023,4004Q69950,,America/New_York
471,,,,,3,Device,,,11/6/2023 7:53:36 PM -05:00,True,False,False,1.0,,,,,,SYS_ALM,SystemAlertAlarm,,,,AlertAlarm/4004Q69950/2023,4004Q69950,,America/New_York
472,,,,,3,Device,,,11/6/2023 7:58:36 PM -05:00,True,False,False,1.0,,,,,,SYS_ALM,SystemAlertAlarm,,,,AlertAlarm/4004Q69950/2023,4004Q69950,,America/New_York
473,,,,,3,Device,,,11/6/2023 8:03:36 PM -05:00,True,False,False,1.0,,,,,,SYS_ALM,SystemAlertAlarm,,,,AlertAlarm/4004Q69950/2023,4004Q69950,,America/New_York
474,,,,,3,Device,,,11/6/2023 8:08:36 PM -05:00,True,False,False,1.0,,,,,,SYS_ALM,SystemAlertAlarm,,,,AlertAlarm/4004Q69950/2023,4004Q69950,,America/New_York
475,,,,,3,Device,,,11/6/2023 8:13:36 PM -05:00,True,False,False,1.0,,,,,,SYS_ALM,SystemAlertAlarm,,,,AlertAlarm/4004Q69950/2023,4004Q69950,,America/New_York
476,,,,,3,Device,,,11/6/2023 8:18:36 PM -05:00,True,False,False,1.0,,,,,,SYS_ALM,SystemAlertAlarm,,,,AlertAlarm/4004Q69950/2023,4004Q69950,,America/New_York
477,,,,,3,Device,,,11/6/2023 8:28:36 PM -05:00,True,False,False,1.0,,,,,,SYS_ALM,SystemAlertAlarm,,,,AlertAlarm/4004Q69950/2023,4004Q69950,,America/New_York
478,,,,,3,Device,,,11/6/2023 8:23:36 PM -05:00,True,False,False,1.0,,,,,,SYS_ALM,SystemAlertAlarm,,,,AlertAlarm/4004Q69950/2023,4004Q69950,,America/New_York
479,,,,,3,Device,,,11/6/2023 8:33:36 PM -05:00,True,False,False,1.0,,,,,,SYS_ALM,SystemAlertAlarm,,,,AlertAlarm/4004Q69950/2023,4004Q69950,,America/New_York
480,,,,,3,Device,,,11/6/2023 8:38:36 PM -05:00,True,False,False,1.0,,,,,,SYS_ALM,SystemAlertAlarm,,,,AlertAlarm/4004Q69950/2023,4004Q69950,,America/New_York
481,,,,,3,Device,,,11/6/2023 8:43:36 PM -05:00,True,False,False,1.0,,,,,,SYS_ALM,SystemAlertAlarm,,,,AlertAlarm/4004Q69950/2023,4004Q69950,,America/New_York
482,,,,,3,Device,,,11/6/2023 8:48:36 PM -05:00,True,False,False,1.0,,,,,,SYS_ALM,SystemAlertAlarm,,,,AlertAlarm/4004Q69950/2023,4004Q69950,,America/New_York
483,,,,,3,Device,,,11/6/2023 8:53:36 PM -05:00,True,False,False,1.0,,,,,,SYS_ALM,SystemAlertAlarm,,,,AlertAlarm/4004Q69950/2023,4004Q69950,,America/New_York
484,,,,,3,Device,,,11/6/2023 8:58:36 PM -05:00,True,False,False,1.0,,,,,,SYS_ALM,SystemAlertAlarm,,,,AlertAlarm/4004Q69950/2023,4004Q69950,,America/New_York
485,,,,,3,Device,,,11/6/2023 9:03:36 PM -05:00,True,False,False,1.0,,,,,,SYS_ALM,SystemAlertAlarm,,,,AlertAlarm/4004Q69950/2023,4004Q69950,,America/New_York
486,,,,,3,Device,,,11/6/2023 9:08:37 PM -05:00,True,False,False,1.0,,,,,,SYS_ALM,SystemAlertAlarm,,,,AlertAlarm/4004Q69950/2023,4004Q69950,,America/New_York
487,,,,,3,Device,,,11/6/2023 9:13:37 PM -05:00,True,False,False,1.0,,,,,,SYS_ALM,SystemAlertAlarm,,,,AlertAlarm/4004Q69950/2023,4004Q69950,,America/New_York
488,,,,,3,Device,,,11/6/2023 9:18:37 PM -05:00,True,False,False,1.0,,,,,,SYS_ALM,SystemAlertAlarm,,,,AlertAlarm/4004Q69950/2023,4004Q69950,,America/New_York
489,,,,,3,Device,,,11/6/2023 9:23:37 PM -05:00,True,False,False,1.0,,,,,,SYS_ALM,SystemAlertAlarm,,,,AlertAlarm/4004Q69950/2023,4004Q69950,,America/New_York
490,,,,,3,Device,,,11/6/2023 9:28:37 PM -05:00,True,False,False,1.0,,,,,,SYS_ALM,SystemAlertAlarm,,,,AlertAlarm/4004Q69950/2023,4004Q69950,,America/New_York
491,,,,,3,Device,,,11/6/2023 9:33:37 PM -05:00,True,False,False,1.0,,,,,,SYS_ALM,SystemAlertAlarm,,,,AlertAlarm/4004Q69950/2023,4004Q69950,,America/New_York
492,,,,,3,Device,,,11/6/2023 9:38:37 PM -05:00,True,False,False,1.0,,,,,,SYS_ALM,SystemAlertAlarm,,,,AlertAlarm/4004Q69950/2023,4004Q69950,,America/New_York
493,,,,,3,Device,,,11/6/2023 9:43:37 PM -05:00,True,False,False,1.0,,,,,,SYS_ALM,SystemAlertAlarm,,,,AlertAlarm/4004Q69950/2023,4004Q69950,,America/New_York
494,,,,,3,Device,,,11/6/2023 9:48:37 PM -05:00,True,False,False,1.0,,,,,,SYS_ALM,SystemAlertAlarm,,,,AlertAlarm/4004Q69950/2023,4004Q69950,,America/New_York
495,,,,,3,Device,,,11/6/2023 9:53:37 PM -05:00,True,False,False,1.0,,,,,,SYS_ALM,SystemAlertAlarm,,,,AlertAlarm/4004Q69950/2023,4004Q69950,,America/New_York
496,,,,,3,Device,,,11/6/2023 9:58:37 PM -05:00,True,False,False,1.0,,,,,,SYS_ALM,SystemAlertAlarm,,,,AlertAlarm/4004Q69950/2023,4004Q69950,,America/New_York
497,,,,,3,Device,,,11/6/2023 10:03:37 PM -05:00,True,False,False,1.0,,,,,,SYS_ALM,SystemAlertAlarm,,,,AlertAlarm/4004Q69950/2023,4004Q69950,,America/New_York
498,,,,,3,Device,,,11/6/2023 10:08:37 PM -05:00,True,False,False,1.0,,,,,,SYS_ALM,SystemAlertAlarm,,,,AlertAlarm/4004Q69950/2023,4004Q69950,,America/New_York
499,,,,,3,Device,,,11/6/2023 10:23:37 PM -05:00,True,False,False,1.0,,,,,,SYS_ALM,SystemAlertAlarm,,,,AlertAlarm/4004Q69950/2023,4004Q69950,,America/New_York
500,,,,,3,Device,,,11/6/2023 10:18:37 PM -05:00,True,False,False,1.0,,,,,,SYS_ALM,SystemAlertAlarm,,,,AlertAlarm/4004Q69950/2023,4004Q69950,,America/New_York
501,,,,,3,Device,,,11/6/2023 10:13:37 PM -05:00,True,False,False,1.0,,,,,,SYS_ALM,SystemAlertAlarm,,,,AlertAlarm/4004Q69950/2023,4004Q69950,,America/New_York
502,,,,,3,Device,,,11/6/2023 10:28:37 PM -05:00,True,False,False,1.0,,,,,,SYS_ALM,SystemAlertAlarm,,,,AlertAlarm/4004Q69950/2023,4004Q69950,,America/New_York
503,,,,,3,Device,,,11/6/2023 10:38:37 PM -05:00,True,False,False,1.0,,,,,,SYS_ALM,SystemAlertAlarm,,,,AlertAlarm/4004Q69950/2023,4004Q69950,,America/New_York
504,,,,,3,Device,,,11/6/2023 10:43:37 PM -05:00,True,False,False,1.0,,,,,,SYS_ALM,SystemAlertAlarm,,,,AlertAlarm/4004Q69950/2023,4004Q69950,,America/New_York
505,,,,,3,Device,,,11/6/2023 10:33:37 PM -05:00,True,False,False,1.0,,,,,,SYS_ALM,SystemAlertAlarm,,,,AlertAlarm/4004Q69950/2023,4004Q69950,,America/New_York
506,,,,,3,Device,,,11/6/2023 10:48:37 PM -05:00,True,False,False,1.0,,,,,,SYS_ALM,SystemAlertAlarm,,,,AlertAlarm/4004Q69950/2023,4004Q69950,,America/New_York
507,,,,,3,Device,,,11/6/2023 10:58:37 PM -05:00,True,False,False,1.0,,,,,,SYS_ALM,SystemAlertAlarm,,,,AlertAlarm/4004Q69950/2023,4004Q69950,,America/New_York
508,,,,,3,Device,,,11/6/2023 10:53:37 PM -05:00,True,False,False,1.0,,,,,,SYS_ALM,SystemAlertAlarm,,,,AlertAlarm/4004Q69950/2023,4004Q69950,,America/New_York
