,AlertAlarmDateTime,SnapshotUrl,TimeZoneAbreviation,UtcOffsetMinutes,adjustedvalue,alertalarmtype,algorithm,description,eventdatetime,isalarm,isalert,isreset,lastvalue,maxalarmthresholdvalue,maxwarningthresholdvalue,metricName,metricNameChinese,metricid,metrickey,metricshortname,metrictype,minalarmthresholdvalue,minwarningthresholdvalue,path,serialnumber,targetvalue,timezone
0,2023-01-01T02:00:00,,,0.0,2,Device,,System Alert Alarm,Jan  1 2023  2:00AM,False,False,True,,,,,,,SYS_ALM,SystemAlertAlarm,,,,AlertAlarm/5111Q21335/2023,5111Q21335,,America/New_York
1,2023-01-01T02:35:00,,,0.0,2,Device,,System Alert Alarm,Jan  1 2023  2:35AM,False,False,True,,,,,,,SYS_ALM,SystemAlertAlarm,,,,AlertAlarm/5111Q21335/2023,5111Q21335,,America/New_York
2,2023-01-01T03:35:00,,,0.0,2,Device,,System Alert Alarm,Jan  1 2023  3:35AM,False,False,True,,,,,,,SYS_ALM,SystemAlertAlarm,,,,AlertAlarm/5111Q21335/2023,5111Q21335,,America/New_York
3,2023-02-10T07:17:00,,,0.0,2,Device,,System Alert Alarm,Feb 10 2023  7:17AM,False,False,True,,,,,,,SYS_ALM,SystemAlertAlarm,,,,AlertAlarm/5111Q21335/2023,5111Q21335,,America/New_York
4,2023-02-15T18:04:00,,,0.0,3,Device,,System Alert Alarm,Feb 15 2023  6:04PM,False,False,True,,,,,,,SYS_ALM,SystemAlertAlarm,,,,AlertAlarm/5111Q21335/2023,5111Q21335,,America/New_York
5,,,,,1,Device,,,5/30/2023 2:28:42 PM -04:00,True,False,False,0.0,,,,,,ALM,CH_ALARMRELAY,,,,AlertAlarm/5111Q21335/2023,5111Q21335,,America/New_York
6,2023-05-31T02:38:00,,,0.0,1,Device,,Alarm Relay,May 31 2023  2:38AM,False,False,True,,,,,,,ALM,CH_ALARMRELAY,,,,AlertAlarm/5111Q21335/2023,5111Q21335,,America/New_York
7,,,,,1,Device,,,5/31/2023 3:38:46 AM -04:00,True,False,False,0.0,,,,,,ALM,CH_ALARMRELAY,,,,AlertAlarm/5111Q21335/2023,5111Q21335,,America/New_York
8,2023-05-31T14:49:00,,,0.0,1,Device,,Alarm Relay,May 31 2023  2:49PM,False,False,True,,,,,,,ALM,CH_ALARMRELAY,,,,AlertAlarm/5111Q21335/2023,5111Q21335,,America/New_York
9,,,,,1,Device,,,5/31/2023 4:04:38 PM -04:00,True,False,False,0.0,,,,,,ALM,CH_ALARMRELAY,,,,AlertAlarm/5111Q21335/2023,5111Q21335,,America/New_York
10,2023-06-01T06:54:00,,,0.0,1,Device,,Alarm Relay,Jun  1 2023  6:54AM,False,False,True,,,,,,,ALM,CH_ALARMRELAY,,,,AlertAlarm/5111Q21335/2023,5111Q21335,,America/New_York
11,,,,,1,Device,,,6/1/2023 11:49:45 AM -04:00,True,False,False,0.0,,,,,,ALM,CH_ALARMRELAY,,,,AlertAlarm/5111Q21335/2023,5111Q21335,,America/New_York
12,2023-06-01T16:29:00,,,0.0,1,Device,,Alarm Relay,Jun  1 2023  4:29PM,False,False,True,,,,,,,ALM,CH_ALARMRELAY,,,,AlertAlarm/5111Q21335/2023,5111Q21335,,America/New_York
13,,,,,1,Device,,,6/1/2023 12:49:45 PM -04:00,True,False,False,0.0,,,,,,ALM,CH_ALARMRELAY,,,,AlertAlarm/5111Q21335/2023,5111Q21335,,America/New_York
14,2023-06-01T19:39:00,,,0.0,1,Device,,Alarm Relay,Jun  1 2023  7:39PM,False,False,True,,,,,,,ALM,CH_ALARMRELAY,,,,AlertAlarm/5111Q21335/2023,5111Q21335,,America/New_York
15,,,,,1,Device,,,6/1/2023 3:49:46 PM -04:00,True,False,False,0.0,,,,,,ALM,CH_ALARMRELAY,,,,AlertAlarm/5111Q21335/2023,5111Q21335,,America/New_York
16,2023-06-02T14:04:00,,,0.0,1,Device,,Alarm Relay,Jun  2 2023  2:04PM,False,False,True,,,,,,,ALM,CH_ALARMRELAY,,,,AlertAlarm/5111Q21335/2023,5111Q21335,,America/New_York
17,,,,,1,Device,,,6/2/2023 12:59:53 PM -04:00,True,False,False,0.0,,,,,,ALM,CH_ALARMRELAY,,,,AlertAlarm/5111Q21335/2023,5111Q21335,,America/New_York
18,2023-06-03T11:02:00,,,0.0,1,Device,,Alarm Relay,Jun  3 2023 11:02AM,False,False,True,,,,,,,ALM,CH_ALARMRELAY,,,,AlertAlarm/5111Q21335/2023,5111Q21335,,America/New_York
19,,,,,1,Device,,,6/4/2023 2:13:19 AM -04:00,True,False,False,0.0,,,,,,ALM,CH_ALARMRELAY,,,,AlertAlarm/5111Q21335/2023,5111Q21335,,America/New_York
20,2023-06-05T20:59:00,,,0.0,1,Device,,Alarm Relay,Jun  5 2023  8:59PM,False,False,True,,,,,,,ALM,CH_ALARMRELAY,,,,AlertAlarm/5111Q21335/2023,5111Q21335,,America/New_York
21,2023-06-23T18:12:00,https://alarmssaveandnotifyprod.blob.core.windows.net/snapshot/vu210550101310_74/2023/6/23/18/12/VU210550101310_74_1687543961,,0.0,123,Device,,RUN CAPACITY LIMITED-HIGH COMPRESSOR LIFT,Jun 23 2023  6:12PM,False,True,False,,,,,,,ALARM_01,CH_ALARM_01,,,,AlertAlarm/5111Q21335/2023,5111Q21335,,America/New_York
22,,,,,2,Device,,,6/23/2023 2:16:55 PM -04:00,False,True,False,1.0,,,,,,SYS_ALM,SystemAlertAlarm,,,,AlertAlarm/5111Q21335/2023,5111Q21335,,America/New_York
23,2023-06-24T06:41:00,,,0.0,2,Device,,System Alert /Alarm,Jun 24 2023  6:41AM,False,False,True,,,,,,,SYS_ALM,SystemAlertAlarm,,,,AlertAlarm/5111Q21335/2023,5111Q21335,,America/New_York
24,2023-06-24T06:41:00,,,0.0,123,Device,,RUN CAPACITY LIMITED-HIGH COMPRESSOR LIFT,Jun 24 2023  6:41AM,False,True,True,,,,,,,ALARM_01,CH_ALARM_01,,,,AlertAlarm/5111Q21335/2023,5111Q21335,,America/New_York
25,2023-06-24T18:23:00,https://alarmssaveandnotifyprod.blob.core.windows.net/snapshot/vu210550101310_74/2023/6/24/21/47/VU210550101310_74_1687631034,,0.0,123,Device,,RUN CAPACITY LIMITED-HIGH COMPRESSOR LIFT,Jun 24 2023  6:23PM,False,True,False,,,,,,,ALARM_01,CH_ALARM_01,,,,AlertAlarm/5111Q21335/2023,5111Q21335,,America/New_York
26,,,,,2,Device,,,6/24/2023 2:24:30 PM -04:00,False,True,False,1.0,,,,,,SYS_ALM,SystemAlertAlarm,,,,AlertAlarm/5111Q21335/2023,5111Q21335,,America/New_York
27,2023-06-24T21:53:00,,,0.0,2,Device,,System Alert /Alarm,Jun 24 2023  9:53PM,False,False,True,,,,,,,SYS_ALM,SystemAlertAlarm,,,,AlertAlarm/5111Q21335/2023,5111Q21335,,America/New_York
28,2023-06-25T06:20:00,,,0.0,123,Device,,RUN CAPACITY LIMITED-HIGH COMPRESSOR LIFT,Jun 25 2023  6:20AM,False,True,True,,,,,,,ALARM_01,CH_ALARM_01,,,,AlertAlarm/5111Q21335/2023,5111Q21335,,America/New_York
29,,,,,2,Device,,,6/25/2023 9:55:03 AM -04:00,False,True,False,1.0,,,,,,SYS_ALM,SystemAlertAlarm,,,,AlertAlarm/5111Q21335/2023,5111Q21335,,America/New_York
30,2023-06-25T15:54:00,,,0.0,2,Device,,System Alert /Alarm,Jun 25 2023  3:54PM,False,False,True,,,,,,,SYS_ALM,SystemAlertAlarm,,,,AlertAlarm/5111Q21335/2023,5111Q21335,,America/New_York
31,2023-06-25T15:54:00,https://alarmssaveandnotifyprod.blob.core.windows.net/snapshot/vu210550101310_74/2023/6/25/15/54/VU210550101310_74_1687708465,,0.0,123,Device,,RUN CAPACITY LIMITED-HIGH COMPRESSOR LIFT,Jun 25 2023  3:54PM,False,True,False,,,,,,,ALARM_01,CH_ALARM_01,,,,AlertAlarm/5111Q21335/2023,5111Q21335,,America/New_York
32,2023-06-26T08:33:00,,,0.0,123,Device,,RUN CAPACITY LIMITED-HIGH COMPRESSOR LIFT,Jun 26 2023  8:33AM,False,True,True,,,,,,,ALARM_01,CH_ALARM_01,,,,AlertAlarm/5111Q21335/2023,5111Q21335,,America/New_York
33,,,,,2,Device,,,6/26/2023 7:53:34 AM -04:00,False,True,False,1.0,,,,,,SYS_ALM,SystemAlertAlarm,,,,AlertAlarm/5111Q21335/2023,5111Q21335,,America/New_York
34,2023-06-26T23:53:00,,,0.0,2,Device,,System Alert /Alarm,Jun 26 2023 11:53PM,False,False,True,,,,,,,SYS_ALM,SystemAlertAlarm,,,,AlertAlarm/5111Q21335/2023,5111Q21335,,America/New_York
35,,,,,2,Device,,,6/27/2023 5:03:40 PM -04:00,False,True,False,1.0,,,,,,SYS_ALM,SystemAlertAlarm,,,,AlertAlarm/5111Q21335/2023,5111Q21335,,America/New_York
36,2023-06-27T23:28:00,,,0.0,2,Device,,System Alert /Alarm,Jun 27 2023 11:28PM,False,False,True,,,,,,,SYS_ALM,SystemAlertAlarm,,,,AlertAlarm/5111Q21335/2023,5111Q21335,,America/New_York
37,2023-07-01T15:14:00,https://alarmssaveandnotifyprod.blob.core.windows.net/snapshot/vu210550101310_74/2023/7/1/19/45/VU210550101310_74_1688224497,,0.0,123,Device,,RUN CAPACITY LIMITED-HIGH COMPRESSOR LIFT,Jul  1 2023  3:14PM,False,True,False,,,,,,,ALARM_01,CH_ALARM_01,,,,AlertAlarm/5111Q21335/2023,5111Q21335,,America/New_York
38,,,,,2,Device,,,7/1/2023 11:17:37 AM -04:00,False,True,False,1.0,,,,,,SYS_ALM,SystemAlertAlarm,,,,AlertAlarm/5111Q21335/2023,5111Q21335,,America/New_York
39,2023-07-01T17:52:00,,,0.0,2,Device,,System Alert /Alarm,Jul  1 2023  5:52PM,False,False,True,,,,,,,SYS_ALM,SystemAlertAlarm,,,,AlertAlarm/5111Q21335/2023,5111Q21335,,America/New_York
40,2023-07-01T17:52:00,,,0.0,123,Device,,RUN CAPACITY LIMITED-HIGH COMPRESSOR LIFT,Jul  1 2023  5:52PM,False,True,True,,,,,,,ALARM_01,CH_ALARM_01,,,,AlertAlarm/5111Q21335/2023,5111Q21335,,America/New_York
41,,,,,2,Device,,,7/1/2023 2:27:38 PM -04:00,False,True,False,1.0,,,,,,SYS_ALM,SystemAlertAlarm,,,,AlertAlarm/5111Q21335/2023,5111Q21335,,America/New_York
42,2023-07-01T19:37:00,,,0.0,2,Device,,System Alert /Alarm,Jul  1 2023  7:37PM,False,False,True,,,,,,,SYS_ALM,SystemAlertAlarm,,,,AlertAlarm/5111Q21335/2023,5111Q21335,,America/New_York
43,2023-07-02T22:05:00,https://alarmssaveandnotifyprod.blob.core.windows.net/snapshot/vu210550101310_74/2023/7/2/22/6/VU210550101310_74_1688335555,,0.0,123,Device,,RUN CAPACITY LIMITED-HIGH COMPRESSOR LIFT,Jul  2 2023 10:05PM,False,True,False,,,,,,,ALARM_01,CH_ALARM_01,,,,AlertAlarm/5111Q21335/2023,5111Q21335,,America/New_York
44,,,,,2,Device,,,7/3/2023 9:50:22 AM -04:00,False,True,False,1.0,,,,,,SYS_ALM,SystemAlertAlarm,,,,AlertAlarm/5111Q21335/2023,5111Q21335,,America/New_York
45,2023-07-03T16:45:00,,,0.0,2,Device,,System Alert /Alarm,Jul  3 2023  4:45PM,False,False,True,,,,,,,SYS_ALM,SystemAlertAlarm,,,,AlertAlarm/5111Q21335/2023,5111Q21335,,America/New_York
46,2023-07-03T16:45:00,,,0.0,123,Device,,RUN CAPACITY LIMITED-HIGH COMPRESSOR LIFT,Jul  3 2023  4:45PM,False,True,True,,,,,,,ALARM_01,CH_ALARM_01,,,,AlertAlarm/5111Q21335/2023,5111Q21335,,America/New_York
47,,,,,2,Device,,,7/3/2023 1:00:23 PM -04:00,False,True,False,1.0,,,,,,SYS_ALM,SystemAlertAlarm,,,,AlertAlarm/5111Q21335/2023,5111Q21335,,America/New_York
48,2023-07-04T04:20:00,,,0.0,2,Device,,System Alert /Alarm,Jul  4 2023  4:20AM,False,False,True,,,,,,,SYS_ALM,SystemAlertAlarm,,,,AlertAlarm/5111Q21335/2023,5111Q21335,,America/New_York
49,,,,,2,Device,,,7/4/2023 12:25:25 AM -04:00,False,True,False,1.0,,,,,,SYS_ALM,SystemAlertAlarm,,,,AlertAlarm/5111Q21335/2023,5111Q21335,,America/New_York
50,2023-07-04T14:37:00,,,0.0,2,Device,,System Alert /Alarm,Jul  4 2023  2:37PM,False,False,True,,,,,,,SYS_ALM,SystemAlertAlarm,,,,AlertAlarm/5111Q21335/2023,5111Q21335,,America/New_York
51,2023-07-04T14:37:00,https://alarmssaveandnotifyprod.blob.core.windows.net/snapshot/vu210550101310_74/2023/7/5/3/12/VU210550101310_74_1688481424,,0.0,123,Device,,RUN CAPACITY LIMITED-HIGH COMPRESSOR LIFT,Jul  4 2023  2:37PM,False,True,False,,,,,,,ALARM_01,CH_ALARM_01,,,,AlertAlarm/5111Q21335/2023,5111Q21335,,America/New_York
52,,,,,2,Device,,,7/4/2023 10:08:11 AM -04:00,False,True,False,1.0,,,,,,SYS_ALM,SystemAlertAlarm,,,,AlertAlarm/5111Q21335/2023,5111Q21335,,America/New_York
53,2023-07-04T17:43:00,,,0.0,123,Device,,RUN CAPACITY LIMITED-HIGH COMPRESSOR LIFT,Jul  4 2023  5:43PM,False,True,True,,,,,,,ALARM_01,CH_ALARM_01,,,,AlertAlarm/5111Q21335/2023,5111Q21335,,America/New_York
54,,,,,2,Device,,,7/4/2023 2:13:12 PM -04:00,False,True,False,1.0,,,,,,SYS_ALM,SystemAlertAlarm,,,,AlertAlarm/5111Q21335/2023,5111Q21335,,America/New_York
55,,,,,2,Device,,,7/4/2023 2:38:12 PM -04:00,False,True,False,1.0,,,,,,SYS_ALM,SystemAlertAlarm,,,,AlertAlarm/5111Q21335/2023,5111Q21335,,America/New_York
56,2023-07-04T23:54:00,,,0.0,2,Device,,System Alert /Alarm,Jul  4 2023 11:54PM,False,False,True,,,,,,,SYS_ALM,SystemAlertAlarm,,,,AlertAlarm/5111Q21335/2023,5111Q21335,,America/New_York
57,2023-07-05T23:35:00,https://alarmssaveandnotifyprod.blob.core.windows.net/snapshot/vu210550101310_74/2023/7/5/23/35/VU210550101310_74_1688600151,,0.0,123,Device,,RUN CAPACITY LIMITED-HIGH COMPRESSOR LIFT,Jul  5 2023 11:35PM,False,True,False,,,,,,,ALARM_01,CH_ALARM_01,,,,AlertAlarm/5111Q21335/2023,5111Q21335,,America/New_York
58,2023-07-05T23:35:00,https://alarmssaveandnotifyprod.blob.core.windows.net/snapshot/vu210550101310_74/2023/7/5/23/35/VU210550101310_74_1688600151,,0.0,123,Device,,RUN CAPACITY LIMITED-HIGH COMPRESSOR LIFT,Jul  5 2023 11:35PM,False,True,False,,,,,,,ALARM_01,CH_ALARM_01,,,,AlertAlarm/5111Q21335/2023,5111Q21335,,America/New_York
59,,,,,2,Device,,,7/5/2023 7:40:03 PM -04:00,False,True,False,1.0,,,,,,SYS_ALM,SystemAlertAlarm,,,,AlertAlarm/5111Q21335/2023,5111Q21335,,America/New_York
60,2023-07-05T23:50:00,,,0.0,2,Device,,System Alert /Alarm,Jul  5 2023 11:50PM,False,False,True,,,,,,,SYS_ALM,SystemAlertAlarm,,,,AlertAlarm/5111Q21335/2023,5111Q21335,,America/New_York
61,2023-07-05T23:50:00,,,0.0,123,Device,,RUN CAPACITY LIMITED-HIGH COMPRESSOR LIFT,Jul  5 2023 11:50PM,False,True,True,,,,,,,ALARM_01,CH_ALARM_01,,,,AlertAlarm/5111Q21335/2023,5111Q21335,,America/New_York
62,2023-07-06T15:01:00,https://alarmssaveandnotifyprod.blob.core.windows.net/snapshot/vu210550101310_74/2023/7/6/17/46/VU210550101310_74_1688655684,,0.0,123,Device,,RUN CAPACITY LIMITED-HIGH COMPRESSOR LIFT,Jul  6 2023  3:01PM,False,True,False,,,,,,,ALARM_01,CH_ALARM_01,,,,AlertAlarm/5111Q21335/2023,5111Q21335,,America/New_York
63,,,,,2,Device,,,7/6/2023 10:58:32 AM -04:00,False,True,False,1.0,,,,,,SYS_ALM,SystemAlertAlarm,,,,AlertAlarm/5111Q21335/2023,5111Q21335,,America/New_York
64,2023-07-06T16:03:00,,,0.0,2,Device,,System Alert /Alarm,Jul  6 2023  4:03PM,False,False,True,,,,,,,SYS_ALM,SystemAlertAlarm,,,,AlertAlarm/5111Q21335/2023,5111Q21335,,America/New_York
65,2023-07-06T16:03:00,,,0.0,123,Device,,RUN CAPACITY LIMITED-HIGH COMPRESSOR LIFT,Jul  6 2023  4:03PM,False,True,True,,,,,,,ALARM_01,CH_ALARM_01,,,,AlertAlarm/5111Q21335/2023,5111Q21335,,America/New_York
66,,,,,2,Device,,,7/6/2023 12:18:32 PM -04:00,False,True,False,1.0,,,,,,SYS_ALM,SystemAlertAlarm,,,,AlertAlarm/5111Q21335/2023,5111Q21335,,America/New_York
67,2023-07-06T18:46:00,,,0.0,2,Device,,System Alert /Alarm,Jul  6 2023  6:46PM,False,False,True,,,,,,,SYS_ALM,SystemAlertAlarm,,,,AlertAlarm/5111Q21335/2023,5111Q21335,,America/New_York
68,2023-07-06T18:46:00,https://alarmssaveandnotifyprod.blob.core.windows.net/snapshot/vu210550101310_74/2023/7/6/18/46/VU210550101310_74_1688669198,,0.0,123,Device,,RUN CAPACITY LIMITED-HIGH COMPRESSOR LIFT,Jul  6 2023  6:46PM,False,True,False,,,,,,,ALARM_01,CH_ALARM_01,,,,AlertAlarm/5111Q21335/2023,5111Q21335,,America/New_York
69,,,,,2,Device,,,7/6/2023 2:49:47 PM -04:00,False,True,False,1.0,,,,,,SYS_ALM,SystemAlertAlarm,,,,AlertAlarm/5111Q21335/2023,5111Q21335,,America/New_York
70,2023-07-06T20:14:00,,,0.0,2,Device,,System Alert /Alarm,Jul  6 2023  8:14PM,False,False,True,,,,,,,SYS_ALM,SystemAlertAlarm,,,,AlertAlarm/5111Q21335/2023,5111Q21335,,America/New_York
71,2023-07-06T20:14:00,,,0.0,123,Device,,RUN CAPACITY LIMITED-HIGH COMPRESSOR LIFT,Jul  6 2023  8:14PM,False,True,True,,,,,,,ALARM_01,CH_ALARM_01,,,,AlertAlarm/5111Q21335/2023,5111Q21335,,America/New_York
72,,,,,2,Device,,,7/6/2023 5:14:47 PM -04:00,False,True,False,1.0,,,,,,SYS_ALM,SystemAlertAlarm,,,,AlertAlarm/5111Q21335/2023,5111Q21335,,America/New_York
73,2023-07-07T00:09:00,,,0.0,2,Device,,System Alert /Alarm,Jul  7 2023 12:09AM,False,False,True,,,,,,,SYS_ALM,SystemAlertAlarm,,,,AlertAlarm/5111Q21335/2023,5111Q21335,,America/New_York
74,2023-07-07T16:58:00,https://alarmssaveandnotifyprod.blob.core.windows.net/snapshot/vu210550101310_74/2023/7/7/16/59/VU210550101310_74_1688749139,,0.0,123,Device,,RUN CAPACITY LIMITED-HIGH COMPRESSOR LIFT,Jul  7 2023  4:58PM,False,True,False,,,,,,,ALARM_01,CH_ALARM_01,,,,AlertAlarm/5111Q21335/2023,5111Q21335,,America/New_York
75,,,,,2,Device,,,7/7/2023 1:00:32 PM -04:00,False,True,False,1.0,,,,,,SYS_ALM,SystemAlertAlarm,,,,AlertAlarm/5111Q21335/2023,5111Q21335,,America/New_York
76,2023-07-07T17:25:00,,,0.0,2,Device,,System Alert /Alarm,Jul  7 2023  5:25PM,False,False,True,,,,,,,SYS_ALM,SystemAlertAlarm,,,,AlertAlarm/5111Q21335/2023,5111Q21335,,America/New_York
77,2023-07-07T17:25:00,,,0.0,123,Device,,RUN CAPACITY LIMITED-HIGH COMPRESSOR LIFT,Jul  7 2023  5:25PM,False,True,True,,,,,,,ALARM_01,CH_ALARM_01,,,,AlertAlarm/5111Q21335/2023,5111Q21335,,America/New_York
78,,,,,2,Device,,,7/9/2023 3:05:42 PM -04:00,False,True,False,1.0,,,,,,SYS_ALM,SystemAlertAlarm,,,,AlertAlarm/5111Q21335/2023,5111Q21335,,America/New_York
79,2023-07-09T19:15:00,,,0.0,2,Device,,System Alert /Alarm,Jul  9 2023  7:15PM,False,False,True,,,,,,,SYS_ALM,SystemAlertAlarm,,,,AlertAlarm/5111Q21335/2023,5111Q21335,,America/New_York
80,,,,,2,Device,,,7/15/2023 2:36:11 PM -04:00,False,True,False,1.0,,,,,,SYS_ALM,SystemAlertAlarm,,,,AlertAlarm/5111Q21335/2023,5111Q21335,,America/New_York
81,,,,,2,Device,,,7/15/2023 3:06:11 PM -04:00,False,True,False,1.0,,,,,,SYS_ALM,SystemAlertAlarm,,,,AlertAlarm/5111Q21335/2023,5111Q21335,,America/New_York
82,2023-07-15T19:26:00,,,0.0,2,Device,,System Alert /Alarm,Jul 15 2023  7:26PM,False,False,True,,,,,,,SYS_ALM,SystemAlertAlarm,,,,AlertAlarm/5111Q21335/2023,5111Q21335,,America/New_York
83,,,,,2,Device,,,7/15/2023 3:51:11 PM -04:00,False,True,False,1.0,,,,,,SYS_ALM,SystemAlertAlarm,,,,AlertAlarm/5111Q21335/2023,5111Q21335,,America/New_York
84,2023-07-16T01:11:00,,,0.0,2,Device,,System Alert /Alarm,Jul 16 2023  1:11AM,False,False,True,,,,,,,SYS_ALM,SystemAlertAlarm,,,,AlertAlarm/5111Q21335/2023,5111Q21335,,America/New_York
85,,,,,2,Device,,,7/15/2023 9:41:12 PM -04:00,False,True,False,1.0,,,,,,SYS_ALM,SystemAlertAlarm,,,,AlertAlarm/5111Q21335/2023,5111Q21335,,America/New_York
86,2023-07-16T04:07:00,,,0.0,2,Device,,System Alert /Alarm,Jul 16 2023  4:07AM,False,False,True,,,,,,,SYS_ALM,SystemAlertAlarm,,,,AlertAlarm/5111Q21335/2023,5111Q21335,,America/New_York
87,2023-07-16T04:07:00,https://alarmssaveandnotifyprod.blob.core.windows.net/snapshot/vu210550101310_74/2023/7/16/4/7/VU210550101310_74_1689480427,,0.0,123,Device,,RUN CAPACITY LIMITED-HIGH COMPRESSOR LIFT,Jul 16 2023  4:07AM,False,True,False,,,,,,,ALARM_01,CH_ALARM_01,,,,AlertAlarm/5111Q21335/2023,5111Q21335,,America/New_York
88,2023-07-16T09:56:00,,,0.0,123,Device,,RUN CAPACITY LIMITED-HIGH COMPRESSOR LIFT,Jul 16 2023  9:56AM,False,True,True,,,,,,,ALARM_01,CH_ALARM_01,,,,AlertAlarm/5111Q21335/2023,5111Q21335,,America/New_York
89,2023-07-16T17:50:00,https://alarmssaveandnotifyprod.blob.core.windows.net/snapshot/vu210550101310_74/2023/7/17/1/9/VU210550101310_74_1689529839,,0.0,123,Device,,RUN CAPACITY LIMITED-HIGH COMPRESSOR LIFT,Jul 16 2023  5:50PM,False,True,False,,,,,,,ALARM_01,CH_ALARM_01,,,,AlertAlarm/5111Q21335/2023,5111Q21335,,America/New_York
90,,,,,2,Device,,,7/16/2023 1:45:31 PM -04:00,False,True,False,1.0,,,,,,SYS_ALM,SystemAlertAlarm,,,,AlertAlarm/5111Q21335/2023,5111Q21335,,America/New_York
91,2023-07-16T17:50:00,,,0.0,2,Device,,System Alert /Alarm,Jul 16 2023  5:50PM,False,False,True,,,,,,,SYS_ALM,SystemAlertAlarm,,,,AlertAlarm/5111Q21335/2023,5111Q21335,,America/New_York
92,,,,,2,Device,,,7/16/2023 2:15:31 PM -04:00,False,True,False,1.0,,,,,,SYS_ALM,SystemAlertAlarm,,,,AlertAlarm/5111Q21335/2023,5111Q21335,,America/New_York
93,2023-07-16T18:35:00,,,0.0,2,Device,,System Alert /Alarm,Jul 16 2023  6:35PM,False,False,True,,,,,,,SYS_ALM,SystemAlertAlarm,,,,AlertAlarm/5111Q21335/2023,5111Q21335,,America/New_York
94,2023-07-16T18:35:00,,,0.0,123,Device,,RUN CAPACITY LIMITED-HIGH COMPRESSOR LIFT,Jul 16 2023  6:35PM,False,True,True,,,,,,,ALARM_01,CH_ALARM_01,,,,AlertAlarm/5111Q21335/2023,5111Q21335,,America/New_York
95,,,,,2,Device,,,7/16/2023 2:45:31 PM -04:00,False,True,False,1.0,,,,,,SYS_ALM,SystemAlertAlarm,,,,AlertAlarm/5111Q21335/2023,5111Q21335,,America/New_York
96,2023-07-16T19:00:00,,,0.0,2,Device,,System Alert /Alarm,Jul 16 2023  7:00PM,False,False,True,,,,,,,SYS_ALM,SystemAlertAlarm,,,,AlertAlarm/5111Q21335/2023,5111Q21335,,America/New_York
97,,,,,2,Device,,,7/16/2023 3:05:31 PM -04:00,False,True,False,1.0,,,,,,SYS_ALM,SystemAlertAlarm,,,,AlertAlarm/5111Q21335/2023,5111Q21335,,America/New_York
98,2023-07-16T21:35:00,,,0.0,2,Device,,System Alert /Alarm,Jul 16 2023  9:35PM,False,False,True,,,,,,,SYS_ALM,SystemAlertAlarm,,,,AlertAlarm/5111Q21335/2023,5111Q21335,,America/New_York
99,2023-07-24T17:40:00,https://alarmssaveandnotifyprod.blob.core.windows.net/snapshot/vu210550101310_74/2023/7/24/20/55/VU210550101310_74_1690220418,,0.0,122,Device,,RUN CAPACITY LIMITED-LOW EVAP REFRIG TEMP,Jul 24 2023  5:40PM,False,True,False,,,,,,,ALARM_01,CH_ALARM_01,,,,AlertAlarm/5111Q21335/2023,5111Q21335,,America/New_York
100,,,,,2,Device,,,7/27/2023 11:41:26 AM -04:00,False,True,False,1.0,,,,,,SYS_ALM,SystemAlertAlarm,,,,AlertAlarm/5111Q21335/2023,5111Q21335,,America/New_York
101,2023-07-27T15:42:00,,,0.0,2,Device,,System Alert /Alarm,Jul 27 2023  3:42PM,False,False,True,,,,,,,SYS_ALM,SystemAlertAlarm,,,,AlertAlarm/5111Q21335/2023,5111Q21335,,America/New_York
102,2023-07-27T15:42:00,,,0.0,122,Device,,RUN CAPACITY LIMITED-LOW EVAP REFRIG TEMP,Jul 27 2023  3:42PM,False,True,True,,,,,,,ALARM_01,CH_ALARM_01,,,,AlertAlarm/5111Q21335/2023,5111Q21335,,America/New_York
103,2023-07-27T15:42:00,https://alarmssaveandnotifyprod.blob.core.windows.net/snapshot/vu210550101310_74/2023/7/27/15/42/VU210550101310_74_1690472548,,0.0,123,Device,,RUN CAPACITY LIMITED-HIGH COMPRESSOR LIFT,Jul 27 2023  3:42PM,False,True,False,,,,,,,ALARM_01,CH_ALARM_01,,,,AlertAlarm/5111Q21335/2023,5111Q21335,,America/New_York
104,2023-07-27T17:36:00,,,0.0,123,Device,,RUN CAPACITY LIMITED-HIGH COMPRESSOR LIFT,Jul 27 2023  5:36PM,False,True,True,,,,,,,ALARM_01,CH_ALARM_01,,,,AlertAlarm/5111Q21335/2023,5111Q21335,,America/New_York
105,,,,,2,Device,,,7/27/2023 2:11:26 PM -04:00,False,True,False,1.0,,,,,,SYS_ALM,SystemAlertAlarm,,,,AlertAlarm/5111Q21335/2023,5111Q21335,,America/New_York
106,2023-07-27T20:46:00,,,0.0,2,Device,,System Alert /Alarm,Jul 27 2023  8:46PM,False,False,True,,,,,,,SYS_ALM,SystemAlertAlarm,,,,AlertAlarm/5111Q21335/2023,5111Q21335,,America/New_York
107,2023-07-28T21:30:00,https://alarmssaveandnotifyprod.blob.core.windows.net/snapshot/vu210550101310_74/2023/7/28/22/46/VU210550101310_74_1690579852,,0.0,123,Device,,RUN CAPACITY LIMITED-HIGH COMPRESSOR LIFT,Jul 28 2023  9:30PM,False,True,False,,,,,,,ALARM_01,CH_ALARM_01,,,,AlertAlarm/5111Q21335/2023,5111Q21335,,America/New_York
108,,,,,2,Device,,,7/28/2023 5:28:26 PM -04:00,False,True,False,1.0,,,,,,SYS_ALM,SystemAlertAlarm,,,,AlertAlarm/5111Q21335/2023,5111Q21335,,America/New_York
109,2023-07-29T02:13:00,,,0.0,2,Device,,System Alert /Alarm,Jul 29 2023  2:13AM,False,False,True,,,,,,,SYS_ALM,SystemAlertAlarm,,,,AlertAlarm/5111Q21335/2023,5111Q21335,,America/New_York
110,2023-07-29T02:13:00,,,0.0,123,Device,,RUN CAPACITY LIMITED-HIGH COMPRESSOR LIFT,Jul 29 2023  2:13AM,False,True,True,,,,,,,ALARM_01,CH_ALARM_01,,,,AlertAlarm/5111Q21335/2023,5111Q21335,,America/New_York
111,,,,,2,Device,,,8/4/2023 3:22:47 PM -04:00,False,True,False,1.0,,,,,,SYS_ALM,SystemAlertAlarm,,,,AlertAlarm/5111Q21335/2023,5111Q21335,,America/New_York
112,2023-08-04T19:27:00,,,0.0,2,Device,,System Alert /Alarm,Aug  4 2023  7:27PM,False,False,True,,,,,,,SYS_ALM,SystemAlertAlarm,,,,AlertAlarm/5111Q21335/2023,5111Q21335,,America/New_York
113,2023-08-07T17:28:00,https://alarmssaveandnotifyprod.blob.core.windows.net/snapshot/vu210550101310_74/2023/8/7/17/28/VU210550101310_74_1691429328,,0.0,123,Device,,RUN CAPACITY LIMITED-HIGH COMPRESSOR LIFT,Aug  7 2023  5:28PM,False,True,False,,,,,,,ALARM_01,CH_ALARM_01,,,,AlertAlarm/5111Q21335/2023,5111Q21335,,America/New_York
114,,,,,2,Device,,,8/7/2023 1:33:46 PM -04:00,False,True,False,1.0,,,,,,SYS_ALM,SystemAlertAlarm,,,,AlertAlarm/5111Q21335/2023,5111Q21335,,America/New_York
115,2023-08-07T18:08:00,,,0.0,2,Device,,System Alert /Alarm,Aug  7 2023  6:08PM,False,False,True,,,,,,,SYS_ALM,SystemAlertAlarm,,,,AlertAlarm/5111Q21335/2023,5111Q21335,,America/New_York
116,2023-08-07T18:08:00,,,0.0,123,Device,,RUN CAPACITY LIMITED-HIGH COMPRESSOR LIFT,Aug  7 2023  6:08PM,False,True,True,,,,,,,ALARM_01,CH_ALARM_01,,,,AlertAlarm/5111Q21335/2023,5111Q21335,,America/New_York
117,,,,,2,Device,,,8/7/2023 8:18:47 PM -04:00,False,True,False,1.0,,,,,,SYS_ALM,SystemAlertAlarm,,,,AlertAlarm/5111Q21335/2023,5111Q21335,,America/New_York
118,2023-08-12T18:28:00,https://alarmssaveandnotifyprod.blob.core.windows.net/snapshot/vu210550101310_74/2023/8/12/18/28/VU210550101310_74_1691864896,,0.0,123,Device,,RUN CAPACITY LIMITED-HIGH COMPRESSOR LIFT,Aug 12 2023  6:28PM,False,True,False,,,,,,,ALARM_01,CH_ALARM_01,,,,AlertAlarm/5111Q21335/2023,5111Q21335,,America/New_York
119,,,,,2,Device,,,8/12/2023 2:30:41 PM -04:00,False,True,False,1.0,,,,,,SYS_ALM,SystemAlertAlarm,,,,AlertAlarm/5111Q21335/2023,5111Q21335,,America/New_York
120,2023-08-12T19:50:00,,,0.0,2,Device,,System Alert /Alarm,Aug 12 2023  7:50PM,False,False,True,,,,,,,SYS_ALM,SystemAlertAlarm,,,,AlertAlarm/5111Q21335/2023,5111Q21335,,America/New_York
121,2023-08-12T19:50:00,,,0.0,123,Device,,RUN CAPACITY LIMITED-HIGH COMPRESSOR LIFT,Aug 12 2023  7:50PM,False,True,True,,,,,,,ALARM_01,CH_ALARM_01,,,,AlertAlarm/5111Q21335/2023,5111Q21335,,America/New_York
122,,,,,2,Device,,,8/12/2023 6:25:41 PM -04:00,False,True,False,1.0,,,,,,SYS_ALM,SystemAlertAlarm,,,,AlertAlarm/5111Q21335/2023,5111Q21335,,America/New_York
123,,,,,2,Device,,,8/13/2023 11:40:45 AM -04:00,False,True,False,1.0,,,,,,SYS_ALM,SystemAlertAlarm,,,,AlertAlarm/5111Q21335/2023,5111Q21335,,America/New_York
124,2023-08-13T16:25:00,,,0.0,2,Device,,System Alert /Alarm,Aug 13 2023  4:25PM,False,False,True,,,,,,,SYS_ALM,SystemAlertAlarm,,,,AlertAlarm/5111Q21335/2023,5111Q21335,,America/New_York
125,,,,,2,Device,,,8/16/2023 11:03:59 AM -04:00,False,True,False,1.0,,,,,,SYS_ALM,SystemAlertAlarm,,,,AlertAlarm/5111Q21335/2023,5111Q21335,,America/New_York
126,2023-08-16T15:32:00,,,0.0,2,Device,,System Alert /Alarm,Aug 16 2023  3:32PM,False,False,True,,,,,,,SYS_ALM,SystemAlertAlarm,,,,AlertAlarm/5111Q21335/2023,5111Q21335,,America/New_York
127,2023-08-16T15:32:00,https://alarmssaveandnotifyprod.blob.core.windows.net/snapshot/vu210550101310_74/2023/8/16/15/32/VU210550101310_74_1692199957,,0.0,123,Device,,RUN CAPACITY LIMITED-HIGH COMPRESSOR LIFT,Aug 16 2023  3:32PM,False,True,False,,,,,,,ALARM_01,CH_ALARM_01,,,,AlertAlarm/5111Q21335/2023,5111Q21335,,America/New_York
128,2023-08-17T00:49:00,,,0.0,123,Device,,RUN CAPACITY LIMITED-HIGH COMPRESSOR LIFT,Aug 17 2023 12:49AM,False,True,True,,,,,,,ALARM_01,CH_ALARM_01,,,,AlertAlarm/5111Q21335/2023,5111Q21335,,America/New_York
129,,,,,2,Device,,,8/16/2023 9:54:02 PM -04:00,False,True,False,1.0,,,,,,SYS_ALM,SystemAlertAlarm,,,,AlertAlarm/5111Q21335/2023,5111Q21335,,America/New_York
130,2023-08-17T02:54:00,,,0.0,2,Device,,System Alert /Alarm,Aug 17 2023  2:54AM,False,False,True,,,,,,,SYS_ALM,SystemAlertAlarm,,,,AlertAlarm/5111Q21335/2023,5111Q21335,,America/New_York
131,,,,,2,Device,,,8/17/2023 11:54:05 AM -04:00,False,True,False,1.0,,,,,,SYS_ALM,SystemAlertAlarm,,,,AlertAlarm/5111Q21335/2023,5111Q21335,,America/New_York
132,2023-08-17T16:09:00,,,0.0,2,Device,,System Alert /Alarm,Aug 17 2023  4:09PM,False,False,True,,,,,,,SYS_ALM,SystemAlertAlarm,,,,AlertAlarm/5111Q21335/2023,5111Q21335,,America/New_York
133,,,,,2,Device,,,8/17/2023 12:14:05 PM -04:00,False,True,False,1.0,,,,,,SYS_ALM,SystemAlertAlarm,,,,AlertAlarm/5111Q21335/2023,5111Q21335,,America/New_York
134,2023-08-18T02:19:00,,,0.0,2,Device,,System Alert /Alarm,Aug 18 2023  2:19AM,False,False,True,,,,,,,SYS_ALM,SystemAlertAlarm,,,,AlertAlarm/5111Q21335/2023,5111Q21335,,America/New_York
135,,,,,2,Device,,,8/21/2023 11:14:24 AM -04:00,False,True,False,1.0,,,,,,SYS_ALM,SystemAlertAlarm,,,,AlertAlarm/5111Q21335/2023,5111Q21335,,America/New_York
136,2023-08-21T16:49:00,,,0.0,2,Device,,System Alert /Alarm,Aug 21 2023  4:49PM,False,False,True,,,,,,,SYS_ALM,SystemAlertAlarm,,,,AlertAlarm/5111Q21335/2023,5111Q21335,,America/New_York
137,,,,,2,Device,,,8/21/2023 1:19:25 PM -04:00,False,True,False,1.0,,,,,,SYS_ALM,SystemAlertAlarm,,,,AlertAlarm/5111Q21335/2023,5111Q21335,,America/New_York
138,2023-08-21T17:24:00,,,0.0,2,Device,,System Alert /Alarm,Aug 21 2023  5:24PM,False,False,True,,,,,,,SYS_ALM,SystemAlertAlarm,,,,AlertAlarm/5111Q21335/2023,5111Q21335,,America/New_York
139,,,,,2,Device,,,8/21/2023 2:44:25 PM -04:00,False,True,False,1.0,,,,,,SYS_ALM,SystemAlertAlarm,,,,AlertAlarm/5111Q21335/2023,5111Q21335,,America/New_York
140,2023-08-21T21:14:00,,,0.0,2,Device,,System Alert /Alarm,Aug 21 2023  9:14PM,False,False,True,,,,,,,SYS_ALM,SystemAlertAlarm,,,,AlertAlarm/5111Q21335/2023,5111Q21335,,America/New_York
141,2023-09-03T16:20:00,https://alarmssaveandnotifyprod.blob.core.windows.net/snapshot/vu210550101310_74/2023/9/3/16/20/VU210550101310_74_1693758050,,0.0,123,Device,,RUN CAPACITY LIMITED-HIGH COMPRESSOR LIFT,Sep  3 2023  4:20PM,False,True,False,,,,,,,ALARM_01,CH_ALARM_01,,,,AlertAlarm/5111Q21335/2023,5111Q21335,,America/New_York
142,,,,,2,Device,,,9/3/2023 12:25:54 PM -04:00,False,True,False,1.0,,,,,,SYS_ALM,SystemAlertAlarm,,,,AlertAlarm/5111Q21335/2023,5111Q21335,,America/New_York
143,2023-09-03T18:25:00,,,0.0,2,Device,,System Alert /Alarm,Sep  3 2023  6:25PM,False,False,True,,,,,,,SYS_ALM,SystemAlertAlarm,,,,AlertAlarm/5111Q21335/2023,5111Q21335,,America/New_York
144,2023-09-03T18:25:00,,,0.0,123,Device,,RUN CAPACITY LIMITED-HIGH COMPRESSOR LIFT,Sep  3 2023  6:25PM,False,True,True,,,,,,,ALARM_01,CH_ALARM_01,,,,AlertAlarm/5111Q21335/2023,5111Q21335,,America/New_York
145,,,,,2,Device,,,9/3/2023 2:55:55 PM -04:00,False,True,False,1.0,,,,,,SYS_ALM,SystemAlertAlarm,,,,AlertAlarm/5111Q21335/2023,5111Q21335,,America/New_York
146,2023-09-04T00:05:00,,,0.0,2,Device,,System Alert /Alarm,Sep  4 2023 12:05AM,False,False,True,,,,,,,SYS_ALM,SystemAlertAlarm,,,,AlertAlarm/5111Q21335/2023,5111Q21335,,America/New_York
147,,,,,2,Device,,,9/4/2023 10:30:59 AM -04:00,False,True,False,1.0,,,,,,SYS_ALM,SystemAlertAlarm,,,,AlertAlarm/5111Q21335/2023,5111Q21335,,America/New_York
148,,,,,2,Device,,,9/5/2023 10:43:45 AM -04:00,False,True,False,1.0,,,,,,SYS_ALM,SystemAlertAlarm,,,,AlertAlarm/5111Q21335/2023,5111Q21335,,America/New_York
149,,,,,2,Device,,,9/6/2023 10:29:42 AM -04:00,False,True,False,1.0,,,,,,SYS_ALM,SystemAlertAlarm,,,,AlertAlarm/5111Q21335/2023,5111Q21335,,America/New_York
150,,,,,2,Device,,,9/6/2023 7:04:44 PM -04:00,False,True,False,1.0,,,,,,SYS_ALM,SystemAlertAlarm,,,,AlertAlarm/5111Q21335/2023,5111Q21335,,America/New_York
151,,,,,2,Device,,,9/7/2023 10:05:23 AM -04:00,False,True,False,1.0,,,,,,SYS_ALM,SystemAlertAlarm,,,,AlertAlarm/5111Q21335/2023,5111Q21335,,America/New_York
152,2023-09-05T14:39:00,,,0.0,2,Device,,System Alert /Alarm,Sep  5 2023  2:39PM,False,False,True,,,,,,,SYS_ALM,SystemAlertAlarm,,,,AlertAlarm/5111Q21335/2023,5111Q21335,,America/New_York
153,2023-09-05T14:39:00,https://alarmssaveandnotifyprod.blob.core.windows.net/snapshot/vu210550101310_74/2023/9/8/16/10/VU210550101310_74_1693924780,,0.0,123,Device,,RUN CAPACITY LIMITED-HIGH COMPRESSOR LIFT,Sep  5 2023  2:39PM,False,True,False,,,,,,,ALARM_01,CH_ALARM_01,,,,AlertAlarm/5111Q21335/2023,5111Q21335,,America/New_York
154,,,,,2,Device,,,9/7/2023 6:30:25 PM -04:00,False,True,False,1.0,,,,,,SYS_ALM,SystemAlertAlarm,,,,AlertAlarm/5111Q21335/2023,5111Q21335,,America/New_York
155,,,,,2,Device,,,9/8/2023 2:00:32 PM -04:00,False,True,False,1.0,,,,,,SYS_ALM,SystemAlertAlarm,,,,AlertAlarm/5111Q21335/2023,5111Q21335,,America/New_York
156,2023-09-06T14:30:00,,,0.0,2,Device,,System Alert /Alarm,Sep  6 2023  2:30PM,False,False,True,,,,,,,SYS_ALM,SystemAlertAlarm,,,,AlertAlarm/5111Q21335/2023,5111Q21335,,America/New_York
157,2023-09-06T22:39:00,,,0.0,123,Device,,RUN CAPACITY LIMITED-HIGH COMPRESSOR LIFT,Sep  6 2023 10:39PM,False,True,True,,,,,,,ALARM_01,CH_ALARM_01,,,,AlertAlarm/5111Q21335/2023,5111Q21335,,America/New_York
158,2023-09-07T14:09:00,,,0.0,2,Device,,System Alert /Alarm,Sep  7 2023  2:09PM,False,False,True,,,,,,,SYS_ALM,SystemAlertAlarm,,,,AlertAlarm/5111Q21335/2023,5111Q21335,,America/New_York
159,2023-09-07T14:09:00,https://alarmssaveandnotifyprod.blob.core.windows.net/snapshot/vu210550101310_74/2023/9/9/6/27/VU210550101310_74_1694095759,,0.0,123,Device,,RUN CAPACITY LIMITED-HIGH COMPRESSOR LIFT,Sep  7 2023  2:09PM,False,True,False,,,,,,,ALARM_01,CH_ALARM_01,,,,AlertAlarm/5111Q21335/2023,5111Q21335,,America/New_York
160,2023-09-08T00:03:00,,,0.0,2,Device,,System Alert /Alarm,Sep  8 2023 12:03AM,False,False,True,,,,,,,SYS_ALM,SystemAlertAlarm,,,,AlertAlarm/5111Q21335/2023,5111Q21335,,America/New_York
161,2023-09-08T15:23:00,,,0.0,2,Device,,System Alert /Alarm,Sep  8 2023  3:23PM,False,False,True,,,,,,,SYS_ALM,SystemAlertAlarm,,,,AlertAlarm/5111Q21335/2023,5111Q21335,,America/New_York
162,2023-09-07T22:00:00,,,0.0,123,Device,,RUN CAPACITY LIMITED-HIGH COMPRESSOR LIFT,Sep  7 2023 10:00PM,False,True,True,,,,,,,ALARM_01,CH_ALARM_01,,,,AlertAlarm/5111Q21335/2023,5111Q21335,,America/New_York
163,2023-09-08T19:20:00,,,0.0,2,Device,,System Alert /Alarm,Sep  8 2023  7:20PM,False,False,True,,,,,,,SYS_ALM,SystemAlertAlarm,,,,AlertAlarm/5111Q21335/2023,5111Q21335,,America/New_York
164,2023-09-21T14:06:00,https://alarmssaveandnotifyprod.blob.core.windows.net/snapshot/vu210550101310_74/2023/9/21/14/6/VU210550101310_74_1695305178,,0.0,122,Device,,RUN CAPACITY LIMITED-LOW EVAP REFRIG TEMP,Sep 21 2023  2:06PM,False,True,False,,,,,,,ALARM_01,CH_ALARM_01,,,,AlertAlarm/5111Q21335/2023,5111Q21335,,America/New_York
165,2023-09-21T14:06:00,https://alarmssaveandnotifyprod.blob.core.windows.net/snapshot/vu210550101310_74/2023/9/21/14/6/VU210550101310_74_1695305178,,0.0,122,Device,,RUN CAPACITY LIMITED-LOW EVAP REFRIG TEMP,Sep 21 2023  2:06PM,False,True,False,,,,,,,ALARM_01,CH_ALARM_01,,,,AlertAlarm/5111Q21335/2023,5111Q21335,,America/New_York
166,,,,,2,Device,,,9/21/2023 10:06:50 AM -04:00,False,True,False,1.0,,,,,,SYS_ALM,SystemAlertAlarm,,,,AlertAlarm/5111Q21335/2023,5111Q21335,,America/New_York
167,2023-09-21T14:38:00,,,0.0,2,Device,,System Alert /Alarm,Sep 21 2023  2:38PM,False,False,True,,,,,,,SYS_ALM,SystemAlertAlarm,,,,AlertAlarm/5111Q21335/2023,5111Q21335,,America/New_York
168,2023-09-21T14:38:00,https://alarmssaveandnotifyprod.blob.core.windows.net/snapshot/vu210550101310_74/2023/9/21/14/38/VU210550101310_74_1695307084,,0.0,162,Device,,SENSOR ALERT-EVAPORATOR APPROACH,Sep 21 2023  2:38PM,False,True,False,,,,,,,ALARM_02,CH_ALARM_02,,,,AlertAlarm/5111Q21335/2023,5111Q21335,,America/New_York
169,2023-09-21T14:41:00,,,0.0,122,Device,,RUN CAPACITY LIMITED-LOW EVAP REFRIG TEMP,Sep 21 2023  2:41PM,False,True,True,,,,,,,ALARM_01,CH_ALARM_01,,,,AlertAlarm/5111Q21335/2023,5111Q21335,,America/New_York
170,2023-09-21T14:41:00,,,0.0,162,Device,,SENSOR ALERT-EVAPORATOR APPROACH,Sep 21 2023  2:41PM,False,True,True,,,,,,,ALARM_02,CH_ALARM_02,,,,AlertAlarm/5111Q21335/2023,5111Q21335,,America/New_York
171,,,,,2,Device,,,9/21/2023 10:46:50 AM -04:00,False,True,False,1.0,,,,,,SYS_ALM,SystemAlertAlarm,,,,AlertAlarm/5111Q21335/2023,5111Q21335,,America/New_York
172,2023-09-21T14:56:00,,,0.0,2,Device,,System Alert /Alarm,Sep 21 2023  2:56PM,False,False,True,,,,,,,SYS_ALM,SystemAlertAlarm,,,,AlertAlarm/5111Q21335/2023,5111Q21335,,America/New_York
173,,,,,2,Device,,,9/21/2023 11:06:51 AM -04:00,False,True,False,1.0,,,,,,SYS_ALM,SystemAlertAlarm,,,,AlertAlarm/5111Q21335/2023,5111Q21335,,America/New_York
174,2023-09-21T19:26:00,,,0.0,2,Device,,System Alert /Alarm,Sep 21 2023  7:26PM,False,False,True,,,,,,,SYS_ALM,SystemAlertAlarm,,,,AlertAlarm/5111Q21335/2023,5111Q21335,,America/New_York
175,,,,,2,Device,,,9/21/2023 3:41:51 PM -04:00,False,True,False,1.0,,,,,,SYS_ALM,SystemAlertAlarm,,,,AlertAlarm/5111Q21335/2023,5111Q21335,,America/New_York
176,2023-09-21T19:51:00,,,0.0,2,Device,,System Alert /Alarm,Sep 21 2023  7:51PM,False,False,True,,,,,,,SYS_ALM,SystemAlertAlarm,,,,AlertAlarm/5111Q21335/2023,5111Q21335,,America/New_York
177,2023-09-21T19:51:00,,,0.0,2,Device,,System Alert /Alarm,Sep 21 2023  7:51PM,False,False,True,,,,,,,SYS_ALM,SystemAlertAlarm,,,,AlertAlarm/5111Q21335/2023,5111Q21335,,America/New_York
178,2023-09-22T15:09:00,https://alarmssaveandnotifyprod.blob.core.windows.net/snapshot/vu210550101310_74/2023/9/23/5/9/VU210550101310_74_1695395394,,0.0,122,Device,,RUN CAPACITY LIMITED-LOW EVAP REFRIG TEMP,Sep 22 2023  3:09PM,False,True,False,,,,,,,ALARM_01,CH_ALARM_01,,,,AlertAlarm/5111Q21335/2023,5111Q21335,,America/New_York
179,2023-09-22T15:15:00,https://alarmssaveandnotifyprod.blob.core.windows.net/snapshot/vu210550101310_74/2023/9/23/5/9/VU210550101310_74_1695395744,,0.0,162,Device,,SENSOR ALERT-EVAPORATOR APPROACH,Sep 22 2023  3:15PM,False,True,False,,,,,,,ALARM_02,CH_ALARM_02,,,,AlertAlarm/5111Q21335/2023,5111Q21335,,America/New_York
180,,,,,2,Device,,,9/22/2023 11:14:23 AM -04:00,False,True,False,1.0,,,,,,SYS_ALM,SystemAlertAlarm,,,,AlertAlarm/5111Q21335/2023,5111Q21335,,America/New_York
181,2023-09-22T16:34:00,,,0.0,2,Device,,System Alert /Alarm,Sep 22 2023  4:34PM,False,False,True,,,,,,,SYS_ALM,SystemAlertAlarm,,,,AlertAlarm/5111Q21335/2023,5111Q21335,,America/New_York
182,2023-09-22T16:34:00,,,0.0,122,Device,,RUN CAPACITY LIMITED-LOW EVAP REFRIG TEMP,Sep 22 2023  4:34PM,False,True,True,,,,,,,ALARM_01,CH_ALARM_01,,,,AlertAlarm/5111Q21335/2023,5111Q21335,,America/New_York
183,2023-09-22T16:34:00,,,0.0,162,Device,,SENSOR ALERT-EVAPORATOR APPROACH,Sep 22 2023  4:34PM,False,True,True,,,,,,,ALARM_02,CH_ALARM_02,,,,AlertAlarm/5111Q21335/2023,5111Q21335,,America/New_York
184,2023-09-23T18:29:00,https://alarmssaveandnotifyprod.blob.core.windows.net/snapshot/vu210550101310_74/2023/9/24/15/44/VU210550101310_74_1695493775,,0.0,122,Device,,RUN CAPACITY LIMITED-LOW EVAP REFRIG TEMP,Sep 23 2023  6:29PM,False,True,False,,,,,,,ALARM_01,CH_ALARM_01,,,,AlertAlarm/5111Q21335/2023,5111Q21335,,America/New_York
185,2023-09-23T22:00:00,https://alarmssaveandnotifyprod.blob.core.windows.net/snapshot/vu210550101310_74/2023/9/24/15/44/VU210550101310_74_1695506448,,0.0,162,Device,,SENSOR ALERT-EVAPORATOR APPROACH,Sep 23 2023 10:00PM,False,True,False,,,,,,,ALARM_02,CH_ALARM_02,,,,AlertAlarm/5111Q21335/2023,5111Q21335,,America/New_York
186,,,,,2,Device,,,9/23/2023 2:32:13 PM -04:00,False,True,False,1.0,,,,,,SYS_ALM,SystemAlertAlarm,,,,AlertAlarm/5111Q21335/2023,5111Q21335,,America/New_York
187,2023-09-23T18:37:00,,,0.0,2,Device,,System Alert /Alarm,Sep 23 2023  6:37PM,False,False,True,,,,,,,SYS_ALM,SystemAlertAlarm,,,,AlertAlarm/5111Q21335/2023,5111Q21335,,America/New_York
188,2023-09-23T18:37:00,,,0.0,122,Device,,RUN CAPACITY LIMITED-LOW EVAP REFRIG TEMP,Sep 23 2023  6:37PM,False,True,True,,,,,,,ALARM_01,CH_ALARM_01,,,,AlertAlarm/5111Q21335/2023,5111Q21335,,America/New_York
189,,,,,2,Device,,,9/23/2023 5:57:13 PM -04:00,False,True,False,1.0,,,,,,SYS_ALM,SystemAlertAlarm,,,,AlertAlarm/5111Q21335/2023,5111Q21335,,America/New_York
190,2023-09-23T22:22:00,,,0.0,2,Device,,System Alert /Alarm,Sep 23 2023 10:22PM,False,False,True,,,,,,,SYS_ALM,SystemAlertAlarm,,,,AlertAlarm/5111Q21335/2023,5111Q21335,,America/New_York
191,2023-09-23T22:22:00,,,0.0,162,Device,,SENSOR ALERT-EVAPORATOR APPROACH,Sep 23 2023 10:22PM,False,True,True,,,,,,,ALARM_02,CH_ALARM_02,,,,AlertAlarm/5111Q21335/2023,5111Q21335,,America/New_York
192,2023-09-24T17:02:00,https://alarmssaveandnotifyprod.blob.core.windows.net/snapshot/vu210550101310_74/2023/9/25/1/9/VU210550101310_74_1695574957,,0.0,162,Device,,SENSOR ALERT-EVAPORATOR APPROACH,Sep 24 2023  5:02PM,False,True,False,,,,,,,ALARM_01,CH_ALARM_01,,,,AlertAlarm/5111Q21335/2023,5111Q21335,,America/New_York
193,2023-09-24T17:07:00,https://alarmssaveandnotifyprod.blob.core.windows.net/snapshot/vu210550101310_74/2023/9/25/1/9/VU210550101310_74_1695575261,,0.0,122,Device,,RUN CAPACITY LIMITED-LOW EVAP REFRIG TEMP,Sep 24 2023  5:07PM,False,True,False,,,,,,,ALARM_02,CH_ALARM_02,,,,AlertAlarm/5111Q21335/2023,5111Q21335,,America/New_York
194,,,,,2,Device,,,9/24/2023 1:06:13 PM -04:00,False,True,False,1.0,,,,,,SYS_ALM,SystemAlertAlarm,,,,AlertAlarm/5111Q21335/2023,5111Q21335,,America/New_York
195,,,,,2,Device,,,9/24/2023 2:31:13 PM -04:00,False,True,False,1.0,,,,,,SYS_ALM,SystemAlertAlarm,,,,AlertAlarm/5111Q21335/2023,5111Q21335,,America/New_York
196,2023-09-24T18:36:00,,,0.0,2,Device,,System Alert /Alarm,Sep 24 2023  6:36PM,False,False,True,,,,,,,SYS_ALM,SystemAlertAlarm,,,,AlertAlarm/5111Q21335/2023,5111Q21335,,America/New_York
197,2023-09-27T14:39:00,https://alarmssaveandnotifyprod.blob.core.windows.net/snapshot/vu210550101310_74/2023/9/27/14/40/VU210550101310_74_1695825595,,0.0,162,Device,,SENSOR ALERT-EVAPORATOR APPROACH,Sep 27 2023  2:39PM,False,True,False,,,,,,,ALARM_01,CH_ALARM_01,,,,AlertAlarm/5111Q21335/2023,5111Q21335,,America/New_York
198,2023-09-27T14:44:00,https://alarmssaveandnotifyprod.blob.core.windows.net/snapshot/vu210550101310_74/2023/9/27/14/45/VU210550101310_74_1695825896,,0.0,122,Device,,RUN CAPACITY LIMITED-LOW EVAP REFRIG TEMP,Sep 27 2023  2:44PM,False,True,False,,,,,,,ALARM_02,CH_ALARM_02,,,,AlertAlarm/5111Q21335/2023,5111Q21335,,America/New_York
199,,,,,2,Device,,,9/27/2023 10:45:10 AM -04:00,False,True,False,1.0,,,,,,SYS_ALM,SystemAlertAlarm,,,,AlertAlarm/5111Q21335/2023,5111Q21335,,America/New_York
200,2023-09-27T14:55:00,,,0.0,2,Device,,System Alert /Alarm,Sep 27 2023  2:55PM,False,False,True,,,,,,,SYS_ALM,SystemAlertAlarm,,,,AlertAlarm/5111Q21335/2023,5111Q21335,,America/New_York
201,2023-09-27T14:55:00,,,0.0,162,Device,,SENSOR ALERT-EVAPORATOR APPROACH,Sep 27 2023  2:55PM,False,True,True,,,,,,,ALARM_01,CH_ALARM_01,,,,AlertAlarm/5111Q21335/2023,5111Q21335,,America/New_York
202,2023-09-27T14:55:00,,,0.0,122,Device,,RUN CAPACITY LIMITED-LOW EVAP REFRIG TEMP,Sep 27 2023  2:55PM,False,True,True,,,,,,,ALARM_02,CH_ALARM_02,,,,AlertAlarm/5111Q21335/2023,5111Q21335,,America/New_York
203,,,,,2,Device,,,9/27/2023 11:20:10 AM -04:00,False,True,False,1.0,,,,,,SYS_ALM,SystemAlertAlarm,,,,AlertAlarm/5111Q21335/2023,5111Q21335,,America/New_York
204,2023-09-27T15:30:00,,,0.0,2,Device,,System Alert /Alarm,Sep 27 2023  3:30PM,False,False,True,,,,,,,SYS_ALM,SystemAlertAlarm,,,,AlertAlarm/5111Q21335/2023,5111Q21335,,America/New_York
205,,,,,2,Device,,,9/27/2023 11:40:10 AM -04:00,False,True,False,1.0,,,,,,SYS_ALM,SystemAlertAlarm,,,,AlertAlarm/5111Q21335/2023,5111Q21335,,America/New_York
206,2023-09-27T15:45:00,,,0.0,2,Device,,System Alert /Alarm,Sep 27 2023  3:45PM,False,False,True,,,,,,,SYS_ALM,SystemAlertAlarm,,,,AlertAlarm/5111Q21335/2023,5111Q21335,,America/New_York
207,,,,,2,Device,,,9/27/2023 12:10:10 PM -04:00,False,True,False,1.0,,,,,,SYS_ALM,SystemAlertAlarm,,,,AlertAlarm/5111Q21335/2023,5111Q21335,,America/New_York
208,2023-09-27T16:15:00,,,0.0,2,Device,,System Alert /Alarm,Sep 27 2023  4:15PM,False,False,True,,,,,,,SYS_ALM,SystemAlertAlarm,,,,AlertAlarm/5111Q21335/2023,5111Q21335,,America/New_York
209,,,,,2,Device,,,9/28/2023 11:40:47 AM -04:00,False,True,False,1.0,,,,,,SYS_ALM,SystemAlertAlarm,,,,AlertAlarm/5111Q21335/2023,5111Q21335,,America/New_York
210,2023-09-28T15:45:00,,,0.0,2,Device,,System Alert /Alarm,Sep 28 2023  3:45PM,False,False,True,,,,,,,SYS_ALM,SystemAlertAlarm,,,,AlertAlarm/5111Q21335/2023,5111Q21335,,America/New_York
211,2023-09-28T16:15:00,https://alarmssaveandnotifyprod.blob.core.windows.net/snapshot/vu210550101310_74/2023/9/28/16/15/VU210550101310_74_1695917718,,0.0,162,Device,,SENSOR ALERT-EVAPORATOR APPROACH,Sep 28 2023  4:15PM,False,True,False,,,,,,,ALARM_01,CH_ALARM_01,,,,AlertAlarm/5111Q21335/2023,5111Q21335,,America/New_York
212,,,,,2,Device,,,9/28/2023 12:15:47 PM -04:00,False,True,False,1.0,,,,,,SYS_ALM,SystemAlertAlarm,,,,AlertAlarm/5111Q21335/2023,5111Q21335,,America/New_York
213,2023-09-28T16:26:00,,,0.0,2,Device,,System Alert /Alarm,Sep 28 2023  4:26PM,False,False,True,,,,,,,SYS_ALM,SystemAlertAlarm,,,,AlertAlarm/5111Q21335/2023,5111Q21335,,America/New_York
214,2023-09-28T16:26:00,https://alarmssaveandnotifyprod.blob.core.windows.net/snapshot/vu210550101310_74/2023/9/28/16/26/VU210550101310_74_1695918376,,0.0,122,Device,,RUN CAPACITY LIMITED-LOW EVAP REFRIG TEMP,Sep 28 2023  4:26PM,False,True,False,,,,,,,ALARM_02,CH_ALARM_02,,,,AlertAlarm/5111Q21335/2023,5111Q21335,,America/New_York
215,2023-09-28T16:55:00,,,0.0,162,Device,,SENSOR ALERT-EVAPORATOR APPROACH,Sep 28 2023  4:55PM,False,True,True,,,,,,,ALARM_01,CH_ALARM_01,,,,AlertAlarm/5111Q21335/2023,5111Q21335,,America/New_York
216,2023-09-28T16:55:00,,,0.0,122,Device,,RUN CAPACITY LIMITED-LOW EVAP REFRIG TEMP,Sep 28 2023  4:55PM,False,True,True,,,,,,,ALARM_02,CH_ALARM_02,,,,AlertAlarm/5111Q21335/2023,5111Q21335,,America/New_York
217,,,,,2,Device,,,9/28/2023 1:00:47 PM -04:00,False,True,False,1.0,,,,,,SYS_ALM,SystemAlertAlarm,,,,AlertAlarm/5111Q21335/2023,5111Q21335,,America/New_York
218,2023-09-28T18:25:00,,,0.0,2,Device,,System Alert /Alarm,Sep 28 2023  6:25PM,False,False,True,,,,,,,SYS_ALM,SystemAlertAlarm,,,,AlertAlarm/5111Q21335/2023,5111Q21335,,America/New_York
219,,,,,2,Device,,,9/28/2023 2:35:48 PM -04:00,False,True,False,1.0,,,,,,SYS_ALM,SystemAlertAlarm,,,,AlertAlarm/5111Q21335/2023,5111Q21335,,America/New_York
220,2023-09-28T19:55:00,,,0.0,2,Device,,System Alert /Alarm,Sep 28 2023  7:55PM,False,False,True,,,,,,,SYS_ALM,SystemAlertAlarm,,,,AlertAlarm/5111Q21335/2023,5111Q21335,,America/New_York
221,,,,,2,Device,,,9/28/2023 4:00:48 PM -04:00,False,True,False,1.0,,,,,,SYS_ALM,SystemAlertAlarm,,,,AlertAlarm/5111Q21335/2023,5111Q21335,,America/New_York
222,2023-09-28T21:35:00,,,0.0,2,Device,,System Alert /Alarm,Sep 28 2023  9:35PM,False,False,True,,,,,,,SYS_ALM,SystemAlertAlarm,,,,AlertAlarm/5111Q21335/2023,5111Q21335,,America/New_York
223,,,,,2,Device,,,9/28/2023 5:40:48 PM -04:00,False,True,False,1.0,,,,,,SYS_ALM,SystemAlertAlarm,,,,AlertAlarm/5111Q21335/2023,5111Q21335,,America/New_York
224,2023-09-28T23:15:00,,,0.0,2,Device,,System Alert /Alarm,Sep 28 2023 11:15PM,False,False,True,,,,,,,SYS_ALM,SystemAlertAlarm,,,,AlertAlarm/5111Q21335/2023,5111Q21335,,America/New_York
225,,,,,2,Device,,,9/28/2023 7:20:49 PM -04:00,False,True,False,1.0,,,,,,SYS_ALM,SystemAlertAlarm,,,,AlertAlarm/5111Q21335/2023,5111Q21335,,America/New_York
226,2023-09-28T23:55:00,,,0.0,2,Device,,System Alert /Alarm,Sep 28 2023 11:55PM,False,False,True,,,,,,,SYS_ALM,SystemAlertAlarm,,,,AlertAlarm/5111Q21335/2023,5111Q21335,,America/New_York
227,,,,,2,Device,,,9/28/2023 8:20:49 PM -04:00,False,True,False,1.0,,,,,,SYS_ALM,SystemAlertAlarm,,,,AlertAlarm/5111Q21335/2023,5111Q21335,,America/New_York
228,2023-09-29T00:30:00,,,0.0,2,Device,,System Alert /Alarm,Sep 29 2023 12:30AM,False,False,True,,,,,,,SYS_ALM,SystemAlertAlarm,,,,AlertAlarm/5111Q21335/2023,5111Q21335,,America/New_York
229,2023-10-03T17:00:00,https://alarmssaveandnotifyprod.blob.core.windows.net/snapshot/vu210550101310_74/2023/10/3/17/0/VU210550101310_74_1696352417,,0.0,123,Device,,RUN CAPACITY LIMITED-HIGH COMPRESSOR LIFT,Oct  3 2023  5:00PM,False,True,False,,,,,,,ALARM_01,CH_ALARM_01,,,,AlertAlarm/5111Q21335/2023,5111Q21335,,America/New_York
230,2023-10-03T17:06:00,https://alarmssaveandnotifyprod.blob.core.windows.net/snapshot/vu210550101310_74/2023/10/3/17/6/VU210550101310_74_1696352769,,0.0,122,Device,,RUN CAPACITY LIMITED-LOW EVAP REFRIG TEMP,Oct  3 2023  5:06PM,False,True,False,,,,,,,ALARM_02,CH_ALARM_02,,,,AlertAlarm/5111Q21335/2023,5111Q21335,,America/New_York
231,,,,,2,Device,,,10/3/2023 3:59:01 PM -04:00,False,True,False,1.0,,,,,,SYS_ALM,SystemAlertAlarm,,,,AlertAlarm/5111Q21335/2023,5111Q21335,,America/New_York
232,2023-10-03T21:54:00,,,0.0,2,Device,,System Alert /Alarm,Oct  3 2023  9:54PM,False,False,True,,,,,,,SYS_ALM,SystemAlertAlarm,,,,AlertAlarm/5111Q21335/2023,5111Q21335,,America/New_York
233,2023-10-03T21:54:00,,,0.0,123,Device,,RUN CAPACITY LIMITED-HIGH COMPRESSOR LIFT,Oct  3 2023  9:54PM,False,True,True,,,,,,,ALARM_01,CH_ALARM_01,,,,AlertAlarm/5111Q21335/2023,5111Q21335,,America/New_York
234,2023-10-03T21:54:00,,,0.0,122,Device,,RUN CAPACITY LIMITED-LOW EVAP REFRIG TEMP,Oct  3 2023  9:54PM,False,True,True,,,,,,,ALARM_02,CH_ALARM_02,,,,AlertAlarm/5111Q21335/2023,5111Q21335,,America/New_York
235,,,,,2,Device,,,10/4/2023 1:59:05 PM -04:00,False,True,False,1.0,,,,,,SYS_ALM,SystemAlertAlarm,,,,AlertAlarm/5111Q21335/2023,5111Q21335,,America/New_York
236,2023-10-04T22:39:00,,,0.0,2,Device,,System Alert /Alarm,Oct  4 2023 10:39PM,False,False,True,,,,,,,SYS_ALM,SystemAlertAlarm,,,,AlertAlarm/5111Q21335/2023,5111Q21335,,America/New_York
237,,,,,2,Device,,,10/4/2023 8:34:07 PM -04:00,False,True,False,1.0,,,,,,SYS_ALM,SystemAlertAlarm,,,,AlertAlarm/5111Q21335/2023,5111Q21335,,America/New_York
238,2023-10-05T02:14:00,,,0.0,2,Device,,System Alert /Alarm,Oct  5 2023  2:14AM,False,False,True,,,,,,,SYS_ALM,SystemAlertAlarm,,,,AlertAlarm/5111Q21335/2023,5111Q21335,,America/New_York
239,,,,,2,Device,,,10/10/2023 12:36:30 PM -04:00,False,True,False,1.0,,,,,,SYS_ALM,SystemAlertAlarm,,,,AlertAlarm/5111Q21335/2023,5111Q21335,,America/New_York
240,2023-10-10T16:41:00,,,0.0,2,Device,,System Alert /Alarm,Oct 10 2023  4:41PM,False,False,True,,,,,,,SYS_ALM,SystemAlertAlarm,,,,AlertAlarm/5111Q21335/2023,5111Q21335,,America/New_York
241,2023-10-10T16:41:00,https://alarmssaveandnotifyprod.blob.core.windows.net/snapshot/vu210550101310_74/2023/10/10/16/41/VU210550101310_74_1696956096,,0.0,122,Device,,RUN CAPACITY LIMITED-LOW EVAP REFRIG TEMP,Oct 10 2023  4:41PM,False,True,False,,,,,,,ALARM_01,CH_ALARM_01,,,,AlertAlarm/5111Q21335/2023,5111Q21335,,America/New_York
242,2023-10-10T16:46:00,https://alarmssaveandnotifyprod.blob.core.windows.net/snapshot/vu210550101310_74/2023/10/10/16/46/VU210550101310_74_1696956401,,0.0,162,Device,,SENSOR ALERT-EVAPORATOR APPROACH,Oct 10 2023  4:46PM,False,True,False,,,,,,,ALARM_02,CH_ALARM_02,,,,AlertAlarm/5111Q21335/2023,5111Q21335,,America/New_York
243,,,,,2,Device,,,10/10/2023 3:46:31 PM -04:00,False,True,False,1.0,,,,,,SYS_ALM,SystemAlertAlarm,,,,AlertAlarm/5111Q21335/2023,5111Q21335,,America/New_York
244,2023-10-10T19:41:00,,,0.0,122,Device,,RUN CAPACITY LIMITED-LOW EVAP REFRIG TEMP,Oct 10 2023  7:41PM,False,True,True,,,,,,,ALARM_01,CH_ALARM_01,,,,AlertAlarm/5111Q21335/2023,5111Q21335,,America/New_York
245,2023-10-10T19:41:00,,,0.0,162,Device,,SENSOR ALERT-EVAPORATOR APPROACH,Oct 10 2023  7:41PM,False,True,True,,,,,,,ALARM_02,CH_ALARM_02,,,,AlertAlarm/5111Q21335/2023,5111Q21335,,America/New_York
246,2023-10-10T23:16:00,,,0.0,2,Device,,System Alert /Alarm,Oct 10 2023 11:16PM,False,False,True,,,,,,,SYS_ALM,SystemAlertAlarm,,,,AlertAlarm/5111Q21335/2023,5111Q21335,,America/New_York
247,,,,,2,Device,,,10/11/2023 12:31:35 PM -04:00,False,True,False,1.0,,,,,,SYS_ALM,SystemAlertAlarm,,,,AlertAlarm/5111Q21335/2023,5111Q21335,,America/New_York
248,,,,,2,Device,,,10/11/2023 1:01:35 PM -04:00,False,True,False,1.0,,,,,,SYS_ALM,SystemAlertAlarm,,,,AlertAlarm/5111Q21335/2023,5111Q21335,,America/New_York
249,2023-10-11T17:41:00,,,0.0,2,Device,,System Alert /Alarm,Oct 11 2023  5:41PM,False,False,True,,,,,,,SYS_ALM,SystemAlertAlarm,,,,AlertAlarm/5111Q21335/2023,5111Q21335,,America/New_York
250,2023-10-11T17:41:00,,,0.0,2,Device,,System Alert /Alarm,Oct 11 2023  5:41PM,False,False,True,,,,,,,SYS_ALM,SystemAlertAlarm,,,,AlertAlarm/5111Q21335/2023,5111Q21335,,America/New_York
251,,,,,2,Device,,,10/11/2023 2:06:35 PM -04:00,False,True,False,1.0,,,,,,SYS_ALM,SystemAlertAlarm,,,,AlertAlarm/5111Q21335/2023,5111Q21335,,America/New_York
252,2023-10-11T18:11:00,,,0.0,2,Device,,System Alert /Alarm,Oct 11 2023  6:11PM,False,False,True,,,,,,,SYS_ALM,SystemAlertAlarm,,,,AlertAlarm/5111Q21335/2023,5111Q21335,,America/New_York
253,,,,,2,Device,,,10/13/2023 3:56:45 PM -04:00,False,True,False,1.0,,,,,,SYS_ALM,SystemAlertAlarm,,,,AlertAlarm/5111Q21335/2023,5111Q21335,,America/New_York
254,2023-10-13T21:25:00,,,0.0,2,Device,,System Alert /Alarm,Oct 13 2023  9:25PM,False,False,True,,,,,,,SYS_ALM,SystemAlertAlarm,,,,AlertAlarm/5111Q21335/2023,5111Q21335,,America/New_York
255,2023-10-13T21:25:00,https://alarmssaveandnotifyprod.blob.core.windows.net/snapshot/vu210550101310_74/2023/10/13/21/25/VU210550101310_74_1697232323,,0.0,122,Device,,RUN CAPACITY LIMITED-LOW EVAP REFRIG TEMP,Oct 13 2023  9:25PM,False,True,False,,,,,,,ALARM_01,CH_ALARM_01,,,,AlertAlarm/5111Q21335/2023,5111Q21335,,America/New_York
256,2023-10-13T21:25:00,https://alarmssaveandnotifyprod.blob.core.windows.net/snapshot/vu210550101310_74/2023/10/13/21/25/VU210550101310_74_1697232323,,0.0,162,Device,,SENSOR ALERT-EVAPORATOR APPROACH,Oct 13 2023  9:25PM,False,True,False,,,,,,,ALARM_02,CH_ALARM_02,,,,AlertAlarm/5111Q21335/2023,5111Q21335,,America/New_York
257,2023-10-13T22:11:00,,,0.0,122,Device,,RUN CAPACITY LIMITED-LOW EVAP REFRIG TEMP,Oct 13 2023 10:11PM,False,True,True,,,,,,,ALARM_01,CH_ALARM_01,,,,AlertAlarm/5111Q21335/2023,5111Q21335,,America/New_York
258,2023-10-13T22:11:00,,,0.0,162,Device,,SENSOR ALERT-EVAPORATOR APPROACH,Oct 13 2023 10:11PM,False,True,True,,,,,,,ALARM_02,CH_ALARM_02,,,,AlertAlarm/5111Q21335/2023,5111Q21335,,America/New_York
259,2023-10-16T17:07:00,https://alarmssaveandnotifyprod.blob.core.windows.net/snapshot/vu210550101310_74/2023/10/16/17/7/VU210550101310_74_1697476050,,0.0,122,Device,,RUN CAPACITY LIMITED-LOW EVAP REFRIG TEMP,Oct 16 2023  5:07PM,False,True,False,,,,,,,ALARM_01,CH_ALARM_01,,,,AlertAlarm/5111Q21335/2023,5111Q21335,,America/New_York
260,2023-10-16T17:27:00,https://alarmssaveandnotifyprod.blob.core.windows.net/snapshot/vu210550101310_74/2023/10/16/17/27/VU210550101310_74_1697477259,,0.0,162,Device,,SENSOR ALERT-EVAPORATOR APPROACH,Oct 16 2023  5:27PM,False,True,False,,,,,,,ALARM_02,CH_ALARM_02,,,,AlertAlarm/5111Q21335/2023,5111Q21335,,America/New_York
261,,,,,2,Device,,,10/16/2023 1:31:25 PM -04:00,False,True,False,1.0,,,,,,SYS_ALM,SystemAlertAlarm,,,,AlertAlarm/5111Q21335/2023,5111Q21335,,America/New_York
262,2023-10-16T19:26:00,,,0.0,2,Device,,System Alert /Alarm,Oct 16 2023  7:26PM,False,False,True,,,,,,,SYS_ALM,SystemAlertAlarm,,,,AlertAlarm/5111Q21335/2023,5111Q21335,,America/New_York
263,2023-10-16T19:26:00,,,0.0,122,Device,,RUN CAPACITY LIMITED-LOW EVAP REFRIG TEMP,Oct 16 2023  7:26PM,False,True,True,,,,,,,ALARM_01,CH_ALARM_01,,,,AlertAlarm/5111Q21335/2023,5111Q21335,,America/New_York
264,2023-10-16T19:26:00,,,0.0,162,Device,,SENSOR ALERT-EVAPORATOR APPROACH,Oct 16 2023  7:26PM,False,True,True,,,,,,,ALARM_02,CH_ALARM_02,,,,AlertAlarm/5111Q21335/2023,5111Q21335,,America/New_York
265,,,,,2,Device,,,10/16/2023 3:31:25 PM -04:00,False,True,False,1.0,,,,,,SYS_ALM,SystemAlertAlarm,,,,AlertAlarm/5111Q21335/2023,5111Q21335,,America/New_York
266,2023-10-16T21:16:00,,,0.0,2,Device,,System Alert /Alarm,Oct 16 2023  9:16PM,False,False,True,,,,,,,SYS_ALM,SystemAlertAlarm,,,,AlertAlarm/5111Q21335/2023,5111Q21335,,America/New_York
267,2023-10-20T08:49:00,https://alarmssaveandnotifyprod.blob.core.windows.net/snapshot/vu210550101310_74/2023/10/20/8/49/VU210550101310_74_1697791747,,0.0,122,Device,,RUN CAPACITY LIMITED-LOW EVAP REFRIG TEMP,Oct 20 2023  8:49AM,False,True,False,,,,,,,ALARM_01,CH_ALARM_01,,,,AlertAlarm/5111Q21335/2023,5111Q21335,,America/New_York
268,,,,,2,Device,,,10/20/2023 4:25:55 AM -04:00,False,True,False,1.0,,,,,,SYS_ALM,SystemAlertAlarm,,,,AlertAlarm/5111Q21335/2023,5111Q21335,,America/New_York
269,2023-10-20T08:30:00,,,0.0,2,Device,,System Alert /Alarm,Oct 20 2023  8:30AM,False,False,True,,,,,,,SYS_ALM,SystemAlertAlarm,,,,AlertAlarm/5111Q21335/2023,5111Q21335,,America/New_York
270,2023-10-24T19:09:00,https://alarmssaveandnotifyprod.blob.core.windows.net/snapshot/vu210550101310_74/2023/10/24/19/9/VU210550101310_74_1698174591,,0.0,162,Device,,SENSOR ALERT-EVAPORATOR APPROACH,Oct 24 2023  7:09PM,False,True,False,,,,,,,ALARM_02,CH_ALARM_02,,,,AlertAlarm/5111Q21335/2023,5111Q21335,,America/New_York
271,,,,,2,Device,,,10/24/2023 3:14:35 PM -04:00,False,True,False,1.0,,,,,,SYS_ALM,SystemAlertAlarm,,,,AlertAlarm/5111Q21335/2023,5111Q21335,,America/New_York
272,,,,,2,Device,,,10/24/2023 8:24:36 PM -04:00,False,True,False,1.0,,,,,,SYS_ALM,SystemAlertAlarm,,,,AlertAlarm/5111Q21335/2023,5111Q21335,,America/New_York
273,2023-10-25T02:49:00,,,0.0,2,Device,,System Alert /Alarm,Oct 25 2023  2:49AM,False,False,True,,,,,,,SYS_ALM,SystemAlertAlarm,,,,AlertAlarm/5111Q21335/2023,5111Q21335,,America/New_York
274,2023-10-25T02:49:00,,,0.0,122,Device,,RUN CAPACITY LIMITED-LOW EVAP REFRIG TEMP,Oct 25 2023  2:49AM,False,True,True,,,,,,,ALARM_01,CH_ALARM_01,,,,AlertAlarm/5111Q21335/2023,5111Q21335,,America/New_York
275,2023-10-25T02:49:00,,,0.0,162,Device,,SENSOR ALERT-EVAPORATOR APPROACH,Oct 25 2023  2:49AM,False,True,True,,,,,,,ALARM_02,CH_ALARM_02,,,,AlertAlarm/5111Q21335/2023,5111Q21335,,America/New_York
276,2023-10-25T14:55:00,https://alarmssaveandnotifyprod.blob.core.windows.net/snapshot/vu210550101310_74/2023/10/25/14/55/VU210550101310_74_1698245723,,0.0,162,Device,,SENSOR ALERT-EVAPORATOR APPROACH,Oct 25 2023  2:55PM,False,True,False,,,,,,,ALARM_01,CH_ALARM_01,,,,AlertAlarm/5111Q21335/2023,5111Q21335,,America/New_York
277,2023-10-25T15:00:00,https://alarmssaveandnotifyprod.blob.core.windows.net/snapshot/vu210550101310_74/2023/10/25/15/0/VU210550101310_74_1698246026,,0.0,122,Device,,RUN CAPACITY LIMITED-LOW EVAP REFRIG TEMP,Oct 25 2023  3:00PM,False,True,False,,,,,,,ALARM_02,CH_ALARM_02,,,,AlertAlarm/5111Q21335/2023,5111Q21335,,America/New_York
278,,,,,2,Device,,,10/25/2023 11:00:42 AM -04:00,False,True,False,1.0,,,,,,SYS_ALM,SystemAlertAlarm,,,,AlertAlarm/5111Q21335/2023,5111Q21335,,America/New_York
279,2023-10-26T16:27:00,,,0.0,2,Device,,System Alert /Alarm,Oct 26 2023  4:27PM,False,False,True,,,,,,,SYS_ALM,SystemAlertAlarm,,,,AlertAlarm/5111Q21335/2023,5111Q21335,,America/New_York
280,2023-10-26T16:27:00,,,0.0,122,Device,,RUN CAPACITY LIMITED-LOW EVAP REFRIG TEMP,Oct 26 2023  4:27PM,False,True,True,,,,,,,ALARM_02,CH_ALARM_02,,,,AlertAlarm/5111Q21335/2023,5111Q21335,,America/New_York
281,2023-10-26T16:55:00,https://alarmssaveandnotifyprod.blob.core.windows.net/snapshot/vu210550101310_74/2023/10/27/10/56/VU210550101310_74_1698339355,,0.0,122,Device,,RUN CAPACITY LIMITED-LOW EVAP REFRIG TEMP,Oct 26 2023  4:55PM,False,True,False,,,,,,,ALARM_02,CH_ALARM_02,,,,AlertAlarm/5111Q21335/2023,5111Q21335,,America/New_York
282,2023-10-25T18:25:00,,,0.0,162,Device,,SENSOR ALERT-EVAPORATOR APPROACH,Oct 25 2023  6:25PM,False,True,True,,,,,,,ALARM_01,CH_ALARM_01,,,,AlertAlarm/5111Q21335/2023,5111Q21335,,America/New_York
283,,,,,2,Device,,,10/25/2023 2:35:43 PM -04:00,False,True,False,1.0,,,,,,SYS_ALM,SystemAlertAlarm,,,,AlertAlarm/5111Q21335/2023,5111Q21335,,America/New_York
284,,,,,2,Device,,,10/25/2023 3:40:43 PM -04:00,False,True,False,1.0,,,,,,SYS_ALM,SystemAlertAlarm,,,,AlertAlarm/5111Q21335/2023,5111Q21335,,America/New_York
285,,,,,2,Device,,,10/26/2023 12:28:54 PM -04:00,False,True,False,1.0,,,,,,SYS_ALM,SystemAlertAlarm,,,,AlertAlarm/5111Q21335/2023,5111Q21335,,America/New_York
286,2023-10-26T20:58:00,,,0.0,2,Device,,System Alert /Alarm,Oct 26 2023  8:58PM,False,False,True,,,,,,,SYS_ALM,SystemAlertAlarm,,,,AlertAlarm/5111Q21335/2023,5111Q21335,,America/New_York
287,2023-10-26T20:58:00,,,0.0,122,Device,,RUN CAPACITY LIMITED-LOW EVAP REFRIG TEMP,Oct 26 2023  8:58PM,False,True,True,,,,,,,ALARM_02,CH_ALARM_02,,,,AlertAlarm/5111Q21335/2023,5111Q21335,,America/New_York
288,2023-10-27T17:41:00,https://alarmssaveandnotifyprod.blob.core.windows.net/snapshot/vu210550101310_74/2023/10/27/17/41/VU210550101310_74_1698428495,,0.0,162,Device,,SENSOR ALERT-EVAPORATOR APPROACH,Oct 27 2023  5:41PM,False,True,False,,,,,,,ALARM_01,CH_ALARM_01,,,,AlertAlarm/5111Q21335/2023,5111Q21335,,America/New_York
289,,,,,2,Device,,,10/27/2023 1:45:37 PM -04:00,False,True,False,1.0,,,,,,SYS_ALM,SystemAlertAlarm,,,,AlertAlarm/5111Q21335/2023,5111Q21335,,America/New_York
290,2023-10-27T18:02:00,,,0.0,2,Device,,System Alert /Alarm,Oct 27 2023  6:02PM,False,False,True,,,,,,,SYS_ALM,SystemAlertAlarm,,,,AlertAlarm/5111Q21335/2023,5111Q21335,,America/New_York
291,2023-10-27T18:02:00,https://alarmssaveandnotifyprod.blob.core.windows.net/snapshot/vu210550101310_74/2023/10/27/18/2/VU210550101310_74_1698429754,,0.0,122,Device,,RUN CAPACITY LIMITED-LOW EVAP REFRIG TEMP,Oct 27 2023  6:02PM,False,True,False,,,,,,,ALARM_02,CH_ALARM_02,,,,AlertAlarm/5111Q21335/2023,5111Q21335,,America/New_York
292,2023-10-27T21:10:00,,,0.0,162,Device,,SENSOR ALERT-EVAPORATOR APPROACH,Oct 27 2023  9:10PM,False,True,True,,,,,,,ALARM_01,CH_ALARM_01,,,,AlertAlarm/5111Q21335/2023,5111Q21335,,America/New_York
293,2023-10-27T21:10:00,,,0.0,122,Device,,RUN CAPACITY LIMITED-LOW EVAP REFRIG TEMP,Oct 27 2023  9:10PM,False,True,True,,,,,,,ALARM_02,CH_ALARM_02,,,,AlertAlarm/5111Q21335/2023,5111Q21335,,America/New_York
294,2023-10-28T17:04:00,https://alarmssaveandnotifyprod.blob.core.windows.net/snapshot/vu210550101310_74/2023/10/28/17/4/VU210550101310_74_1698512696,,0.0,162,Device,,SENSOR ALERT-EVAPORATOR APPROACH,Oct 28 2023  5:04PM,False,True,False,,,,,,,ALARM_01,CH_ALARM_01,,,,AlertAlarm/5111Q21335/2023,5111Q21335,,America/New_York
295,,,,,2,Device,,,10/28/2023 1:07:18 PM -04:00,False,True,False,1.0,,,,,,SYS_ALM,SystemAlertAlarm,,,,AlertAlarm/5111Q21335/2023,5111Q21335,,America/New_York
296,2023-10-28T18:10:00,,,0.0,2,Device,,System Alert /Alarm,Oct 28 2023  6:10PM,False,False,True,,,,,,,SYS_ALM,SystemAlertAlarm,,,,AlertAlarm/5111Q21335/2023,5111Q21335,,America/New_York
297,2023-10-28T18:10:00,https://alarmssaveandnotifyprod.blob.core.windows.net/snapshot/vu210550101310_74/2023/10/28/18/10/VU210550101310_74_1698516628,,0.0,122,Device,,RUN CAPACITY LIMITED-LOW EVAP REFRIG TEMP,Oct 28 2023  6:10PM,False,True,False,,,,,,,ALARM_02,CH_ALARM_02,,,,AlertAlarm/5111Q21335/2023,5111Q21335,,America/New_York
298,2023-10-28T18:27:00,,,0.0,162,Device,,SENSOR ALERT-EVAPORATOR APPROACH,Oct 28 2023  6:27PM,False,True,True,,,,,,,ALARM_01,CH_ALARM_01,,,,AlertAlarm/5111Q21335/2023,5111Q21335,,America/New_York
299,2023-10-28T18:27:00,,,0.0,122,Device,,RUN CAPACITY LIMITED-LOW EVAP REFRIG TEMP,Oct 28 2023  6:27PM,False,True,True,,,,,,,ALARM_02,CH_ALARM_02,,,,AlertAlarm/5111Q21335/2023,5111Q21335,,America/New_York
300,2023-10-30T18:00:00,https://alarmssaveandnotifyprod.blob.core.windows.net/snapshot/vu210550101310_74/2023/10/31/20/23/VU210550101310_74_1698688846,,0.0,122,Device,,RUN CAPACITY LIMITED-LOW EVAP REFRIG TEMP,Oct 30 2023  6:00PM,False,True,False,,,,,,,ALARM_01,CH_ALARM_01,,,,AlertAlarm/5111Q21335/2023,5111Q21335,,America/New_York
301,,,,,2,Device,,,11/7/2023 5:12:35 AM -05:00,False,True,False,1.0,,,,,,SYS_ALM,SystemAlertAlarm,,,,AlertAlarm/5111Q21335/2023,5111Q21335,,America/New_York
302,2023-11-07T10:34:00,,,0.0,2,Device,,System Alert /Alarm,Nov  7 2023 10:34AM,False,False,True,,,,,,,SYS_ALM,SystemAlertAlarm,,,,AlertAlarm/5111Q21335/2023,5111Q21335,,America/New_York
303,2023-11-07T10:46:00,https://alarmssaveandnotifyprod.blob.core.windows.net/snapshot/vu210550101310_74/2023/11/7/10/46/VU210550101310_74_1699353995,,0.0,162,Device,,SENSOR ALERT-EVAPORATOR APPROACH,Nov  7 2023 10:46AM,False,True,False,,,,,,,ALARM_02,CH_ALARM_02,,,,AlertAlarm/5111Q21335/2023,5111Q21335,,America/New_York
304,2023-11-07T19:07:00,,,0.0,122,Device,,RUN CAPACITY LIMITED-LOW EVAP REFRIG TEMP,Nov  7 2023  7:07PM,False,True,True,,,,,,,ALARM_01,CH_ALARM_01,,,,AlertAlarm/5111Q21335/2023,5111Q21335,,America/New_York
305,2023-11-07T19:07:00,,,0.0,162,Device,,SENSOR ALERT-EVAPORATOR APPROACH,Nov  7 2023  7:07PM,False,True,True,,,,,,,ALARM_02,CH_ALARM_02,,,,AlertAlarm/5111Q21335/2023,5111Q21335,,America/New_York
306,,,,,2,Device,,,11/7/2023 2:12:37 PM -05:00,False,True,False,1.0,,,,,,SYS_ALM,SystemAlertAlarm,,,,AlertAlarm/5111Q21335/2023,5111Q21335,,America/New_York
307,2023-11-07T19:52:00,,,0.0,2,Device,,System Alert /Alarm,Nov  7 2023  7:52PM,False,False,True,,,,,,,SYS_ALM,SystemAlertAlarm,,,,AlertAlarm/5111Q21335/2023,5111Q21335,,America/New_York
308,,,,,2,Device,,,11/10/2023 12:42:53 PM -05:00,False,True,False,1.0,,,,,,SYS_ALM,SystemAlertAlarm,,,,AlertAlarm/5111Q21335/2023,5111Q21335,,America/New_York
309,2023-11-10T18:27:00,,,0.0,2,Device,,System Alert /Alarm,Nov 10 2023  6:27PM,False,False,True,,,,,,,SYS_ALM,SystemAlertAlarm,,,,AlertAlarm/5111Q21335/2023,5111Q21335,,America/New_York
310,,,,,2,Device,,,11/10/2023 1:37:53 PM -05:00,False,True,False,1.0,,,,,,SYS_ALM,SystemAlertAlarm,,,,AlertAlarm/5111Q21335/2023,5111Q21335,,America/New_York
311,2023-11-10T19:07:00,,,0.0,2,Device,,System Alert /Alarm,Nov 10 2023  7:07PM,False,False,True,,,,,,,SYS_ALM,SystemAlertAlarm,,,,AlertAlarm/5111Q21335/2023,5111Q21335,,America/New_York
312,,,,,2,Device,,,11/10/2023 2:12:53 PM -05:00,False,True,False,1.0,,,,,,SYS_ALM,SystemAlertAlarm,,,,AlertAlarm/5111Q21335/2023,5111Q21335,,America/New_York
313,,,,,2,Device,,,11/10/2023 2:47:53 PM -05:00,False,True,False,1.0,,,,,,SYS_ALM,SystemAlertAlarm,,,,AlertAlarm/5111Q21335/2023,5111Q21335,,America/New_York
314,2023-11-10T19:52:00,,,0.0,2,Device,,System Alert /Alarm,Nov 10 2023  7:52PM,False,False,True,,,,,,,SYS_ALM,SystemAlertAlarm,,,,AlertAlarm/5111Q21335/2023,5111Q21335,,America/New_York
315,,,,,2,Device,,,11/10/2023 3:07:53 PM -05:00,False,True,False,1.0,,,,,,SYS_ALM,SystemAlertAlarm,,,,AlertAlarm/5111Q21335/2023,5111Q21335,,America/New_York
316,2023-11-10T20:42:00,,,0.0,2,Device,,System Alert /Alarm,Nov 10 2023  8:42PM,False,False,True,,,,,,,SYS_ALM,SystemAlertAlarm,,,,AlertAlarm/5111Q21335/2023,5111Q21335,,America/New_York
317,,,,,2,Device,,,11/10/2023 3:52:53 PM -05:00,False,True,False,1.0,,,,,,SYS_ALM,SystemAlertAlarm,,,,AlertAlarm/5111Q21335/2023,5111Q21335,,America/New_York
318,2023-11-10T20:57:00,,,0.0,2,Device,,System Alert /Alarm,Nov 10 2023  8:57PM,False,False,True,,,,,,,SYS_ALM,SystemAlertAlarm,,,,AlertAlarm/5111Q21335/2023,5111Q21335,,America/New_York
319,,,,,2,Device,,,11/10/2023 4:02:53 PM -05:00,False,True,False,1.0,,,,,,SYS_ALM,SystemAlertAlarm,,,,AlertAlarm/5111Q21335/2023,5111Q21335,,America/New_York
320,2023-11-11T06:47:00,,,0.0,2,Device,,System Alert /Alarm,Nov 11 2023  6:47AM,False,False,True,,,,,,,SYS_ALM,SystemAlertAlarm,,,,AlertAlarm/5111Q21335/2023,5111Q21335,,America/New_York
321,,,,,2,Device,,,11/11/2023 2:22:56 AM -05:00,False,True,False,1.0,,,,,,SYS_ALM,SystemAlertAlarm,,,,AlertAlarm/5111Q21335/2023,5111Q21335,,America/New_York
322,2023-11-11T07:27:00,,,0.0,2,Device,,System Alert /Alarm,Nov 11 2023  7:27AM,False,False,True,,,,,,,SYS_ALM,SystemAlertAlarm,,,,AlertAlarm/5111Q21335/2023,5111Q21335,,America/New_York
323,,,,,2,Device,,,11/11/2023 2:32:56 AM -05:00,False,True,False,1.0,,,,,,SYS_ALM,SystemAlertAlarm,,,,AlertAlarm/5111Q21335/2023,5111Q21335,,America/New_York
324,2023-11-11T08:24:00,,,0.0,2,Device,,System Alert /Alarm,Nov 11 2023  8:24AM,False,False,True,,,,,,,SYS_ALM,SystemAlertAlarm,,,,AlertAlarm/5111Q21335/2023,5111Q21335,,America/New_York
325,2023-11-11T08:24:00,https://alarmssaveandnotifyprod.blob.core.windows.net/snapshot/vu210550101310_74/2023/11/11/8/24/VU210550101310_74_1699691043,,0.0,122,Device,,RUN CAPACITY LIMITED-LOW EVAP REFRIG TEMP,Nov 11 2023  8:24AM,False,True,False,,,,,,,ALARM_01,CH_ALARM_01,,,,AlertAlarm/5111Q21335/2023,5111Q21335,,America/New_York
326,2023-11-11T08:24:00,https://alarmssaveandnotifyprod.blob.core.windows.net/snapshot/vu210550101310_74/2023/11/11/8/24/VU210550101310_74_1699691043,,0.0,162,Device,,SENSOR ALERT-EVAPORATOR APPROACH,Nov 11 2023  8:24AM,False,True,False,,,,,,,ALARM_02,CH_ALARM_02,,,,AlertAlarm/5111Q21335/2023,5111Q21335,,America/New_York
327,2023-11-11T09:22:00,,,0.0,122,Device,,RUN CAPACITY LIMITED-LOW EVAP REFRIG TEMP,Nov 11 2023  9:22AM,False,True,True,,,,,,,ALARM_01,CH_ALARM_01,,,,AlertAlarm/5111Q21335/2023,5111Q21335,,America/New_York
328,2023-11-11T09:22:00,,,0.0,162,Device,,SENSOR ALERT-EVAPORATOR APPROACH,Nov 11 2023  9:22AM,False,True,True,,,,,,,ALARM_02,CH_ALARM_02,,,,AlertAlarm/5111Q21335/2023,5111Q21335,,America/New_York
329,,,,,2,Device,,,11/11/2023 6:12:57 AM -05:00,False,True,False,1.0,,,,,,SYS_ALM,SystemAlertAlarm,,,,AlertAlarm/5111Q21335/2023,5111Q21335,,America/New_York
330,2023-11-11T13:12:00,,,0.0,2,Device,,System Alert /Alarm,Nov 11 2023  1:12PM,False,False,True,,,,,,,SYS_ALM,SystemAlertAlarm,,,,AlertAlarm/5111Q21335/2023,5111Q21335,,America/New_York
331,,,,,2,Device,,,11/11/2023 12:17:58 PM -05:00,False,True,False,1.0,,,,,,SYS_ALM,SystemAlertAlarm,,,,AlertAlarm/5111Q21335/2023,5111Q21335,,America/New_York
332,2023-11-11T17:22:00,,,0.0,2,Device,,System Alert /Alarm,Nov 11 2023  5:22PM,False,False,True,,,,,,,SYS_ALM,SystemAlertAlarm,,,,AlertAlarm/5111Q21335/2023,5111Q21335,,America/New_York
333,,,,,2,Device,,,11/11/2023 12:32:58 PM -05:00,False,True,False,1.0,,,,,,SYS_ALM,SystemAlertAlarm,,,,AlertAlarm/5111Q21335/2023,5111Q21335,,America/New_York
334,2023-11-11T17:37:00,,,0.0,2,Device,,System Alert /Alarm,Nov 11 2023  5:37PM,False,False,True,,,,,,,SYS_ALM,SystemAlertAlarm,,,,AlertAlarm/5111Q21335/2023,5111Q21335,,America/New_York
335,,,,,2,Device,,,11/11/2023 12:57:58 PM -05:00,False,True,False,1.0,,,,,,SYS_ALM,SystemAlertAlarm,,,,AlertAlarm/5111Q21335/2023,5111Q21335,,America/New_York
336,2023-11-11T18:12:00,,,0.0,2,Device,,System Alert /Alarm,Nov 11 2023  6:12PM,False,False,True,,,,,,,SYS_ALM,SystemAlertAlarm,,,,AlertAlarm/5111Q21335/2023,5111Q21335,,America/New_York
337,,,,,2,Device,,,11/11/2023 1:17:58 PM -05:00,False,True,False,1.0,,,,,,SYS_ALM,SystemAlertAlarm,,,,AlertAlarm/5111Q21335/2023,5111Q21335,,America/New_York
338,2023-11-11T18:27:00,,,0.0,2,Device,,System Alert /Alarm,Nov 11 2023  6:27PM,False,False,True,,,,,,,SYS_ALM,SystemAlertAlarm,,,,AlertAlarm/5111Q21335/2023,5111Q21335,,America/New_York
339,,,,,2,Device,,,11/11/2023 1:32:58 PM -05:00,False,True,False,1.0,,,,,,SYS_ALM,SystemAlertAlarm,,,,AlertAlarm/5111Q21335/2023,5111Q21335,,America/New_York
340,2023-11-11T18:37:00,,,0.0,2,Device,,System Alert /Alarm,Nov 11 2023  6:37PM,False,False,True,,,,,,,SYS_ALM,SystemAlertAlarm,,,,AlertAlarm/5111Q21335/2023,5111Q21335,,America/New_York
341,,,,,2,Device,,,11/11/2023 3:07:59 PM -05:00,False,True,False,1.0,,,,,,SYS_ALM,SystemAlertAlarm,,,,AlertAlarm/5111Q21335/2023,5111Q21335,,America/New_York
342,2023-11-11T20:12:00,,,0.0,2,Device,,System Alert /Alarm,Nov 11 2023  8:12PM,False,False,True,,,,,,,SYS_ALM,SystemAlertAlarm,,,,AlertAlarm/5111Q21335/2023,5111Q21335,,America/New_York
343,,,,,2,Device,,,11/11/2023 3:17:59 PM -05:00,False,True,False,1.0,,,,,,SYS_ALM,SystemAlertAlarm,,,,AlertAlarm/5111Q21335/2023,5111Q21335,,America/New_York
344,2023-11-11T20:27:00,,,0.0,2,Device,,System Alert /Alarm,Nov 11 2023  8:27PM,False,False,True,,,,,,,SYS_ALM,SystemAlertAlarm,,,,AlertAlarm/5111Q21335/2023,5111Q21335,,America/New_York
345,,,,,2,Device,,,11/11/2023 3:42:59 PM -05:00,False,True,False,1.0,,,,,,SYS_ALM,SystemAlertAlarm,,,,AlertAlarm/5111Q21335/2023,5111Q21335,,America/New_York
346,2023-11-11T21:07:00,,,0.0,2,Device,,System Alert /Alarm,Nov 11 2023  9:07PM,False,False,True,,,,,,,SYS_ALM,SystemAlertAlarm,,,,AlertAlarm/5111Q21335/2023,5111Q21335,,America/New_York
347,,,,,2,Device,,,11/11/2023 4:42:59 PM -05:00,False,True,False,1.0,,,,,,SYS_ALM,SystemAlertAlarm,,,,AlertAlarm/5111Q21335/2023,5111Q21335,,America/New_York
348,2023-11-11T22:57:00,,,0.0,2,Device,,System Alert /Alarm,Nov 11 2023 10:57PM,False,False,True,,,,,,,SYS_ALM,SystemAlertAlarm,,,,AlertAlarm/5111Q21335/2023,5111Q21335,,America/New_York
349,,,,,2,Device,,,11/11/2023 6:17:59 PM -05:00,False,True,False,1.0,,,,,,SYS_ALM,SystemAlertAlarm,,,,AlertAlarm/5111Q21335/2023,5111Q21335,,America/New_York
350,2023-11-12T21:33:00,,,0.0,2,Device,,System Alert /Alarm,Nov 12 2023  9:33PM,False,False,True,,,,,,,SYS_ALM,SystemAlertAlarm,,,,AlertAlarm/5111Q21335/2023,5111Q21335,,America/New_York
351,,,,,2,Device,,,11/12/2023 4:48:04 PM -05:00,False,True,False,1.0,,,,,,SYS_ALM,SystemAlertAlarm,,,,AlertAlarm/5111Q21335/2023,5111Q21335,,America/New_York
352,2023-11-13T13:48:00,,,0.0,2,Device,,System Alert /Alarm,Nov 13 2023  1:48PM,False,False,True,,,,,,,SYS_ALM,SystemAlertAlarm,,,,AlertAlarm/5111Q21335/2023,5111Q21335,,America/New_York
353,,,,,2,Device,,,11/13/2023 9:18:08 AM -05:00,False,True,False,1.0,,,,,,SYS_ALM,SystemAlertAlarm,,,,AlertAlarm/5111Q21335/2023,5111Q21335,,America/New_York
354,2023-11-13T22:33:00,,,0.0,2,Device,,System Alert /Alarm,Nov 13 2023 10:33PM,False,False,True,,,,,,,SYS_ALM,SystemAlertAlarm,,,,AlertAlarm/5111Q21335/2023,5111Q21335,,America/New_York
355,,,,,2,Device,,,11/13/2023 6:33:10 PM -05:00,False,True,False,1.0,,,,,,SYS_ALM,SystemAlertAlarm,,,,AlertAlarm/5111Q21335/2023,5111Q21335,,America/New_York
356,2023-11-14T11:28:00,,,0.0,2,Device,,System Alert /Alarm,Nov 14 2023 11:28AM,False,False,True,,,,,,,SYS_ALM,SystemAlertAlarm,,,,AlertAlarm/5111Q21335/2023,5111Q21335,,America/New_York
357,,,,,2,Device,,,11/14/2023 6:33:12 AM -05:00,False,True,False,1.0,,,,,,SYS_ALM,SystemAlertAlarm,,,,AlertAlarm/5111Q21335/2023,5111Q21335,,America/New_York
358,2023-11-14T11:58:00,,,0.0,2,Device,,System Alert /Alarm,Nov 14 2023 11:58AM,False,False,True,,,,,,,SYS_ALM,SystemAlertAlarm,,,,AlertAlarm/5111Q21335/2023,5111Q21335,,America/New_York
359,,,,,2,Device,,,11/14/2023 7:03:12 AM -05:00,False,True,False,1.0,,,,,,SYS_ALM,SystemAlertAlarm,,,,AlertAlarm/5111Q21335/2023,5111Q21335,,America/New_York
360,2023-11-14T13:43:00,,,0.0,2,Device,,System Alert /Alarm,Nov 14 2023  1:43PM,False,False,True,,,,,,,SYS_ALM,SystemAlertAlarm,,,,AlertAlarm/5111Q21335/2023,5111Q21335,,America/New_York
361,,,,,2,Device,,,11/14/2023 8:48:12 AM -05:00,False,True,False,1.0,,,,,,SYS_ALM,SystemAlertAlarm,,,,AlertAlarm/5111Q21335/2023,5111Q21335,,America/New_York
362,2023-11-14T13:58:00,,,0.0,2,Device,,System Alert /Alarm,Nov 14 2023  1:58PM,False,False,True,,,,,,,SYS_ALM,SystemAlertAlarm,,,,AlertAlarm/5111Q21335/2023,5111Q21335,,America/New_York
363,,,,,2,Device,,,11/14/2023 9:08:12 AM -05:00,False,True,False,1.0,,,,,,SYS_ALM,SystemAlertAlarm,,,,AlertAlarm/5111Q21335/2023,5111Q21335,,America/New_York
364,2023-11-14T14:23:00,,,0.0,2,Device,,System Alert /Alarm,Nov 14 2023  2:23PM,False,False,True,,,,,,,SYS_ALM,SystemAlertAlarm,,,,AlertAlarm/5111Q21335/2023,5111Q21335,,America/New_York
365,,,,,2,Device,,,11/14/2023 9:28:13 AM -05:00,False,True,False,1.0,,,,,,SYS_ALM,SystemAlertAlarm,,,,AlertAlarm/5111Q21335/2023,5111Q21335,,America/New_York
366,2023-11-14T14:33:00,,,0.0,2,Device,,System Alert /Alarm,Nov 14 2023  2:33PM,False,False,True,,,,,,,SYS_ALM,SystemAlertAlarm,,,,AlertAlarm/5111Q21335/2023,5111Q21335,,America/New_York
367,,,,,2,Device,,,11/14/2023 9:38:13 AM -05:00,False,True,False,1.0,,,,,,SYS_ALM,SystemAlertAlarm,,,,AlertAlarm/5111Q21335/2023,5111Q21335,,America/New_York
368,2023-11-14T14:48:00,,,0.0,2,Device,,System Alert /Alarm,Nov 14 2023  2:48PM,False,False,True,,,,,,,SYS_ALM,SystemAlertAlarm,,,,AlertAlarm/5111Q21335/2023,5111Q21335,,America/New_York
369,,,,,2,Device,,,11/14/2023 9:53:13 AM -05:00,False,True,False,1.0,,,,,,SYS_ALM,SystemAlertAlarm,,,,AlertAlarm/5111Q21335/2023,5111Q21335,,America/New_York
370,2023-11-14T15:18:00,,,0.0,2,Device,,System Alert /Alarm,Nov 14 2023  3:18PM,False,False,True,,,,,,,SYS_ALM,SystemAlertAlarm,,,,AlertAlarm/5111Q21335/2023,5111Q21335,,America/New_York
371,,,,,2,Device,,,11/14/2023 10:48:13 AM -05:00,False,True,False,1.0,,,,,,SYS_ALM,SystemAlertAlarm,,,,AlertAlarm/5111Q21335/2023,5111Q21335,,America/New_York
372,2023-11-14T15:53:00,,,0.0,2,Device,,System Alert /Alarm,Nov 14 2023  3:53PM,False,False,True,,,,,,,SYS_ALM,SystemAlertAlarm,,,,AlertAlarm/5111Q21335/2023,5111Q21335,,America/New_York
373,,,,,2,Device,,,11/14/2023 10:58:13 AM -05:00,False,True,False,1.0,,,,,,SYS_ALM,SystemAlertAlarm,,,,AlertAlarm/5111Q21335/2023,5111Q21335,,America/New_York
374,2023-11-14T16:03:00,,,0.0,2,Device,,System Alert /Alarm,Nov 14 2023  4:03PM,False,False,True,,,,,,,SYS_ALM,SystemAlertAlarm,,,,AlertAlarm/5111Q21335/2023,5111Q21335,,America/New_York
375,,,,,2,Device,,,11/14/2023 11:08:13 AM -05:00,False,True,False,1.0,,,,,,SYS_ALM,SystemAlertAlarm,,,,AlertAlarm/5111Q21335/2023,5111Q21335,,America/New_York
376,2023-11-14T17:23:00,,,0.0,2,Device,,System Alert /Alarm,Nov 14 2023  5:23PM,False,False,True,,,,,,,SYS_ALM,SystemAlertAlarm,,,,AlertAlarm/5111Q21335/2023,5111Q21335,,America/New_York
377,,,,,2,Device,,,11/14/2023 12:28:13 PM -05:00,False,True,False,1.0,,,,,,SYS_ALM,SystemAlertAlarm,,,,AlertAlarm/5111Q21335/2023,5111Q21335,,America/New_York
378,2023-11-14T18:33:00,,,0.0,2,Device,,System Alert /Alarm,Nov 14 2023  6:33PM,False,False,True,,,,,,,SYS_ALM,SystemAlertAlarm,,,,AlertAlarm/5111Q21335/2023,5111Q21335,,America/New_York
379,,,,,2,Device,,,11/14/2023 1:38:13 PM -05:00,False,True,False,1.0,,,,,,SYS_ALM,SystemAlertAlarm,,,,AlertAlarm/5111Q21335/2023,5111Q21335,,America/New_York
380,2023-11-14T19:18:00,,,0.0,2,Device,,System Alert /Alarm,Nov 14 2023  7:18PM,False,False,True,,,,,,,SYS_ALM,SystemAlertAlarm,,,,AlertAlarm/5111Q21335/2023,5111Q21335,,America/New_York
381,,,,,2,Device,,,11/14/2023 2:38:14 PM -05:00,False,True,False,1.0,,,,,,SYS_ALM,SystemAlertAlarm,,,,AlertAlarm/5111Q21335/2023,5111Q21335,,America/New_York
382,2023-11-14T21:03:00,,,0.0,2,Device,,System Alert /Alarm,Nov 14 2023  9:03PM,False,False,True,,,,,,,SYS_ALM,SystemAlertAlarm,,,,AlertAlarm/5111Q21335/2023,5111Q21335,,America/New_York
383,,,,,2,Device,,,11/14/2023 4:08:14 PM -05:00,False,True,False,1.0,,,,,,SYS_ALM,SystemAlertAlarm,,,,AlertAlarm/5111Q21335/2023,5111Q21335,,America/New_York
384,2023-11-14T22:33:00,,,0.0,2,Device,,System Alert /Alarm,Nov 14 2023 10:33PM,False,False,True,,,,,,,SYS_ALM,SystemAlertAlarm,,,,AlertAlarm/5111Q21335/2023,5111Q21335,,America/New_York
385,,,,,2,Device,,,11/14/2023 6:13:14 PM -05:00,False,True,False,1.0,,,,,,SYS_ALM,SystemAlertAlarm,,,,AlertAlarm/5111Q21335/2023,5111Q21335,,America/New_York
386,2023-11-15T01:18:00,,,0.0,2,Device,,System Alert /Alarm,Nov 15 2023  1:18AM,False,False,True,,,,,,,SYS_ALM,SystemAlertAlarm,,,,AlertAlarm/5111Q21335/2023,5111Q21335,,America/New_York
387,,,,,2,Device,,,11/14/2023 8:33:15 PM -05:00,False,True,False,1.0,,,,,,SYS_ALM,SystemAlertAlarm,,,,AlertAlarm/5111Q21335/2023,5111Q21335,,America/New_York
388,2023-11-15T04:53:00,,,0.0,2,Device,,System Alert /Alarm,Nov 15 2023  4:53AM,False,False,True,,,,,,,SYS_ALM,SystemAlertAlarm,,,,AlertAlarm/5111Q21335/2023,5111Q21335,,America/New_York
389,,,,,2,Device,,,11/14/2023 11:58:16 PM -05:00,False,True,False,1.0,,,,,,SYS_ALM,SystemAlertAlarm,,,,AlertAlarm/5111Q21335/2023,5111Q21335,,America/New_York
390,2023-11-15T07:28:00,,,0.0,2,Device,,System Alert /Alarm,Nov 15 2023  7:28AM,False,False,True,,,,,,,SYS_ALM,SystemAlertAlarm,,,,AlertAlarm/5111Q21335/2023,5111Q21335,,America/New_York
391,,,,,2,Device,,,11/15/2023 2:43:16 AM -05:00,False,True,False,1.0,,,,,,SYS_ALM,SystemAlertAlarm,,,,AlertAlarm/5111Q21335/2023,5111Q21335,,America/New_York
392,2023-11-15T14:03:00,,,0.0,2,Device,,System Alert /Alarm,Nov 15 2023  2:03PM,False,False,True,,,,,,,SYS_ALM,SystemAlertAlarm,,,,AlertAlarm/5111Q21335/2023,5111Q21335,,America/New_York
393,,,,,2,Device,,,11/15/2023 9:08:18 AM -05:00,False,True,False,1.0,,,,,,SYS_ALM,SystemAlertAlarm,,,,AlertAlarm/5111Q21335/2023,5111Q21335,,America/New_York
394,,,,,2,Device,,,11/15/2023 9:58:18 AM -05:00,False,True,False,1.0,,,,,,SYS_ALM,SystemAlertAlarm,,,,AlertAlarm/5111Q21335/2023,5111Q21335,,America/New_York
395,2023-11-15T15:18:00,,,0.0,2,Device,,System Alert /Alarm,Nov 15 2023  3:18PM,False,False,True,,,,,,,SYS_ALM,SystemAlertAlarm,,,,AlertAlarm/5111Q21335/2023,5111Q21335,,America/New_York
396,,,,,2,Device,,,11/15/2023 10:28:18 AM -05:00,False,True,False,1.0,,,,,,SYS_ALM,SystemAlertAlarm,,,,AlertAlarm/5111Q21335/2023,5111Q21335,,America/New_York
397,2023-11-15T16:08:00,,,0.0,2,Device,,System Alert /Alarm,Nov 15 2023  4:08PM,False,False,True,,,,,,,SYS_ALM,SystemAlertAlarm,,,,AlertAlarm/5111Q21335/2023,5111Q21335,,America/New_York
398,,,,,2,Device,,,11/15/2023 11:13:18 AM -05:00,False,True,False,1.0,,,,,,SYS_ALM,SystemAlertAlarm,,,,AlertAlarm/5111Q21335/2023,5111Q21335,,America/New_York
399,2023-11-15T16:38:00,,,0.0,2,Device,,System Alert /Alarm,Nov 15 2023  4:38PM,False,False,True,,,,,,,SYS_ALM,SystemAlertAlarm,,,,AlertAlarm/5111Q21335/2023,5111Q21335,,America/New_York
400,,,,,2,Device,,,11/15/2023 12:33:18 PM -05:00,False,True,False,1.0,,,,,,SYS_ALM,SystemAlertAlarm,,,,AlertAlarm/5111Q21335/2023,5111Q21335,,America/New_York
401,2023-11-15T17:53:00,,,0.0,2,Device,,System Alert /Alarm,Nov 15 2023  5:53PM,False,False,True,,,,,,,SYS_ALM,SystemAlertAlarm,,,,AlertAlarm/5111Q21335/2023,5111Q21335,,America/New_York
402,,,,,2,Device,,,11/15/2023 1:03:18 PM -05:00,False,True,False,1.0,,,,,,SYS_ALM,SystemAlertAlarm,,,,AlertAlarm/5111Q21335/2023,5111Q21335,,America/New_York
403,2023-11-15T20:08:00,,,0.0,2,Device,,System Alert /Alarm,Nov 15 2023  8:08PM,False,False,True,,,,,,,SYS_ALM,SystemAlertAlarm,,,,AlertAlarm/5111Q21335/2023,5111Q21335,,America/New_York
404,,,,,2,Device,,,11/15/2023 3:13:19 PM -05:00,False,True,False,1.0,,,,,,SYS_ALM,SystemAlertAlarm,,,,AlertAlarm/5111Q21335/2023,5111Q21335,,America/New_York
405,2023-11-15T21:08:00,,,0.0,2,Device,,System Alert /Alarm,Nov 15 2023  9:08PM,False,False,True,,,,,,,SYS_ALM,SystemAlertAlarm,,,,AlertAlarm/5111Q21335/2023,5111Q21335,,America/New_York
406,,,,,2,Device,,,11/15/2023 4:18:19 PM -05:00,False,True,False,1.0,,,,,,SYS_ALM,SystemAlertAlarm,,,,AlertAlarm/5111Q21335/2023,5111Q21335,,America/New_York
407,2023-11-15T22:18:00,,,0.0,2,Device,,System Alert /Alarm,Nov 15 2023 10:18PM,False,False,True,,,,,,,SYS_ALM,SystemAlertAlarm,,,,AlertAlarm/5111Q21335/2023,5111Q21335,,America/New_York
408,,,,,2,Device,,,11/15/2023 5:23:19 PM -05:00,False,True,False,1.0,,,,,,SYS_ALM,SystemAlertAlarm,,,,AlertAlarm/5111Q21335/2023,5111Q21335,,America/New_York
409,2023-11-15T23:08:00,,,0.0,2,Device,,System Alert /Alarm,Nov 15 2023 11:08PM,False,False,True,,,,,,,SYS_ALM,SystemAlertAlarm,,,,AlertAlarm/5111Q21335/2023,5111Q21335,,America/New_York
410,,,,,2,Device,,,11/15/2023 5:58:20 PM -05:00,False,True,False,1.0,,,,,,SYS_ALM,SystemAlertAlarm,,,,AlertAlarm/5111Q21335/2023,5111Q21335,,America/New_York
411,,,,,2,Device,,,11/16/2023 1:28:21 AM -05:00,False,True,False,1.0,,,,,,SYS_ALM,SystemAlertAlarm,,,,AlertAlarm/5111Q21335/2023,5111Q21335,,America/New_York
412,2023-11-16T07:58:00,,,0.0,2,Device,,System Alert /Alarm,Nov 16 2023  7:58AM,False,False,True,,,,,,,SYS_ALM,SystemAlertAlarm,,,,AlertAlarm/5111Q21335/2023,5111Q21335,,America/New_York
413,,,,,2,Device,,,11/16/2023 4:23:22 AM -05:00,False,True,False,1.0,,,,,,SYS_ALM,SystemAlertAlarm,,,,AlertAlarm/5111Q21335/2023,5111Q21335,,America/New_York
414,,,,,2,Device,,,11/16/2023 8:33:23 AM -05:00,False,True,False,1.0,,,,,,SYS_ALM,SystemAlertAlarm,,,,AlertAlarm/5111Q21335/2023,5111Q21335,,America/New_York
415,2023-11-16T13:48:00,,,0.0,2,Device,,System Alert /Alarm,Nov 16 2023  1:48PM,False,False,True,,,,,,,SYS_ALM,SystemAlertAlarm,,,,AlertAlarm/5111Q21335/2023,5111Q21335,,America/New_York
416,,,,,2,Device,,,11/16/2023 8:58:23 AM -05:00,False,True,False,1.0,,,,,,SYS_ALM,SystemAlertAlarm,,,,AlertAlarm/5111Q21335/2023,5111Q21335,,America/New_York
417,2023-11-16T14:08:00,,,0.0,2,Device,,System Alert /Alarm,Nov 16 2023  2:08PM,False,False,True,,,,,,,SYS_ALM,SystemAlertAlarm,,,,AlertAlarm/5111Q21335/2023,5111Q21335,,America/New_York
418,,,,,2,Device,,,11/16/2023 9:13:23 AM -05:00,False,True,False,1.0,,,,,,SYS_ALM,SystemAlertAlarm,,,,AlertAlarm/5111Q21335/2023,5111Q21335,,America/New_York
419,2023-11-16T14:28:00,,,0.0,2,Device,,System Alert /Alarm,Nov 16 2023  2:28PM,False,False,True,,,,,,,SYS_ALM,SystemAlertAlarm,,,,AlertAlarm/5111Q21335/2023,5111Q21335,,America/New_York
420,,,,,2,Device,,,11/16/2023 9:38:23 AM -05:00,False,True,False,1.0,,,,,,SYS_ALM,SystemAlertAlarm,,,,AlertAlarm/5111Q21335/2023,5111Q21335,,America/New_York
421,2023-11-16T16:23:00,,,0.0,2,Device,,System Alert /Alarm,Nov 16 2023  4:23PM,False,False,True,,,,,,,SYS_ALM,SystemAlertAlarm,,,,AlertAlarm/5111Q21335/2023,5111Q21335,,America/New_York
422,,,,,2,Device,,,11/16/2023 11:43:23 AM -05:00,False,True,False,1.0,,,,,,SYS_ALM,SystemAlertAlarm,,,,AlertAlarm/5111Q21335/2023,5111Q21335,,America/New_York
423,2023-11-16T17:13:00,,,0.0,2,Device,,System Alert /Alarm,Nov 16 2023  5:13PM,False,False,True,,,,,,,SYS_ALM,SystemAlertAlarm,,,,AlertAlarm/5111Q21335/2023,5111Q21335,,America/New_York
424,,,,,2,Device,,,11/16/2023 12:18:23 PM -05:00,False,True,False,1.0,,,,,,SYS_ALM,SystemAlertAlarm,,,,AlertAlarm/5111Q21335/2023,5111Q21335,,America/New_York
425,2023-11-16T21:03:00,,,0.0,2,Device,,System Alert /Alarm,Nov 16 2023  9:03PM,False,False,True,,,,,,,SYS_ALM,SystemAlertAlarm,,,,AlertAlarm/5111Q21335/2023,5111Q21335,,America/New_York
426,,,,,2,Device,,,11/16/2023 4:08:24 PM -05:00,False,True,False,1.0,,,,,,SYS_ALM,SystemAlertAlarm,,,,AlertAlarm/5111Q21335/2023,5111Q21335,,America/New_York
427,2023-11-16T21:13:00,,,0.0,2,Device,,System Alert /Alarm,Nov 16 2023  9:13PM,False,False,True,,,,,,,SYS_ALM,SystemAlertAlarm,,,,AlertAlarm/5111Q21335/2023,5111Q21335,,America/New_York
428,,,,,2,Device,,,11/16/2023 4:18:24 PM -05:00,False,True,False,1.0,,,,,,SYS_ALM,SystemAlertAlarm,,,,AlertAlarm/5111Q21335/2023,5111Q21335,,America/New_York
429,2023-11-16T21:43:00,,,0.0,2,Device,,System Alert /Alarm,Nov 16 2023  9:43PM,False,False,True,,,,,,,SYS_ALM,SystemAlertAlarm,,,,AlertAlarm/5111Q21335/2023,5111Q21335,,America/New_York
430,,,,,2,Device,,,11/16/2023 4:58:24 PM -05:00,False,True,False,1.0,,,,,,SYS_ALM,SystemAlertAlarm,,,,AlertAlarm/5111Q21335/2023,5111Q21335,,America/New_York
431,2023-11-16T22:03:00,,,0.0,2,Device,,System Alert /Alarm,Nov 16 2023 10:03PM,False,False,True,,,,,,,SYS_ALM,SystemAlertAlarm,,,,AlertAlarm/5111Q21335/2023,5111Q21335,,America/New_York
432,,,,,2,Device,,,11/16/2023 5:13:24 PM -05:00,False,True,False,1.0,,,,,,SYS_ALM,SystemAlertAlarm,,,,AlertAlarm/5111Q21335/2023,5111Q21335,,America/New_York
433,2023-11-16T22:33:00,,,0.0,2,Device,,System Alert /Alarm,Nov 16 2023 10:33PM,False,False,True,,,,,,,SYS_ALM,SystemAlertAlarm,,,,AlertAlarm/5111Q21335/2023,5111Q21335,,America/New_York
434,,,,,2,Device,,,11/16/2023 5:38:24 PM -05:00,False,True,False,1.0,,,,,,SYS_ALM,SystemAlertAlarm,,,,AlertAlarm/5111Q21335/2023,5111Q21335,,America/New_York
435,2023-11-17T00:13:00,,,0.0,2,Device,,System Alert /Alarm,Nov 17 2023 12:13AM,False,False,True,,,,,,,SYS_ALM,SystemAlertAlarm,,,,AlertAlarm/5111Q21335/2023,5111Q21335,,America/New_York
436,,,,,2,Device,,,11/16/2023 7:18:25 PM -05:00,False,True,False,1.0,,,,,,SYS_ALM,SystemAlertAlarm,,,,AlertAlarm/5111Q21335/2023,5111Q21335,,America/New_York
437,2023-11-17T01:23:00,,,0.0,2,Device,,System Alert /Alarm,Nov 17 2023  1:23AM,False,False,True,,,,,,,SYS_ALM,SystemAlertAlarm,,,,AlertAlarm/5111Q21335/2023,5111Q21335,,America/New_York
438,,,,,2,Device,,,11/16/2023 8:28:25 PM -05:00,False,True,False,1.0,,,,,,SYS_ALM,SystemAlertAlarm,,,,AlertAlarm/5111Q21335/2023,5111Q21335,,America/New_York
439,2023-11-17T02:48:00,,,0.0,2,Device,,System Alert /Alarm,Nov 17 2023  2:48AM,False,False,True,,,,,,,SYS_ALM,SystemAlertAlarm,,,,AlertAlarm/5111Q21335/2023,5111Q21335,,America/New_York
440,,,,,2,Device,,,11/16/2023 11:08:26 PM -05:00,False,True,False,1.0,,,,,,SYS_ALM,SystemAlertAlarm,,,,AlertAlarm/5111Q21335/2023,5111Q21335,,America/New_York
441,2023-11-17T05:28:00,,,0.0,2,Device,,System Alert /Alarm,Nov 17 2023  5:28AM,False,False,True,,,,,,,SYS_ALM,SystemAlertAlarm,,,,AlertAlarm/5111Q21335/2023,5111Q21335,,America/New_York
442,,,,,2,Device,,,11/17/2023 1:23:26 AM -05:00,False,True,False,1.0,,,,,,SYS_ALM,SystemAlertAlarm,,,,AlertAlarm/5111Q21335/2023,5111Q21335,,America/New_York
443,,,,,2,Device,,,11/17/2023 2:08:26 AM -05:00,False,True,False,1.0,,,,,,SYS_ALM,SystemAlertAlarm,,,,AlertAlarm/5111Q21335/2023,5111Q21335,,America/New_York
444,2023-11-17T07:38:00,,,0.0,2,Device,,System Alert /Alarm,Nov 17 2023  7:38AM,False,False,True,,,,,,,SYS_ALM,SystemAlertAlarm,,,,AlertAlarm/5111Q21335/2023,5111Q21335,,America/New_York
445,,,,,2,Device,,,11/17/2023 3:38:27 AM -05:00,False,True,False,1.0,,,,,,SYS_ALM,SystemAlertAlarm,,,,AlertAlarm/5111Q21335/2023,5111Q21335,,America/New_York
446,,,,,2,Device,,,11/17/2023 3:48:27 AM -05:00,False,True,False,1.0,,,,,,SYS_ALM,SystemAlertAlarm,,,,AlertAlarm/5111Q21335/2023,5111Q21335,,America/New_York
447,2023-11-17T08:53:00,,,0.0,2,Device,,System Alert /Alarm,Nov 17 2023  8:53AM,False,False,True,,,,,,,SYS_ALM,SystemAlertAlarm,,,,AlertAlarm/5111Q21335/2023,5111Q21335,,America/New_York
448,,,,,2,Device,,,11/17/2023 4:08:27 AM -05:00,False,True,False,1.0,,,,,,SYS_ALM,SystemAlertAlarm,,,,AlertAlarm/5111Q21335/2023,5111Q21335,,America/New_York
449,2023-11-17T09:18:00,,,0.0,2,Device,,System Alert /Alarm,Nov 17 2023  9:18AM,False,False,True,,,,,,,SYS_ALM,SystemAlertAlarm,,,,AlertAlarm/5111Q21335/2023,5111Q21335,,America/New_York
450,,,,,2,Device,,,11/17/2023 4:23:27 AM -05:00,False,True,False,1.0,,,,,,SYS_ALM,SystemAlertAlarm,,,,AlertAlarm/5111Q21335/2023,5111Q21335,,America/New_York
451,2023-11-17T09:28:00,,,0.0,2,Device,,System Alert /Alarm,Nov 17 2023  9:28AM,False,False,True,,,,,,,SYS_ALM,SystemAlertAlarm,,,,AlertAlarm/5111Q21335/2023,5111Q21335,,America/New_York
452,,,,,2,Device,,,11/17/2023 6:03:27 AM -05:00,False,True,False,1.0,,,,,,SYS_ALM,SystemAlertAlarm,,,,AlertAlarm/5111Q21335/2023,5111Q21335,,America/New_York
453,2023-11-17T11:23:00,,,0.0,2,Device,,System Alert /Alarm,Nov 17 2023 11:23AM,False,False,True,,,,,,,SYS_ALM,SystemAlertAlarm,,,,AlertAlarm/5111Q21335/2023,5111Q21335,,America/New_York
454,,,,,2,Device,,,11/17/2023 6:38:27 AM -05:00,False,True,False,1.0,,,,,,SYS_ALM,SystemAlertAlarm,,,,AlertAlarm/5111Q21335/2023,5111Q21335,,America/New_York
455,,,,,2,Device,,,11/17/2023 7:08:27 AM -05:00,False,True,False,1.0,,,,,,SYS_ALM,SystemAlertAlarm,,,,AlertAlarm/5111Q21335/2023,5111Q21335,,America/New_York
456,2023-11-17T12:13:00,,,0.0,2,Device,,System Alert /Alarm,Nov 17 2023 12:13PM,False,False,True,,,,,,,SYS_ALM,SystemAlertAlarm,,,,AlertAlarm/5111Q21335/2023,5111Q21335,,America/New_York
457,,,,,2,Device,,,11/17/2023 7:18:27 AM -05:00,False,True,False,1.0,,,,,,SYS_ALM,SystemAlertAlarm,,,,AlertAlarm/5111Q21335/2023,5111Q21335,,America/New_York
458,2023-11-17T12:33:00,,,0.0,2,Device,,System Alert /Alarm,Nov 17 2023 12:33PM,False,False,True,,,,,,,SYS_ALM,SystemAlertAlarm,,,,AlertAlarm/5111Q21335/2023,5111Q21335,,America/New_York
459,,,,,2,Device,,,11/17/2023 7:43:27 AM -05:00,False,True,False,1.0,,,,,,SYS_ALM,SystemAlertAlarm,,,,AlertAlarm/5111Q21335/2023,5111Q21335,,America/New_York
460,2023-11-17T13:08:00,,,0.0,2,Device,,System Alert /Alarm,Nov 17 2023  1:08PM,False,False,True,,,,,,,SYS_ALM,SystemAlertAlarm,,,,AlertAlarm/5111Q21335/2023,5111Q21335,,America/New_York
461,,,,,2,Device,,,11/17/2023 8:38:28 AM -05:00,False,True,False,1.0,,,,,,SYS_ALM,SystemAlertAlarm,,,,AlertAlarm/5111Q21335/2023,5111Q21335,,America/New_York
462,2023-11-17T13:53:00,,,0.0,2,Device,,System Alert /Alarm,Nov 17 2023  1:53PM,False,False,True,,,,,,,SYS_ALM,SystemAlertAlarm,,,,AlertAlarm/5111Q21335/2023,5111Q21335,,America/New_York
463,,,,,2,Device,,,11/17/2023 9:08:28 AM -05:00,False,True,False,1.0,,,,,,SYS_ALM,SystemAlertAlarm,,,,AlertAlarm/5111Q21335/2023,5111Q21335,,America/New_York
464,2023-11-17T14:58:00,,,0.0,2,Device,,System Alert /Alarm,Nov 17 2023  2:58PM,False,False,True,,,,,,,SYS_ALM,SystemAlertAlarm,,,,AlertAlarm/5111Q21335/2023,5111Q21335,,America/New_York
465,,,,,2,Device,,,11/17/2023 10:38:28 AM -05:00,False,True,False,1.0,,,,,,SYS_ALM,SystemAlertAlarm,,,,AlertAlarm/5111Q21335/2023,5111Q21335,,America/New_York
466,2023-11-17T16:13:00,,,0.0,2,Device,,System Alert /Alarm,Nov 17 2023  4:13PM,False,False,True,,,,,,,SYS_ALM,SystemAlertAlarm,,,,AlertAlarm/5111Q21335/2023,5111Q21335,,America/New_York
467,,,,,2,Device,,,11/17/2023 11:18:28 AM -05:00,False,True,False,1.0,,,,,,SYS_ALM,SystemAlertAlarm,,,,AlertAlarm/5111Q21335/2023,5111Q21335,,America/New_York
468,2023-11-17T16:28:00,,,0.0,2,Device,,System Alert /Alarm,Nov 17 2023  4:28PM,False,False,True,,,,,,,SYS_ALM,SystemAlertAlarm,,,,AlertAlarm/5111Q21335/2023,5111Q21335,,America/New_York
469,,,,,2,Device,,,11/17/2023 11:33:28 AM -05:00,False,True,False,1.0,,,,,,SYS_ALM,SystemAlertAlarm,,,,AlertAlarm/5111Q21335/2023,5111Q21335,,America/New_York
470,2023-11-17T17:58:00,,,0.0,2,Device,,System Alert /Alarm,Nov 17 2023  5:58PM,False,False,True,,,,,,,SYS_ALM,SystemAlertAlarm,,,,AlertAlarm/5111Q21335/2023,5111Q21335,,America/New_York
471,,,,,2,Device,,,11/17/2023 1:03:29 PM -05:00,False,True,False,1.0,,,,,,SYS_ALM,SystemAlertAlarm,,,,AlertAlarm/5111Q21335/2023,5111Q21335,,America/New_York
472,2023-11-17T20:53:00,,,0.0,2,Device,,System Alert /Alarm,Nov 17 2023  8:53PM,False,False,True,,,,,,,SYS_ALM,SystemAlertAlarm,,,,AlertAlarm/5111Q21335/2023,5111Q21335,,America/New_York
473,,,,,2,Device,,,11/17/2023 3:58:29 PM -05:00,False,True,False,1.0,,,,,,SYS_ALM,SystemAlertAlarm,,,,AlertAlarm/5111Q21335/2023,5111Q21335,,America/New_York
474,2023-11-17T23:48:00,,,0.0,2,Device,,System Alert /Alarm,Nov 17 2023 11:48PM,False,False,True,,,,,,,SYS_ALM,SystemAlertAlarm,,,,AlertAlarm/5111Q21335/2023,5111Q21335,,America/New_York
475,2023-11-20T09:21:00,https://alarmssaveandnotifyprod.blob.core.windows.net/snapshot/vu210550101310_74/2023/11/20/9/21/VU210550101310_74_1700472083,,0.0,162,Device,,SENSOR ALERT-EVAPORATOR APPROACH,Nov 20 2023  9:21AM,False,True,False,,,,,,,ALARM_01,CH_ALARM_01,,,,AlertAlarm/5111Q21335/2023,5111Q21335,,America/New_York
476,,,,,2,Device,,,11/20/2023 4:26:50 AM -05:00,False,True,False,1.0,,,,,,SYS_ALM,SystemAlertAlarm,,,,AlertAlarm/5111Q21335/2023,5111Q21335,,America/New_York
477,2023-11-20T09:31:00,,,0.0,2,Device,,System Alert /Alarm,Nov 20 2023  9:31AM,False,False,True,,,,,,,SYS_ALM,SystemAlertAlarm,,,,AlertAlarm/5111Q21335/2023,5111Q21335,,America/New_York
478,2023-11-20T09:31:00,,,0.0,162,Device,,SENSOR ALERT-EVAPORATOR APPROACH,Nov 20 2023  9:31AM,False,True,True,,,,,,,ALARM_01,CH_ALARM_01,,,,AlertAlarm/5111Q21335/2023,5111Q21335,,America/New_York
479,,,,,2,Device,,,11/20/2023 5:51:51 AM -05:00,False,True,False,1.0,,,,,,SYS_ALM,SystemAlertAlarm,,,,AlertAlarm/5111Q21335/2023,5111Q21335,,America/New_York
480,2023-11-20T11:06:00,,,0.0,2,Device,,System Alert /Alarm,Nov 20 2023 11:06AM,False,False,True,,,,,,,SYS_ALM,SystemAlertAlarm,,,,AlertAlarm/5111Q21335/2023,5111Q21335,,America/New_York
481,,,,,2,Device,,,11/20/2023 6:11:51 AM -05:00,False,True,False,1.0,,,,,,SYS_ALM,SystemAlertAlarm,,,,AlertAlarm/5111Q21335/2023,5111Q21335,,America/New_York
482,2023-11-20T11:26:00,,,0.0,2,Device,,System Alert /Alarm,Nov 20 2023 11:26AM,False,False,True,,,,,,,SYS_ALM,SystemAlertAlarm,,,,AlertAlarm/5111Q21335/2023,5111Q21335,,America/New_York
483,,,,,2,Device,,,11/20/2023 6:41:51 AM -05:00,False,True,False,1.0,,,,,,SYS_ALM,SystemAlertAlarm,,,,AlertAlarm/5111Q21335/2023,5111Q21335,,America/New_York
484,2023-11-20T12:21:00,,,0.0,2,Device,,System Alert /Alarm,Nov 20 2023 12:21PM,False,False,True,,,,,,,SYS_ALM,SystemAlertAlarm,,,,AlertAlarm/5111Q21335/2023,5111Q21335,,America/New_York
485,,,,,2,Device,,,11/20/2023 8:26:51 AM -05:00,False,True,False,1.0,,,,,,SYS_ALM,SystemAlertAlarm,,,,AlertAlarm/5111Q21335/2023,5111Q21335,,America/New_York
486,2023-11-20T14:36:00,,,0.0,2,Device,,System Alert /Alarm,Nov 20 2023  2:36PM,False,False,True,,,,,,,SYS_ALM,SystemAlertAlarm,,,,AlertAlarm/5111Q21335/2023,5111Q21335,,America/New_York
487,,,,,2,Device,,,11/20/2023 9:46:51 AM -05:00,False,True,False,1.0,,,,,,SYS_ALM,SystemAlertAlarm,,,,AlertAlarm/5111Q21335/2023,5111Q21335,,America/New_York
488,2023-11-20T14:51:00,,,0.0,2,Device,,System Alert /Alarm,Nov 20 2023  2:51PM,False,False,True,,,,,,,SYS_ALM,SystemAlertAlarm,,,,AlertAlarm/5111Q21335/2023,5111Q21335,,America/New_York
489,,,,,2,Device,,,11/20/2023 10:01:51 AM -05:00,False,True,False,1.0,,,,,,SYS_ALM,SystemAlertAlarm,,,,AlertAlarm/5111Q21335/2023,5111Q21335,,America/New_York
490,2023-11-20T15:56:00,,,0.0,2,Device,,System Alert /Alarm,Nov 20 2023  3:56PM,False,False,True,,,,,,,SYS_ALM,SystemAlertAlarm,,,,AlertAlarm/5111Q21335/2023,5111Q21335,,America/New_York
491,,,,,2,Device,,,11/20/2023 1:21:52 PM -05:00,False,True,False,1.0,,,,,,SYS_ALM,SystemAlertAlarm,,,,AlertAlarm/5111Q21335/2023,5111Q21335,,America/New_York
492,2023-11-20T18:31:00,,,0.0,2,Device,,System Alert /Alarm,Nov 20 2023  6:31PM,False,False,True,,,,,,,SYS_ALM,SystemAlertAlarm,,,,AlertAlarm/5111Q21335/2023,5111Q21335,,America/New_York
493,,,,,2,Device,,,11/20/2023 1:41:52 PM -05:00,False,True,False,1.0,,,,,,SYS_ALM,SystemAlertAlarm,,,,AlertAlarm/5111Q21335/2023,5111Q21335,,America/New_York
494,2023-11-20T19:56:00,,,0.0,2,Device,,System Alert /Alarm,Nov 20 2023  7:56PM,False,False,True,,,,,,,SYS_ALM,SystemAlertAlarm,,,,AlertAlarm/5111Q21335/2023,5111Q21335,,America/New_York
495,2023-11-22T05:28:00,https://alarmssaveandnotifyprod.blob.core.windows.net/snapshot/vu210550101310_74/2023/11/22/5/28/VU210550101310_74_1700630885,,0.0,162,Device,,SENSOR ALERT-EVAPORATOR APPROACH,Nov 22 2023  5:28AM,False,True,False,,,,,,,ALARM_01,CH_ALARM_01,,,,AlertAlarm/5111Q21335/2023,5111Q21335,,America/New_York
496,2023-11-22T05:28:00,https://alarmssaveandnotifyprod.blob.core.windows.net/snapshot/vu210550101310_74/2023/11/22/5/28/VU210550101310_74_1700630885,,0.0,122,Device,,RUN CAPACITY LIMITED-LOW EVAP REFRIG TEMP,Nov 22 2023  5:28AM,False,True,False,,,,,,,ALARM_02,CH_ALARM_02,,,,AlertAlarm/5111Q21335/2023,5111Q21335,,America/New_York
497,2023-12-08T17:08:00,,,0.0,162,Device,,SENSOR ALERT-EVAPORATOR APPROACH,Dec  8 2023  5:08PM,False,True,True,,,,,,,ALARM_01,CH_ALARM_01,,,,AlertAlarm/5111Q21335/2023,5111Q21335,,America/New_York
498,,,,,2,Device,,,12/10/2023 12:12:34 AM -05:00,False,True,False,1.0,,,,,,SYS_ALM,SystemAlertAlarm,,,,AlertAlarm/5111Q21335/2023,5111Q21335,,America/New_York
499,2023-12-10T05:17:00,,,0.0,2,Device,,System Alert /Alarm,Dec 10 2023  5:17AM,False,False,True,,,,,,,SYS_ALM,SystemAlertAlarm,,,,AlertAlarm/5111Q21335/2023,5111Q21335,,America/New_York
500,2023-12-10T05:17:00,,,0.0,122,Device,,RUN CAPACITY LIMITED-LOW EVAP REFRIG TEMP,Dec 10 2023  5:17AM,False,True,True,,,,,,,ALARM_02,CH_ALARM_02,,,,AlertAlarm/5111Q21335/2023,5111Q21335,,America/New_York
501,,,,,2,Device,,,12/10/2023 12:22:34 AM -05:00,False,True,False,1.0,,,,,,SYS_ALM,SystemAlertAlarm,,,,AlertAlarm/5111Q21335/2023,5111Q21335,,America/New_York
502,2023-12-10T05:27:00,,,0.0,2,Device,,System Alert /Alarm,Dec 10 2023  5:27AM,False,False,True,,,,,,,SYS_ALM,SystemAlertAlarm,,,,AlertAlarm/5111Q21335/2023,5111Q21335,,America/New_York
503,2023-12-10T14:55:00,https://alarmssaveandnotifyprod.blob.core.windows.net/snapshot/vu210550101310_74/2023/12/10/14/55/VU210550101310_74_1702220121,,0.0,122,Device,,RUN CAPACITY LIMITED-LOW EVAP REFRIG TEMP,Dec 10 2023  2:55PM,False,True,False,,,,,,,ALARM_01,CH_ALARM_01,,,,AlertAlarm/5111Q21335/2023,5111Q21335,,America/New_York
504,2023-12-10T14:55:00,https://alarmssaveandnotifyprod.blob.core.windows.net/snapshot/vu210550101310_74/2023/12/10/14/55/VU210550101310_74_1702220121,,0.0,162,Device,,SENSOR ALERT-EVAPORATOR APPROACH,Dec 10 2023  2:55PM,False,True,False,,,,,,,ALARM_02,CH_ALARM_02,,,,AlertAlarm/5111Q21335/2023,5111Q21335,,America/New_York
505,,,,,2,Device,,,12/10/2023 9:02:35 AM -05:00,False,True,False,1.0,,,,,,SYS_ALM,SystemAlertAlarm,,,,AlertAlarm/5111Q21335/2023,5111Q21335,,America/New_York
506,,,,,2,Device,,,12/10/2023 9:27:36 AM -05:00,False,True,False,1.0,,,,,,SYS_ALM,SystemAlertAlarm,,,,AlertAlarm/5111Q21335/2023,5111Q21335,,America/New_York
507,,,,,2,Device,,,12/10/2023 9:47:36 AM -05:00,False,True,False,1.0,,,,,,SYS_ALM,SystemAlertAlarm,,,,AlertAlarm/5111Q21335/2023,5111Q21335,,America/New_York
508,2023-12-10T15:22:00,,,0.0,2,Device,,System Alert /Alarm,Dec 10 2023  3:22PM,False,False,True,,,,,,,SYS_ALM,SystemAlertAlarm,,,,AlertAlarm/5111Q21335/2023,5111Q21335,,America/New_York
509,2023-12-10T15:22:00,,,0.0,122,Device,,RUN CAPACITY LIMITED-LOW EVAP REFRIG TEMP,Dec 10 2023  3:22PM,False,True,True,,,,,,,ALARM_01,CH_ALARM_01,,,,AlertAlarm/5111Q21335/2023,5111Q21335,,America/New_York
510,2023-12-10T15:22:00,,,0.0,162,Device,,SENSOR ALERT-EVAPORATOR APPROACH,Dec 10 2023  3:22PM,False,True,True,,,,,,,ALARM_02,CH_ALARM_02,,,,AlertAlarm/5111Q21335/2023,5111Q21335,,America/New_York
511,,,,,2,Device,,,12/10/2023 10:27:36 AM -05:00,False,True,False,1.0,,,,,,SYS_ALM,SystemAlertAlarm,,,,AlertAlarm/5111Q21335/2023,5111Q21335,,America/New_York
512,2023-12-10T16:02:00,,,0.0,2,Device,,System Alert /Alarm,Dec 10 2023  4:02PM,False,False,True,,,,,,,SYS_ALM,SystemAlertAlarm,,,,AlertAlarm/5111Q21335/2023,5111Q21335,,America/New_York
513,,,,,2,Device,,,12/10/2023 11:17:36 AM -05:00,False,True,False,1.0,,,,,,SYS_ALM,SystemAlertAlarm,,,,AlertAlarm/5111Q21335/2023,5111Q21335,,America/New_York
514,2023-12-10T16:32:00,,,0.0,2,Device,,System Alert /Alarm,Dec 10 2023  4:32PM,False,False,True,,,,,,,SYS_ALM,SystemAlertAlarm,,,,AlertAlarm/5111Q21335/2023,5111Q21335,,America/New_York
