,AlertAlarmDateTime,SnapshotUrl,TimeZoneAbreviation,UtcOffsetMinutes,adjustedvalue,alertalarmtype,algorithm,description,eventdatetime,isalarm,isalert,isreset,lastvalue,maxalarmthresholdvalue,maxwarningthresholdvalue,metricName,metricNameChinese,metricid,metrickey,metricshortname,metrictype,minalarmthresholdvalue,minwarningthresholdvalue,path,serialnumber,targetvalue,timezone
0,2023-01-02T18:28:00,,,0.0,1,Device,,Alarm Relay,Jan  2 2023  6:28PM,False,False,True,,,,,,,ALM,CH_ALARMRELAY,,,,AlertAlarm/5200Q64908/2023,5200Q64908,,America/Phoenix
1,2023-01-02T18:28:00,,,0.0,3,Device,,System Alert Alarm,Jan  2 2023  6:28PM,False,False,True,,,,,,,SYS_ALM,SystemAlertAlarm,,,,AlertAlarm/5200Q64908/2023,5200Q64908,,America/Phoenix
2,2023-01-23T00:52:00,,,0.0,3,Device,,System Alert Alarm,Jan 23 2023 12:52AM,False,False,True,,,,,,,SYS_ALM,SystemAlertAlarm,,,,AlertAlarm/5200Q64908/2023,5200Q64908,,America/Phoenix
3,2023-01-23T00:52:00,,,0.0,2,Device,,System Alert Alarm,Jan 23 2023 12:52AM,False,False,True,,,,,,,SYS_ALM,SystemAlertAlarm,,,,AlertAlarm/5200Q64908/2023,5200Q64908,,America/Phoenix
4,2023-01-26T19:23:00,,,0.0,3,Device,,System Alert Alarm,Jan 26 2023  7:23PM,False,False,True,,,,,,,SYS_ALM,SystemAlertAlarm,,,,AlertAlarm/5200Q64908/2023,5200Q64908,,America/Phoenix
5,2023-01-28T10:53:00,,,0.0,3,Device,,System Alert Alarm,Jan 28 2023 10:53AM,False,False,True,,,,,,,SYS_ALM,SystemAlertAlarm,,,,AlertAlarm/5200Q64908/2023,5200Q64908,,America/Phoenix
6,2023-01-28T11:03:00,,,0.0,3,Device,,System Alert Alarm,Jan 28 2023 11:03AM,False,False,True,,,,,,,SYS_ALM,SystemAlertAlarm,,,,AlertAlarm/5200Q64908/2023,5200Q64908,,America/Phoenix
7,2023-04-05T20:12:00,https://alarmssaveandnotifyprod.blob.core.windows.net/snapshot/vu207150371310_2/2023/4/5/20/12/VU207150371310_2_1680725538,,0.0,206,Device,,PROTECTIVE LIMIT-STARTER FAULT ,Apr  5 2023  8:12PM,True,False,False,,,,,,,ALARM_01,CH_ALARM_01,,,,AlertAlarm/5200Q64908/2023,5200Q64908,,America/Phoenix
8,2023-04-06T04:22:00,,,0.0,3,Device,,System Alert Alarm,Apr  6 2023  4:22AM,False,False,True,,,,,,,SYS_ALM,SystemAlertAlarm,,,,AlertAlarm/5200Q64908/2023,5200Q64908,,America/Phoenix
9,2023-04-06T04:22:00,,,0.0,206,Device,,PROTECTIVE LIMIT-STARTER FAULT ,Apr  6 2023  4:22AM,True,False,True,,,,,,,ALARM_01,CH_ALARM_01,,,,AlertAlarm/5200Q64908/2023,5200Q64908,,America/Phoenix
10,2023-04-11T20:07:00,https://alarmssaveandnotifyprod.blob.core.windows.net/snapshot/vu207150371310_2/2023/4/11/20/8/VU207150371310_2_1681243670,,0.0,206,Device,,PROTECTIVE LIMIT-STARTER FAULT ,Apr 11 2023  8:07PM,True,False,False,,,,,,,ALARM_01,CH_ALARM_01,,,,AlertAlarm/5200Q64908/2023,5200Q64908,,America/Phoenix
11,,,,,3,Device,,,5/10/2023 10:00:28 AM -07:00,True,False,False,1.0,,,,,,SYS_ALM,SystemAlertAlarm,,,,AlertAlarm/5200Q64908/2023,5200Q64908,,America/Phoenix
12,2023-05-10T17:05:00,,,0.0,3,Device,,System Alert Alarm,May 10 2023  5:05PM,False,False,True,,,,,,,SYS_ALM,SystemAlertAlarm,,,,AlertAlarm/5200Q64908/2023,5200Q64908,,America/Phoenix
13,2023-05-10T17:05:00,,,0.0,206,Device,,PROTECTIVE LIMIT-STARTER FAULT ,May 10 2023  5:05PM,True,False,True,,,,,,,ALARM_01,CH_ALARM_01,,,,AlertAlarm/5200Q64908/2023,5200Q64908,,America/Phoenix
14,2023-06-20T03:20:00,https://alarmssaveandnotifyprod.blob.core.windows.net/snapshot/vu207150371310_2/2023/6/20/3/20/VU207150371310_2_1687231208,,0.0,163,Device,,SENSOR ALERT-CONDENSER APPROACH,Jun 20 2023  3:20AM,False,True,False,,,,,,,ALARM_01,CH_ALARM_01,,,,AlertAlarm/5200Q64908/2023,5200Q64908,,America/Phoenix
15,2023-06-20T03:20:00,https://alarmssaveandnotifyprod.blob.core.windows.net/snapshot/vu207150371310_2/2023/6/20/3/20/VU207150371310_2_1687231208,,0.0,230,Device,,PROTECTIVE LIMIT-LOW CONDENSER WATER FLOW,Jun 20 2023  3:20AM,True,False,False,,,,,,,ALARM_02,CH_ALARM_02,,,,AlertAlarm/5200Q64908/2023,5200Q64908,,America/Phoenix
16,,,,,3,Device,,,6/19/2023 8:21:14 PM -07:00,True,False,False,1.0,,,,,,SYS_ALM,SystemAlertAlarm,,,,AlertAlarm/5200Q64908/2023,5200Q64908,,America/Phoenix
17,,,,,1,Device,,,6/19/2023 8:31:14 PM -07:00,True,False,False,0.0,,,,,,ALM,CH_ALARMRELAY,,,,AlertAlarm/5200Q64908/2023,5200Q64908,,America/Phoenix
18,2023-06-20T03:36:00,,,0.0,163,Device,,SENSOR ALERT-CONDENSER APPROACH,Jun 20 2023  3:36AM,False,True,True,,,,,,,ALARM_01,CH_ALARM_01,,,,AlertAlarm/5200Q64908/2023,5200Q64908,,America/Phoenix
19,2023-06-20T03:36:00,,,0.0,1,Device,,Alarm Relay,Jun 20 2023  3:36AM,False,False,True,,,,,,,ALM,CH_ALARMRELAY,,,,AlertAlarm/5200Q64908/2023,5200Q64908,,America/Phoenix
20,2023-06-20T03:36:00,,,0.0,3,Device,,System Alert Alarm,Jun 20 2023  3:36AM,False,False,True,,,,,,,SYS_ALM,SystemAlertAlarm,,,,AlertAlarm/5200Q64908/2023,5200Q64908,,America/Phoenix
21,2023-06-20T03:36:00,,,0.0,230,Device,,PROTECTIVE LIMIT-LOW CONDENSER WATER FLOW,Jun 20 2023  3:36AM,True,False,True,,,,,,,ALARM_02,CH_ALARM_02,,,,AlertAlarm/5200Q64908/2023,5200Q64908,,America/Phoenix
22,,,,,3,Device,,,6/19/2023 8:41:15 PM -07:00,True,False,False,1.0,,,,,,SYS_ALM,SystemAlertAlarm,,,,AlertAlarm/5200Q64908/2023,5200Q64908,,America/Phoenix
23,2023-06-20T03:46:00,,,0.0,3,Device,,System Alert Alarm,Jun 20 2023  3:46AM,False,False,True,,,,,,,SYS_ALM,SystemAlertAlarm,,,,AlertAlarm/5200Q64908/2023,5200Q64908,,America/Phoenix
24,,,,,3,Device,,,6/19/2023 8:51:15 PM -07:00,True,False,False,1.0,,,,,,SYS_ALM,SystemAlertAlarm,,,,AlertAlarm/5200Q64908/2023,5200Q64908,,America/Phoenix
25,2023-06-20T04:01:00,,,0.0,3,Device,,System Alert Alarm,Jun 20 2023  4:01AM,False,False,True,,,,,,,SYS_ALM,SystemAlertAlarm,,,,AlertAlarm/5200Q64908/2023,5200Q64908,,America/Phoenix
26,,,,,3,Device,,,6/30/2023 9:48:32 AM -07:00,True,False,False,1.0,,,,,,SYS_ALM,SystemAlertAlarm,,,,AlertAlarm/5200Q64908/2023,5200Q64908,,America/Phoenix
27,2023-06-30T16:58:00,,,0.0,3,Device,,System Alert Alarm,Jun 30 2023  4:58PM,False,False,True,,,,,,,SYS_ALM,SystemAlertAlarm,,,,AlertAlarm/5200Q64908/2023,5200Q64908,,America/Phoenix
28,,,,,2,Device,,,6/30/2023 10:18:32 AM -07:00,False,True,False,1.0,,,,,,SYS_ALM,SystemAlertAlarm,,,,AlertAlarm/5200Q64908/2023,5200Q64908,,America/Phoenix
29,2023-06-30T17:28:00,,,0.0,2,Device,,System Alert Alarm,Jun 30 2023  5:28PM,False,False,True,,,,,,,SYS_ALM,SystemAlertAlarm,,,,AlertAlarm/5200Q64908/2023,5200Q64908,,America/Phoenix
30,2023-06-30T18:58:00,https://alarmssaveandnotifyprod.blob.core.windows.net/snapshot/vu207150371310_2/2023/6/30/18/58/VU207150371310_2_1688151486,,0.0,163,Device,,SENSOR ALERT-CONDENSER APPROACH,Jun 30 2023  6:58PM,False,True,False,,,,,,,ALARM_01,CH_ALARM_01,,,,AlertAlarm/5200Q64908/2023,5200Q64908,,America/Phoenix
31,2023-06-30T18:58:00,https://alarmssaveandnotifyprod.blob.core.windows.net/snapshot/vu207150371310_2/2023/6/30/18/58/VU207150371310_2_1688151486,,0.0,120,Device,,RUN CAPACITY LIMITED-HIGH CONDENSER PRESSURE,Jun 30 2023  6:58PM,False,True,False,,,,,,,ALARM_02,CH_ALARM_02,,,,AlertAlarm/5200Q64908/2023,5200Q64908,,America/Phoenix
32,2023-06-30T18:58:00,https://alarmssaveandnotifyprod.blob.core.windows.net/snapshot/vu207150371310_2/2023/6/30/18/58/VU207150371310_2_1688151486,,0.0,238,Device,,PROTECTIVE LIMIT-EXCESSIVE COMPR SURGE,Jun 30 2023  6:58PM,True,False,False,,,,,,,ALARM_03,CH_ALARM_03,,,,AlertAlarm/5200Q64908/2023,5200Q64908,,America/Phoenix
33,2023-06-30T18:58:00,https://alarmssaveandnotifyprod.blob.core.windows.net/snapshot/vu207150371310_2/2023/6/30/18/58/VU207150371310_2_1688151486,,0.0,230,Device,,PROTECTIVE LIMIT-LOW CONDENSER WATER FLOW,Jun 30 2023  6:58PM,True,False,False,,,,,,,ALARM_04,CH_ALARM_04,,,,AlertAlarm/5200Q64908/2023,5200Q64908,,America/Phoenix
34,2023-06-30T18:58:00,https://alarmssaveandnotifyprod.blob.core.windows.net/snapshot/vu207150371310_2/2023/6/30/18/58/VU207150371310_2_1688151486,,0.0,151,Device,,CONDENSER PRESSURE ALERT-PUMP RELAY ENERGIZED,Jun 30 2023  6:58PM,False,True,False,,,,,,,ALARM_05,CH_ALARM_05,,,,AlertAlarm/5200Q64908/2023,5200Q64908,,America/Phoenix
35,,,,,3,Device,,,6/30/2023 11:58:33 AM -07:00,True,False,False,1.0,,,,,,SYS_ALM,SystemAlertAlarm,,,,AlertAlarm/5200Q64908/2023,5200Q64908,,America/Phoenix
36,,,,,1,Device,,,6/30/2023 12:03:33 PM -07:00,True,False,False,0.0,,,,,,ALM,CH_ALARMRELAY,,,,AlertAlarm/5200Q64908/2023,5200Q64908,,America/Phoenix
37,2023-06-30T19:18:00,,,0.0,1,Device,,Alarm Relay,Jun 30 2023  7:18PM,False,False,True,,,,,,,ALM,CH_ALARMRELAY,,,,AlertAlarm/5200Q64908/2023,5200Q64908,,America/Phoenix
38,2023-06-30T19:18:00,,,0.0,3,Device,,System Alert Alarm,Jun 30 2023  7:18PM,False,False,True,,,,,,,SYS_ALM,SystemAlertAlarm,,,,AlertAlarm/5200Q64908/2023,5200Q64908,,America/Phoenix
39,2023-06-30T19:18:00,,,0.0,238,Device,,PROTECTIVE LIMIT-EXCESSIVE COMPR SURGE,Jun 30 2023  7:18PM,True,False,True,,,,,,,ALARM_03,CH_ALARM_03,,,,AlertAlarm/5200Q64908/2023,5200Q64908,,America/Phoenix
40,2023-06-30T19:18:00,,,0.0,230,Device,,PROTECTIVE LIMIT-LOW CONDENSER WATER FLOW,Jun 30 2023  7:18PM,True,False,True,,,,,,,ALARM_04,CH_ALARM_04,,,,AlertAlarm/5200Q64908/2023,5200Q64908,,America/Phoenix
41,2023-06-30T19:18:00,,,0.0,163,Device,,SENSOR ALERT-CONDENSER APPROACH,Jun 30 2023  7:18PM,False,True,True,,,,,,,ALARM_01,CH_ALARM_01,,,,AlertAlarm/5200Q64908/2023,5200Q64908,,America/Phoenix
42,2023-06-30T19:18:00,,,0.0,120,Device,,RUN CAPACITY LIMITED-HIGH CONDENSER PRESSURE,Jun 30 2023  7:18PM,False,True,True,,,,,,,ALARM_02,CH_ALARM_02,,,,AlertAlarm/5200Q64908/2023,5200Q64908,,America/Phoenix
43,2023-06-30T19:18:00,,,0.0,151,Device,,CONDENSER PRESSURE ALERT-PUMP RELAY ENERGIZED,Jun 30 2023  7:18PM,False,True,True,,,,,,,ALARM_05,CH_ALARM_05,,,,AlertAlarm/5200Q64908/2023,5200Q64908,,America/Phoenix
44,2023-06-30T19:21:00,https://alarmssaveandnotifyprod.blob.core.windows.net/snapshot/vu207150371310_2/2023/6/30/19/21/VU207150371310_2_1688152875,,0.0,163,Device,,SENSOR ALERT-CONDENSER APPROACH,Jun 30 2023  7:21PM,False,True,False,,,,,,,ALARM_01,CH_ALARM_01,,,,AlertAlarm/5200Q64908/2023,5200Q64908,,America/Phoenix
45,2023-06-30T19:21:00,https://alarmssaveandnotifyprod.blob.core.windows.net/snapshot/vu207150371310_2/2023/6/30/19/21/VU207150371310_2_1688152875,,0.0,120,Device,,RUN CAPACITY LIMITED-HIGH CONDENSER PRESSURE,Jun 30 2023  7:21PM,False,True,False,,,,,,,ALARM_02,CH_ALARM_02,,,,AlertAlarm/5200Q64908/2023,5200Q64908,,America/Phoenix
46,2023-06-30T19:21:00,https://alarmssaveandnotifyprod.blob.core.windows.net/snapshot/vu207150371310_2/2023/6/30/19/21/VU207150371310_2_1688152875,,0.0,151,Device,,CONDENSER PRESSURE ALERT-PUMP RELAY ENERGIZED,Jun 30 2023  7:21PM,False,True,False,,,,,,,ALARM_03,CH_ALARM_03,,,,AlertAlarm/5200Q64908/2023,5200Q64908,,America/Phoenix
47,,,,,2,Device,,,6/30/2023 12:23:33 PM -07:00,False,True,False,1.0,,,,,,SYS_ALM,SystemAlertAlarm,,,,AlertAlarm/5200Q64908/2023,5200Q64908,,America/Phoenix
48,2023-06-30T19:33:00,,,0.0,2,Device,,System Alert Alarm,Jun 30 2023  7:33PM,False,False,True,,,,,,,SYS_ALM,SystemAlertAlarm,,,,AlertAlarm/5200Q64908/2023,5200Q64908,,America/Phoenix
49,2023-06-30T19:33:00,,,0.0,163,Device,,SENSOR ALERT-CONDENSER APPROACH,Jun 30 2023  7:33PM,False,True,True,,,,,,,ALARM_01,CH_ALARM_01,,,,AlertAlarm/5200Q64908/2023,5200Q64908,,America/Phoenix
50,2023-06-30T19:33:00,,,0.0,120,Device,,RUN CAPACITY LIMITED-HIGH CONDENSER PRESSURE,Jun 30 2023  7:33PM,False,True,True,,,,,,,ALARM_02,CH_ALARM_02,,,,AlertAlarm/5200Q64908/2023,5200Q64908,,America/Phoenix
51,2023-06-30T19:33:00,,,0.0,151,Device,,CONDENSER PRESSURE ALERT-PUMP RELAY ENERGIZED,Jun 30 2023  7:33PM,False,True,True,,,,,,,ALARM_03,CH_ALARM_03,,,,AlertAlarm/5200Q64908/2023,5200Q64908,,America/Phoenix
52,2023-07-06T17:12:00,https://alarmssaveandnotifyprod.blob.core.windows.net/snapshot/vu207150371310_2/2023/7/6/21/59/VU207150371310_2_1688663570,,0.0,206,Device,,PROTECTIVE LIMIT-STARTER FAULT ,Jul  6 2023  5:12PM,True,False,False,,,,,,,ALARM_01,CH_ALARM_01,,,,AlertAlarm/5200Q64908/2023,5200Q64908,,America/Phoenix
53,,,,,3,Device,,,7/6/2023 10:16:51 AM -07:00,True,False,False,1.0,,,,,,SYS_ALM,SystemAlertAlarm,,,,AlertAlarm/5200Q64908/2023,5200Q64908,,America/Phoenix
54,2023-07-06T17:31:00,,,0.0,3,Device,,System Alert Alarm,Jul  6 2023  5:31PM,False,False,True,,,,,,,SYS_ALM,SystemAlertAlarm,,,,AlertAlarm/5200Q64908/2023,5200Q64908,,America/Phoenix
55,2023-07-06T17:31:00,,,0.0,206,Device,,PROTECTIVE LIMIT-STARTER FAULT ,Jul  6 2023  5:31PM,True,False,True,,,,,,,ALARM_01,CH_ALARM_01,,,,AlertAlarm/5200Q64908/2023,5200Q64908,,America/Phoenix
56,2023-07-15T17:12:00,https://alarmssaveandnotifyprod.blob.core.windows.net/snapshot/vu207150371310_2/2023/7/15/17/12/VU207150371310_2_1689441150,,0.0,238,Device,,PROTECTIVE LIMIT-EXCESSIVE COMPR SURGE,Jul 15 2023  5:12PM,True,False,False,,,,,,,ALARM_01,CH_ALARM_01,,,,AlertAlarm/5200Q64908/2023,5200Q64908,,America/Phoenix
57,,,,,3,Device,,,7/15/2023 10:13:48 AM -07:00,True,False,False,1.0,,,,,,SYS_ALM,SystemAlertAlarm,,,,AlertAlarm/5200Q64908/2023,5200Q64908,,America/Phoenix
58,,,,,1,Device,,,7/15/2023 10:18:48 AM -07:00,True,False,False,0.0,,,,,,ALM,CH_ALARMRELAY,,,,AlertAlarm/5200Q64908/2023,5200Q64908,,America/Phoenix
59,2023-07-15T18:03:00,,,0.0,1,Device,,Alarm Relay,Jul 15 2023  6:03PM,False,False,True,,,,,,,ALM,CH_ALARMRELAY,,,,AlertAlarm/5200Q64908/2023,5200Q64908,,America/Phoenix
60,2023-07-15T18:03:00,,,0.0,3,Device,,System Alert Alarm,Jul 15 2023  6:03PM,False,False,True,,,,,,,SYS_ALM,SystemAlertAlarm,,,,AlertAlarm/5200Q64908/2023,5200Q64908,,America/Phoenix
61,2023-07-15T18:03:00,,,0.0,238,Device,,PROTECTIVE LIMIT-EXCESSIVE COMPR SURGE,Jul 15 2023  6:03PM,True,False,True,,,,,,,ALARM_01,CH_ALARM_01,,,,AlertAlarm/5200Q64908/2023,5200Q64908,,America/Phoenix
62,,,,,1,Device,,,7/15/2023 11:18:49 AM -07:00,True,False,False,0.0,,,,,,ALM,CH_ALARMRELAY,,,,AlertAlarm/5200Q64908/2023,5200Q64908,,America/Phoenix
63,2023-07-15T18:53:00,,,0.0,1,Device,,Alarm Relay,Jul 15 2023  6:53PM,False,False,True,,,,,,,ALM,CH_ALARMRELAY,,,,AlertAlarm/5200Q64908/2023,5200Q64908,,America/Phoenix
64,2023-07-15T18:56:00,https://alarmssaveandnotifyprod.blob.core.windows.net/snapshot/vu207150371310_2/2023/7/15/18/57/VU207150371310_2_1689447419,,0.0,163,Device,,SENSOR ALERT-CONDENSER APPROACH,Jul 15 2023  6:56PM,False,True,False,,,,,,,ALARM_01,CH_ALARM_01,,,,AlertAlarm/5200Q64908/2023,5200Q64908,,America/Phoenix
65,,,,,2,Device,,,7/15/2023 11:58:49 AM -07:00,False,True,False,1.0,,,,,,SYS_ALM,SystemAlertAlarm,,,,AlertAlarm/5200Q64908/2023,5200Q64908,,America/Phoenix
66,2023-07-15T19:03:00,,,0.0,2,Device,,System Alert Alarm,Jul 15 2023  7:03PM,False,False,True,,,,,,,SYS_ALM,SystemAlertAlarm,,,,AlertAlarm/5200Q64908/2023,5200Q64908,,America/Phoenix
67,2023-07-15T19:03:00,,,0.0,163,Device,,SENSOR ALERT-CONDENSER APPROACH,Jul 15 2023  7:03PM,False,True,True,,,,,,,ALARM_01,CH_ALARM_01,,,,AlertAlarm/5200Q64908/2023,5200Q64908,,America/Phoenix
68,2023-08-31T04:38:00,https://alarmssaveandnotifyprod.blob.core.windows.net/snapshot/vu207150371310_2/2023/8/31/4/38/VU207150371310_2_1693456725,,0.0,206,Device,,PROTECTIVE LIMIT-STARTER FAULT ,Aug 31 2023  4:38AM,True,False,False,,,,,,,ALARM_01,CH_ALARM_01,,,,AlertAlarm/5200Q64908/2023,5200Q64908,,America/Phoenix
69,,,,,3,Device,,,8/30/2023 9:40:10 PM -07:00,True,False,False,1.0,,,,,,SYS_ALM,SystemAlertAlarm,,,,AlertAlarm/5200Q64908/2023,5200Q64908,,America/Phoenix
70,,,,,1,Device,,,8/30/2023 9:50:10 PM -07:00,True,False,False,0.0,,,,,,ALM,CH_ALARMRELAY,,,,AlertAlarm/5200Q64908/2023,5200Q64908,,America/Phoenix
71,2023-08-31T10:35:00,,,0.0,1,Device,,Alarm Relay,Aug 31 2023 10:35AM,False,False,True,,,,,,,ALM,CH_ALARMRELAY,,,,AlertAlarm/5200Q64908/2023,5200Q64908,,America/Phoenix
72,2023-08-31T10:35:00,,,0.0,3,Device,,System Alert Alarm,Aug 31 2023 10:35AM,False,False,True,,,,,,,SYS_ALM,SystemAlertAlarm,,,,AlertAlarm/5200Q64908/2023,5200Q64908,,America/Phoenix
73,2023-08-31T10:35:00,,,0.0,206,Device,,PROTECTIVE LIMIT-STARTER FAULT ,Aug 31 2023 10:35AM,True,False,True,,,,,,,ALARM_01,CH_ALARM_01,,,,AlertAlarm/5200Q64908/2023,5200Q64908,,America/Phoenix
74,,,,,1,Device,,,8/31/2023 3:50:13 AM -07:00,True,False,False,0.0,,,,,,ALM,CH_ALARMRELAY,,,,AlertAlarm/5200Q64908/2023,5200Q64908,,America/Phoenix
75,2023-08-31T14:35:00,,,0.0,1,Device,,Alarm Relay,Aug 31 2023  2:35PM,False,False,True,,,,,,,ALM,CH_ALARMRELAY,,,,AlertAlarm/5200Q64908/2023,5200Q64908,,America/Phoenix
76,2023-10-30T16:01:00,https://alarmssaveandnotifyprod.blob.core.windows.net/snapshot/vu207150371310_2/2023/10/30/16/1/VU207150371310_2_1698681692,,0.0,123,Device,,RUN CAPACITY LIMITED-HIGH COMPRESSOR LIFT ,Oct 30 2023  4:01PM,False,True,False,,,,,,,ALARM_01,CH_ALARM_01,,,,AlertAlarm/5200Q64908/2023,5200Q64908,,America/Phoenix
77,,,,,2,Device,,,10/30/2023 9:05:40 AM -07:00,False,True,False,1.0,,,,,,SYS_ALM,SystemAlertAlarm,,,,AlertAlarm/5200Q64908/2023,5200Q64908,,America/Phoenix
78,2023-10-30T16:20:00,,,0.0,2,Device,,System Alert Alarm,Oct 30 2023  4:20PM,False,False,True,,,,,,,SYS_ALM,SystemAlertAlarm,,,,AlertAlarm/5200Q64908/2023,5200Q64908,,America/Phoenix
79,2023-10-30T16:20:00,,,0.0,123,Device,,RUN CAPACITY LIMITED-HIGH COMPRESSOR LIFT ,Oct 30 2023  4:20PM,False,True,True,,,,,,,ALARM_01,CH_ALARM_01,,,,AlertAlarm/5200Q64908/2023,5200Q64908,,America/Phoenix
80,2023-11-01T22:23:00,https://alarmssaveandnotifyprod.blob.core.windows.net/snapshot/vu207150371310_2/2023/11/1/22/23/VU207150371310_2_1698877425,,0.0,123,Device,,RUN CAPACITY LIMITED-HIGH COMPRESSOR LIFT ,Nov  1 2023 10:23PM,False,True,False,,,,,,,ALARM_01,CH_ALARM_01,,,,AlertAlarm/5200Q64908/2023,5200Q64908,,America/Phoenix
81,,,,,2,Device,,,11/1/2023 3:28:03 PM -07:00,False,True,False,1.0,,,,,,SYS_ALM,SystemAlertAlarm,,,,AlertAlarm/5200Q64908/2023,5200Q64908,,America/Phoenix
82,2023-11-01T22:43:00,,,0.0,2,Device,,System Alert Alarm,Nov  1 2023 10:43PM,False,False,True,,,,,,,SYS_ALM,SystemAlertAlarm,,,,AlertAlarm/5200Q64908/2023,5200Q64908,,America/Phoenix
83,2023-11-01T22:43:00,,,0.0,123,Device,,RUN CAPACITY LIMITED-HIGH COMPRESSOR LIFT ,Nov  1 2023 10:43PM,False,True,True,,,,,,,ALARM_01,CH_ALARM_01,,,,AlertAlarm/5200Q64908/2023,5200Q64908,,America/Phoenix
84,2023-11-11T08:36:00,https://alarmssaveandnotifyprod.blob.core.windows.net/snapshot/vu207150371310_2/2023/11/11/8/36/VU207150371310_2_1699691779,,0.0,206,Device,,PROTECTIVE LIMIT-STARTER FAULT ,Nov 11 2023  8:36AM,True,False,False,,,,,,,ALARM_01,CH_ALARM_01,,,,AlertAlarm/5200Q64908/2023,5200Q64908,,America/Phoenix
85,,,,,3,Device,,,11/11/2023 1:40:01 AM -07:00,True,False,False,1.0,,,,,,SYS_ALM,SystemAlertAlarm,,,,AlertAlarm/5200Q64908/2023,5200Q64908,,America/Phoenix
86,,,,,1,Device,,,11/11/2023 1:50:01 AM -07:00,True,False,False,0.0,,,,,,ALM,CH_ALARMRELAY,,,,AlertAlarm/5200Q64908/2023,5200Q64908,,America/Phoenix
87,2023-11-11T12:35:00,,,0.0,1,Device,,Alarm Relay,Nov 11 2023 12:35PM,False,False,True,,,,,,,ALM,CH_ALARMRELAY,,,,AlertAlarm/5200Q64908/2023,5200Q64908,,America/Phoenix
88,2023-11-11T12:35:00,,,0.0,3,Device,,System Alert Alarm,Nov 11 2023 12:35PM,False,False,True,,,,,,,SYS_ALM,SystemAlertAlarm,,,,AlertAlarm/5200Q64908/2023,5200Q64908,,America/Phoenix
89,2023-11-11T12:35:00,,,0.0,206,Device,,PROTECTIVE LIMIT-STARTER FAULT ,Nov 11 2023 12:35PM,True,False,True,,,,,,,ALARM_01,CH_ALARM_01,,,,AlertAlarm/5200Q64908/2023,5200Q64908,,America/Phoenix
90,2023-12-14T16:19:00,https://alarmssaveandnotifyprod.blob.core.windows.net/snapshot/vu207150371310_2/2023/12/14/16/19/VU207150371310_2_1702570780,,0.0,122,Device,,RUN CAPACITY LIMITED-LOW EVAP REFRIG TEMP,Dec 14 2023  4:19PM,False,True,False,,,,,,,ALARM_01,CH_ALARM_01,,,,AlertAlarm/5200Q64908/2023,5200Q64908,,America/Phoenix
91,2023-12-15T22:42:00,,,0.0,122,Device,,RUN CAPACITY LIMITED-LOW EVAP REFRIG TEMP,Dec 15 2023 10:42PM,False,True,True,,,,,,,ALARM_01,CH_ALARM_01,,,,AlertAlarm/5200Q64908/2023,5200Q64908,,America/Phoenix
92,2023-12-15T22:42:00,https://alarmssaveandnotifyprod.blob.core.windows.net/snapshot/vu207150371310_2/2023/12/15/22/42/VU207150371310_2_1702680156,,0.0,123,Device,,RUN CAPACITY LIMITED-HIGH COMPRESSOR LIFT ,Dec 15 2023 10:42PM,False,True,False,,,,,,,ALARM_01,CH_ALARM_01,,,,AlertAlarm/5200Q64908/2023,5200Q64908,,America/Phoenix
93,,,,,2,Device,,,12/15/2023 3:52:19 PM -07:00,False,True,False,1.0,,,,,,SYS_ALM,SystemAlertAlarm,,,,AlertAlarm/5200Q64908/2023,5200Q64908,,America/Phoenix
94,2023-12-15T23:07:00,,,0.0,2,Device,,System Alert Alarm,Dec 15 2023 11:07PM,False,False,True,,,,,,,SYS_ALM,SystemAlertAlarm,,,,AlertAlarm/5200Q64908/2023,5200Q64908,,America/Phoenix
95,2023-12-15T23:07:00,,,0.0,123,Device,,RUN CAPACITY LIMITED-HIGH COMPRESSOR LIFT ,Dec 15 2023 11:07PM,False,True,True,,,,,,,ALARM_01,CH_ALARM_01,,,,AlertAlarm/5200Q64908/2023,5200Q64908,,America/Phoenix
96,,,,,3,Device,,,12/15/2023 4:12:19 PM -07:00,True,False,False,1.0,,,,,,SYS_ALM,SystemAlertAlarm,,,,AlertAlarm/5200Q64908/2023,5200Q64908,,America/Phoenix
97,2023-12-15T23:22:00,,,0.0,3,Device,,System Alert Alarm,Dec 15 2023 11:22PM,False,False,True,,,,,,,SYS_ALM,SystemAlertAlarm,,,,AlertAlarm/5200Q64908/2023,5200Q64908,,America/Phoenix
98,2023-12-20T07:33:00,https://alarmssaveandnotifyprod.blob.core.windows.net/snapshot/vu207150371310_2/2023/12/20/7/33/VU207150371310_2_1703057617,,0.0,230,Device,,PROTECTIVE LIMIT-LOW CONDENSER WATER FLOW,Dec 20 2023  7:33AM,True,False,False,,,,,,,ALARM_01,CH_ALARM_01,,,,AlertAlarm/5200Q64908/2023,5200Q64908,,America/Phoenix
99,,,,,3,Device,,,12/20/2023 12:38:01 AM -07:00,True,False,False,1.0,,,,,,SYS_ALM,SystemAlertAlarm,,,,AlertAlarm/5200Q64908/2023,5200Q64908,,America/Phoenix
100,2023-12-20T08:48:00,,,0.0,3,Device,,System Alert Alarm,Dec 20 2023  8:48AM,False,False,True,,,,,,,SYS_ALM,SystemAlertAlarm,,,,AlertAlarm/5200Q64908/2023,5200Q64908,,America/Phoenix
101,2023-12-20T08:48:00,,,0.0,230,Device,,PROTECTIVE LIMIT-LOW CONDENSER WATER FLOW,Dec 20 2023  8:48AM,True,False,True,,,,,,,ALARM_01,CH_ALARM_01,,,,AlertAlarm/5200Q64908/2023,5200Q64908,,America/Phoenix
102,,,,,1,Device,,,12/20/2023 2:03:01 AM -07:00,True,False,False,0.0,,,,,,ALM,CH_ALARMRELAY,,,,AlertAlarm/5200Q64908/2023,5200Q64908,,America/Phoenix
103,2023-12-20T09:33:00,,,0.0,1,Device,,Alarm Relay,Dec 20 2023  9:33AM,False,False,True,,,,,,,ALM,CH_ALARMRELAY,,,,AlertAlarm/5200Q64908/2023,5200Q64908,,America/Phoenix
104,2023-12-20T09:49:00,https://alarmssaveandnotifyprod.blob.core.windows.net/snapshot/vu207150371310_2/2023/12/20/9/49/VU207150371310_2_1703065750,,0.0,163,Device,,SENSOR ALERT-CONDENSER APPROACH,Dec 20 2023  9:49AM,False,True,False,,,,,,,ALARM_01,CH_ALARM_01,,,,AlertAlarm/5200Q64908/2023,5200Q64908,,America/Phoenix
0,2024-01-03T19:04:00,,,0.0,163,Device,,SENSOR ALERT-CONDENSER APPROACH,Jan  3 2024  7:04PM,False,True,True,,,,,,,ALARM_01,CH_ALARM_01,,,,AlertAlarm/5200Q64908/2024,5200Q64908,,America/Phoenix
1,2024-01-03T19:04:00,https://alarmssaveandnotifyprod.blob.core.windows.net/snapshot/vu207150371310_2/2024/1/3/19/4/VU207150371310_2_1704308677,,0.0,122,Device,,RUN CAPACITY LIMITED-LOW EVAP REFRIG TEMP,Jan  3 2024  7:04PM,False,True,False,,,,,,,ALARM_01,CH_ALARM_01,,,,AlertAlarm/5200Q64908/2024,5200Q64908,,America/Phoenix
